reut2-019.sgm, EYSKENS WANTS 102.1 BILLION FRANC BELGIAN TAX CUTS, Finance Minister Mark Eyskens isproposing a package of personal income tax cuts worth 102.1billion francs that would apply from 1989, a finance ministryspokesman said.    The package, one of 11 possible tax reform scenarios drawnup by government officials, is expected to be discussed byministers in the coming weeks so that a government draft can bepresented to parliament in October.    The proposals, which would greatly simplify the country'stax system, include a cut in withholding tax on investmentincome earned in Belgium to 20 pct from the current 25 pct.    The reduction would apply to income from risk capital, butthe spokesman said this was likely to be defined to include allshares and bonds.    The package chosen by Eyskens is more favourable tofamilies with children than the present regime and would treatspouses' incomes separately instead of combining them, apractice that is widely seen as discouraging marriage. The taxreform does not encompass corporate taxation.    The spokesman said some 75 pct of the cost of the packagewould be financed by changes to the 258 tax allowancescurrently granted to diverse interest groups.    A further 14 pct would be met by higher tax revenuesresulting from the overall macro-economic benefits of thepackage.    This would leave a shortfall of around 20 billion francs,which the government would have to decide how to cover, eitherby raising indirect taxes or by making further budgetary cuts.    The package favoured by Eyskens, who has described Belgiumas a "fiscal Himalaya," is the least costly of the 11 scenariosprepared. It envisages three marginal rates, or tax thresholds,of 30 pct, 40 pct and 50 pct. This compares with 13 currently,of which the highest is 71.6 pct. REUTER&#3;
reut2-019.sgm, &lt;INTERNATIONAL DESIGN GROUP INC> TO OFFER RIGHTS, International Design Group incsaid holders of record on June 26 will receive rights topurchase two units at 10 cts each for each common share held.    Each unit consists of one common share and one five-yearwarrant to buy one common share at 15.625 dlrs. Reuter&#3;
reut2-019.sgm, NVHOMES LP &lt;NVH> SETS LOWER DIV, Qtly div 20 cts vs 21 cts prior    Pay July 31    Record July 1    NOTE: Partnership does not pay at regular rate. Reuter&#3;
reut2-019.sgm, U.S. COURT UPHOLDS APEX DECISION FAVORING NYMEX, The U.S. Court of Appeals for theSecond Circuit upheld a lower court decision dismissing a suitby Apex Oil Co against the New York Mercantile Exchange andseveral oil companies.    The Court, however, ruled that Apex Oil could pursueanititrust and commodities market manipulation allegationsagainst Belcher Oil Co, a unit of Coastal Corp &lt;CGP>.    Apex Oil, primarily a trading company, charged that severalcompanies, including Belcher, and NYMEX conspired to force itto deliver heating oil it had sold on the mercantile exchange,knowing Apex could not make full delivery.       The NYMEX ordered Apex to deliver four mln barrels ofheating oil sold via a February 1982 heating oil contract. Apexeventually fulfilled this obligation but claimed damages.    Richard Wiener, attorney for Apex at Cadwalader Wickershamand Taft, said the company has not yet decided whether topursue its case against Belcher Oil.    The NYMEX, meanwhile, has a counterclaim pending againstApex Oil, seeking an unspecified amount of attorney's fees and15 mln dlrs in punitive damages, according to a NYMEXspokeswoman. Reuter&#3;
reut2-019.sgm, TRIBUNE CO TO ISSUE UP TO 100 MLN DLRS IN MEDIUM TERMNOTES, 
reut2-019.sgm, CANADA POST WORKERS REJECT LATEST OFFER, Canadian letter carriers today rejected anew contract offer from Canada Post as the strike spread toToronto where half the nation's mail is sorted.    The Letter Carriers Union said the new offer presented June18 contained the same demands for concessions the union hadalready refused.    The union members walked out in other Ontario cities todaybut returned to work in Atlantic Canada, parts of Quebec,Edmonton, and Victoria. Negotiators were scheduled to resumebargaining today but were not expected to reach an agreement toend the four-day-old strike. Reuter&#3;
reut2-019.sgm, SPANISH PRIVATE BANK WORKERS STRIKE, Most private banks in central Madrid andBarcelona closed as Spanish bank staff went on strike for morepay, union officials and employers said.    Union officials said there was at least partial response tothe strike call in the rest of Spain. But a spokesman for theemployers' Banks Association said banks in many towns wereworking almost normally.    Unions called the strike today and tomorrow morning topress for shorter working hours and an eight pct pay increase.Employers offered a 4.75 pct wage increase last month. REUTER&#3;
reut2-019.sgm, AMERICAN FEDERAL SAVINGS &lt;AFSL.O> SEES PRESSURE, American Federal Savings and LoansAssociation of Colorado said its earnings will continue to beunder pressure this year due to the weakness of the Coloradoeconomy.    The company, which today declared a regular quarterlydividend, said it was also under pressure from the level ofnon-earning assets it holds.    The company said this pressure will be offset to a certainextent by increased revenues from out-of-state operations andits strong capital position. Reuter&#3;
reut2-019.sgm, DAXOR &lt;DAXR.O> IN FEDERAL EXPRESS &lt;FDX> DEAL, Daxor Corp said it has received anoffer from Federal Express Corp to establish a national frozenblood bank at Federal's Memphis, Tenn., headquarters.    The company said its blood could be shipped anywhere in theU.S. within six hours from Memphis via Federal Express'delivery system. Reuter&#3;
reut2-019.sgm, FED SETS SIX-DAY SYSTEM REPURCHASES, FED SAYS, 
reut2-019.sgm, CANON &lt;CANNY.O> OPENS VIRGINIA FACILITY, Canon Inc of Japan said Canonof Virginia Inc has opened a 26 mln dlr 289,000 square footplant in Newport News, Va.    The company said the plant will initially make 700 to 1,000Canon dual-color copiers a month, and other business equipmentlines including laser beam printers and electronic typewritersmay be phased in later. Reuter&#3;
reut2-019.sgm, DIGICON &lt;DGC> STARTS EXCHANGE OFFER FOR DEBT, Digicon Inc said it started an offer toexchange a package of new securities for all 55,019,000 dlrs ofits outstanding subordinated debentures.    The exchange includes its 12-7/8 pct senior subordinatednotes, 10-1/2 pct convertible subordinated debentures and the8-1/2 pct convertible subordinated debentures of DigiconFinance N.V.    It said the new securities to be issued in exchange offersinclude up to 8,574,000 dlrs of Digicon's 12 pct seniorsubordinated notes due 1994, up to 23,580,000 dlrs of Digicon9.35 pct convertible subordinated debentures due 1997 and up to16,506,000 shares of Digicon common.    Digicon said in addition to the new notes, new debenturesand common stock, it also will issue to exchangeing holders upto 22,865,000 dlrs of contingently extinguishable debtcertificates.    It said the exchange offers are being made only byprospectus. Reuter&#3;
reut2-019.sgm, GTE &lt;GTE> DEVELOPS METHOD FOR MAKING TRANSISTORS, GTE Corp scientists said theyhave discoverd a much simpler method for producing transistorsby creating an entirely new electronic material.    The new method, they said, consists of simultaneously"growing" metal connections and silicon crystals together toform one, three dimensional device with connections penetratingthe entire device.    Conventional transistors require many steps to make andhave connections only on the surface.    GTE Laboratories created "an entirely new electronicmaterial and device form, which may open up a spectrum of usesthat cannot even be imagined at this time," said David Decker,vice president and director of research for GTE Laboratories.    "Although still early in our research, we are obviouslyexcited that we have found a significantly simpler and, webelieve, cheaper way to produce an electronic device," he said.    Researchers at GTE created the new transistor by combiningand heating silicon and a conductive metal, tantalumdisilicide, so that the two grow together.    The resulting device has microscopic metal rods extendingthrougout the chips, creating a three dimensional transistorthat should be superior to standard devics in high powerapplications, the scientists said.    They said that, because the connections extend verticallythrougout the new device, it has a much greater volume ofactive material than conventional surface-mounted connections.    Decker said the scientists are still in the early stages oftheir research on the device, but prototypes of the new devicecompare favorably with conventionaly made transistors and showpromise of superior performance.    He said the prototype device also proved to be particularlyefficient in detecting light, which could open up newpossibilities in solar energy conversion, the development ofelectronic cameras and greater efficiency in opticalcommunication systems. REUTER&#3;
reut2-019.sgm, DAXOR &lt;DAXR.O> IN FEDERAL EXPRESS &lt;FDX> DEAL, Daxor Corp said it has received anoffer from Federal Express Corp to establish a national frozenblood bank at Federal's Memphis, Tenn., Headquarters.    The company said its blood could be shipped anywhere in theU.S. Within six hours from Memphis via Federal Express'delivery system. REUTER&#3;
reut2-019.sgm, SMITHKLINE &lt;SKB> SAYS BAUSCH &lt;BOL> RECALL SET, Allergan Inc, a subsidiary ofSmithkline Beckman Corp, said the U.S. District Court in NewYork has ordered Bausch and Lomb Inc to immediately recall fromretail shelves all soft contact lens solutions sold under the"HYPO-CARE" name and cease any further distribution.    The company said the court found that HYPO-CARE was tooclose to Allergan's trademark "HYDROCARE" to prevent publicconfusion. Reuter&#3;
reut2-019.sgm, , 
reut2-019.sgm, THE HYDRAULIC CO &lt;THC> FILES FOR OFFERING, The Hydraulic Co said it filedfor a proposed public offering of 500,000 shares of commonstock through an underwriting group co-managed by SalomonBrothers Inc and Edward D. Jones and Co.    The company said proceeds will be used to repay certainshort-term debt. Reuter&#3;
reut2-019.sgm, FED SETS SIX-DAY SYSTEM REPURCHASES, The Federal Reserve entered thegovernment securities market to arrange six-day repurchaseagreements for system account, a spokeswoman for the New YorkFed said.    Fed funds were trading at 6-3/4 pct at the time of thedirect injection of temporary reserves, dealers said.    Economists had expected three- or six-day repurchasesbecause the Fed needs to add a large volume of reserves thisstatement period. Reuter&#3;
reut2-019.sgm, RHINE BLOCKED FOR THREE MORE WEEKS - SALVAGER, Dutch salvage firm Smit-Tak said itmay take some three weeks to lift the Swiss tug Orinoko and itslighter Pavo which sank 10 days ago at Karlsruhe in WestGermany, blocking the Rhine river.    Smit-Tak, which with its West German subsidiary HarmsBergung GmbH was commissioned by the local water authorities toraise the vessels, said its lifting fleet was in position anddivers had made the first inspection.    Smit is still preparing its final salvage plan and said thework would begin on Sunday. Reuter&#3;
reut2-019.sgm, TRIBUNE &lt;TRB> TO ISSUE 100 MLN DLRS IN NOTES, Tribune Co said it will offer up to 100mln dlrs of medium-term notes.    The notes will be offered on a continuing basis throughSalomon Brothers Inc and Merrill Lynch Capital Markets.    The notes may have maturities of nine months to 15 years.Specific terms of each transaction will be established at thetime of sale, the company said.    Proceeds will be used for general corporate purposes. Reuter&#3;
reut2-019.sgm, STIFEL FINANCIAL SAID IT RECEIVED UNSOLICITED MERGERPROPOSAL, 
reut2-019.sgm, HARCOURT &lt;HBJ> MUM ON REED &lt;REED.L> RUMORS, Harcourt Brace Jovanovich Inc officialswere not available for comment on market rumors that it isinterested in acquiring Reed International plc &lt;REED.L>.    Officials of First Boston Inc, Harcourt's financialadviser, declined comment.    A Wall Street arbitrageur, who owns Harcourt shares, saidthe rumors did not make much sense because Harcourt hasannounced a recapitalization plan to ward off a takeoverattempt by British publisher Robert Maxwell."It's completelyinconsistent with the recapitalization, the only way is if theydrop the recapitalization," he said.    Calls to Harcourt seeking comment were not returned.    Harcourt's recapitalization will come under scrutiny of aU.S. Court in Orlando, Fla. Monday. The company has sought adeclaratory judgment on convertibility of debentures due 2011in light of the recapitalization.    Harcourt said in a statement this week that SalomonBrothers Inc &lt;SB> and Mutual Shares Corp have intervened in thecase, claiming ownership of more than 30 mln dlrs face amountof the debenture. In addition, British Printing andCommunications Corp, headed by Maxwell, owns 9.5 mln dlrs faceamount, Harcourt said.    Salomon said in a filing with the Securities and ExchangeCommission today that it has 21,978 of the debentures. If thecourt decides they should be converted at par value of one dlr,they could be converted into 22.0 mln shares.    Harcourt is asking the court to rule the company is notrequired to issue common to debenture holders who did notconvert prior to June eight.    An increase in Reed shares in London today was attributedby brokers to rumors of Harcourt's interest and also to rumorsthat Maxwell might be a buyer. But an adviser to Maxwell in NewYork said "there's no basis to think that it's us." Reuter&#3;
reut2-019.sgm, SALOMON BROTHERS HAS HARCOURT &lt;HBJ> DEBENTURES, Salomon Brothers Inc said it hasacquired 21,978 convertible subordinated debentures of HarcourtBrace Jovanovich Inc, which it says could be converted into21,978,000 common shares.    In a filing with the Securities and Exchange Commission,the New York brokerage firm said it bought the debentures,which have a face value of 1,000 dlrs each, in May and June asa regular part of its investment and arbitrage activities.    The conversion rights of the debentures are the subject ofa Florida court case, in which Salomon Brothers said it hasalso intervened.    Salomon Brothers said it rejects Hartcourt's position thatthe debentures are not convertible into stock as of June 9.    It said it would leave open a range of options regardingthe debentures, including buying more, selling some or all oftheir current stake in the market or in negotiated deals,talking with other Harcourt security holders, surrendering thedebentures if there were a merger or tender offer or convertingthem into stock.    Salomon said it would have a 35.8 pct stake in Harcourt,based on 39.4 mln shares outstanding, if it converted thedebentures into 21,978,000 common shares. The percentage isbased on the current outstanding plus the amount of stock thatwould be issued in a conversion.    But Salomon said its stake in Harcourt's common stock wouldbe lower if other debentureholders converted their securitiesinto stock. It says it has no idea of the total number ofdebentures outstanding.    Harcourt has said that Salomon and Mutual Shares Corp, aNew York investment firm, hold a combined total of 30 mln dlrsof debentures.    Harcourt announced a recapitalization plan last month toward off a takeover attempt by British publisher RobertMaxwell.    Reuter&#3;
reut2-019.sgm, GEN DYNAMICS &lt;GD> IN CONTRACT CONSORTIUM, General Dynamics Corp said itformed an international consortium to compete for the contractrelating to the multinational air to ground missile known asthe modular standoff weapon.    The modular standoff program is an agreement between theU.S., West Germany, United Kingdom, France, Italy, Canada andSpain, to develop three versions of the air-to-ground system.    The company said the consortium includes Brunswick Corp &lt;BC>,Dornier GMBH &lt;DOGG.F> of West Germany, Hunting Engineering CoLtd of the U.K., Aerospatiale of France, Agusta of Italy,Garrett of Canada, and Inisel of Spain. Reuter&#3;
reut2-019.sgm, LLOYDS BANK SAYS IT WITHDRAWING FROM MARKET MAKING INEUROBONDS AND GILTS, 
reut2-019.sgm, S. AFRICA CITICORP STAFF CHALLENGE DISINVESTMENT, South African staff of the U.S.Bank Citicorp &lt;CCI> said they will challenge its plans to selllocal operations and withdraw from the country.    Employees said they had written to Citicorp chief executiveJohn Reed protesting against the way the disinvestment deal hasbeen handled. They said that they were not consulted on thesale of Citicorp's local subsidiary, Citibank N.A. Ltd, toSouth Africa's First National Bank &lt;BCLJ.J>.    The letter, signed by most of the bank's 175 staff, hintsat legal action against Citicorp unless it reviews thedisinvestment arrangement.    "We are seriously considering legal action," a seniorCitibank employee told Reuters. "There has been no consultationwith South African staff and that runs contrary to Americancorporate thinking in this country," he added.    Citicorp announced the 130 mln rand cash sale on Tuesdaywith an effective date of July 1.    First National Bank's managing director, Chris Ball, saidhis bank was essentially buying the skills of Citibank'sspecialist employees and disclosed that the American bank'sassets in South Africa totalled only 15 mln rand.    Ball indicated that the bank's staff had been told of thesale and agreed to stay on in the bank's employ.    Citibank's staff, 40 pct of whom are black, have complainedthat the disinvestment accord bars local employees from jobswith Citicorp anywhere in the world for five years.    They say that this provision amounts to a restraint clausewhich is legally challengeable. This could threaten thedivestment plan, say industry sources, since most of thepurchase price, as Ball said, is for employee skills andexpertise and not assets.    The Citibank employee challenge is seen as more importantthan a previous, ultimately unsuccessful, challenge on jobsecurity issues by General Motors employees after the U.S.Automaker announced its pull out, because valuable managers andother key staff are involved in protest.    The employees assert that the Citicorp sale, unlike similardisinvestment moves announced this week by &lt;Ford Motor Co> and&lt;ITT Corp>, include no portion of South African profits forlocal employees or black community projects.    "We always thought they would offer a settlement to staffhere in keeping with their image as an equal opportunityemployer," said a senior black employee, adding "We had no ideathat the age of slavery was still alive." REUTER&#3;
reut2-019.sgm, WORLD BANK LOANS INDIA 929 MLN DLRS, The World Bank said it has extendedthree loans to India totalling 929 mln dlrs, for two projectsin the power sector, and one for water supply and sewage.    One power project will be supported by a 485 mln dlr loan,the bank said.    The other power project, supported by a 375 mln dlr loan,plans to aid in the first phase of a power generation complexin eastern India, the bank said.    The third project, which is being supported by a bank loanof 53 mln dlrs and an International Development Associationloan of 16 mln dlrs, hopes to increase water supply to Madras. Reuter&#3;
