reut2-012.sgm, REPUBLIC SAVINGS AND LOAN &lt;RSLA> SETS DIVIDEND, Qtly div 30 cts vs 30 cts prior    Pay April 27    Record April 13    NOTE: Company's full name is Republic Savings and LoanAssociation of Wisconsin. Reuter&#3;
reut2-012.sgm, SHULTZ USSR TRIP FUELS TALK OF EEP WHEAT OFFER, Speculation the United States willoffer subsidized wheat to the Soviet Union appears to havereached a new level of intensity in the run-up to Secretary ofState George Shultz' visit later this month to Moscow.    Rumors of an impending deal have coursed through wheatmarkets since officials from the two countries held theircustomary, semi-annual grain talks in February. Moscow'sdecision at that time to reenter the U.S. corn marketstrengthened the perception of warming farm trade prospects.    Shultz is set to arrive in Moscow April 13.    Shultz' statement two weeks ago that he would not stand inthe way of a wheat subsidy offer under the Export EnhancementProgram, EEP, coupled with the announcement of his visit toMoscow, was interpreted by many grain trade representativeshere as a clear signal that the Reagan administration waspreparing an offer.    Administration officials -- in and out of the U.S.Agriculture Department -- have been extremely tight-lippedabout the prospects of a subsidy offer.    But USDA officials for the most part have abandoned thecontention the proposal is dormant, suggesting that an offer,while not a "done deal," is a live possibility.    Prominent U.S. grain trade representatives -- many of whomasked not to be identified -- continue to maintain that anoffer to subsidize four mln tonnes of wheat is imminent.    Others, who one month ago claimed a deal was not possible,are saying they would not rule one out.    Rep. Pat Roberts, R-Kan., yesterday went so far as topredict a subsidy offer would be made within the next ten daysto two weeks.    Aides to Roberts said he had spoken to Republican leaderswho had been in contact with administration officials.    Richard Fritz, director of international marketing at U.S.Wheat Associates, said he was confident an export enhancementoffer would be made by the middle of this month.    Fritz also said he thought the value of the bonus would endup being close to the offer Washington made Peking earlier thisyear when USDA approved subsidies to China of around 36 dlrsper tonne on one mln tonnes of wheat.    Some grain trade representatives say a four-mln-tonne wheatsubsidy offer might help stimulate more Soviet purchases ofU.S. corn and open the door to U.S. sales of soybeans.    As ever, one of the crucial sticking points in a wheat dealwould appear to be price.    Last summer the administration took the controversial stepof offering the Soviets subsidized wheat -- but wereembarrassed when Moscow spurned the proposal on the groundsthat the 15-dlr-per-tonne subsidy still left U.S. wheat pricesfar above world market prices.    The administration's decision to set the subsidy level upfront instead of accepting bids from exporters appeared to be ameans of controlling the price while attempting to dampencriticism, grain trade sources said.    Nonetheless, the pricing procedure did not prevent Shultzfrom saying the Soviets were "chortling" because Washington wasoffering Soviet housewives cheaper grain than that available toU.S. housewives.    The conventional wisdom among grain trade representativeshere is that a general warming of relations between the twocountries since last summer, combined with continued hard timesin the U.S. grain belt, would favor a subsidy offer.    In addition, the USSR has made it clear it would considerbuying U.S. wheat if it were priced more competitively.    However, observers have not forgotten the circumstancessurrounding the administration's announcement of the wheatsubsidy offer last summer.    Up until the time of the announcment, congressional andindustry leaders were led to believe the White House haddecided to expand the Export Enhancement Program to include notonly the Soviets, but also a much broader list of countries.    Instead, the administration scaled back the offer toinclude only the Soviets.    That last-minute change of heart adds a measure ofuncertainty even to the predictions of those most convincedthat the administration will not now pass up the opportunity tosell four mln tonnes of wheat to the Soviet Union. Reuter&#3;
reut2-012.sgm, KAINES CONFIRMS WHITE SUGAR SALES TO INDIA, London-based sugar operator Kaines Ltdconfirmed it sold two cargoes of white sugar to India out of anestimated overall sales total of four or five cargoes in whichother brokers participated.    The sugar, for April/May and April/June shipment, was soldat between 214 and 218 dlrs a tonne cif, it said. Reuter&#3;
reut2-012.sgm, LUXTEC &lt;LUXT> CUTS WARRANT EXERCISE PRICE, Luxtec Corp said it hasreduced the exercise price of its Class B common stock purchasewarrants to one dlr from two dlrs from today through June 30. Reuter&#3;
reut2-012.sgm, &lt;THL HOLDINGS INC> YEAR JAN 31 NET, Oper net 94.4 mln vs 74.1 mln    Revs 1.3 bilion vs 1.2 billion    NOTE: THL is parent to SCOA Industries Inc, acquired in aleveraged buyout in December 1985. Reuter&#3;
reut2-012.sgm, GUARDIAN ROYAL SEES EXPANSION IN LIFE ASSURANCE, Insurance group Guardian Royal ExchangePlc &lt;GREX.L> said it would expand its life assurance businessand push further into European markets, but that U.K.Underwriting losses remained a heavy drag on profits.    Earlier, the group had announced sharply increased pre-taxprofits of 143.8 mln stg for calendar 1986, versus 3.5 mln theprevious year.    "We are anxious to develop our life assurance business,"group managing director Peter Dugdale told a news conference."If we have a thrust for the coming years, it is probably bestto spend more time on life in the U.K. And abroad," he said. Reuter&#3;
reut2-012.sgm, MOUNTAIN STATES ADDS TWO MINERALS PROPERTIES, Mountain States Resources Corpsaid it acquired two properties to add to its strategicminerals holdings.    The acquisitions include a total of 5,100 acres oftitanium, zirconium and rare earth resources, the company said.    Both properties, located in southern Utah, consist ofapproximately 1,430 acres of unpatented mining claims and onestate lease, it said.    The company also announced the formation of Rare TechMinerals Inc, a wholly-owned subsidiary. Reuter&#3;
reut2-012.sgm, RESTORATION OF COFFEE EXPORT QUOTAS BEFORE OCTOBER SEEMS UNLIKELY - ICO PRODUCER DELEGATES, 
reut2-012.sgm, SHULTZ USSR TRIP FUELS TALK OF EEP WHEAT OFFER, Speculation the United States willoffer subsidized wheat to the Soviet Union appears to havereached a new level of intensity in the run-up to Secretary ofState George Shultz' visit later this month to Moscow.    Rumors of an impending deal have coursed through wheatmarkets since officials from the two countries held theircustomary, semi-annual grain talks in February. Moscow'sdecision at that time to reenter the U.S. corn marketstrengthened the perception of warming farm trade prospects.    Shultz is set to arrive in Moscow April 13. Reuter&#3;
reut2-012.sgm, FREDDIE MAC ADJUSTS SHORT-TERM DISCOUNT RATES, The Federal Home Loan Mortgage Corpadjusted the rates on its short-term discount notes as follows:   MATURITY   RATE       OLD RATE  MATURITY    32 days   6.00 pct   6.10 pct   1 day   Reuter&#3;
reut2-012.sgm, ICO QUOTAS BEFORE OCTOBER UNLIKELY - DELEGATES, The restoration of coffee export quotasbefore the end of the current 1986/87 coffee year (Oct 1/Sept30) now seems unlikely, given reluctance by InternationalCoffee Organization, ICO, producers and consumers to resumenegotiations on an interim quota accord, producer delegatestold reporters.    Consumers and most producers see no point in reopening thequota dialogue while Brazil's position remains unchanged, theysaid.    Brazil's refusal to accept a reduction in its previous 30pct share of the ICO's global export quota effectivelytorpedoed talks here last month aimed at restoring quotasbefore October, the delegates noted.    Disappointment at the lack of progress on quotas forcedcoffee futures in London and New York to new lows today,traders here said. Near May in New York fell below one dlr inearly trading at around 99.10 cents per pound, traders said.    Producer delegates said that while the possibility ofreimposing quotas before October remained on the ICO agenda, inpractice the idea had effectively been discarded.    The ICO's executive board session here this week has so farbarely touched on the quota debate, demonstrating generalunwillingness to revive talks while chances of success arestill remote, producer delegates said.    Some producers are in no hurry to see quotas restored,despite the price collapse seen since the failure of lastmonth's negotiations, they said.    "With Brazil's frost season approaching, who wants tonegotiate quotas," one leading producer delegate said.    Coffee prices normally rise during Brazil's frost season(mainly June-August) as dealers and roasters build up stocks asinsurance against possible severe frost damage to Brazil'scrop.    Many producers are more interested in working towardsreimposing quotas from October 1, based on a new system ofquota allocations valid until the International CoffeeAgreement expires in 1989, they said.    Guatemala has already proposed the "other oilds" producergroup should meet in the next two months to begin talks on howto allocate quota shares.    Producers still seem divided on how to overhaul the quotadistribution system, with some producer delegates reportinggrowing support for a radical reallocation, based on theprinciple of "objective criteria" favoured by consumers.    At last month's council session a splinter group of smallproducers backed consumer demands for new quota shares based onexportable production and stocks, while Brazil, Colombia andthe rest of the producers favoured leaving quota allocationsunchanged, except for some temporary adjustments.    A delegate from one of the eight said more producers nowsupported their cause.    The delegate said unless major producers like Brazil showedreadiness to negotiate new quota shares, prospects for a quotaaccord in October also looked bleak.    The U.S. and most other consumers are still determined tomake reimposition of quotas conditional on a redistribution ofquota shares based on "objective criteria."    ICO observers remained sceptical that Brazil would beprepared to accept a quota reduction when the ICO council meetsin September.    Brazil has adopted a tough stance with banks on externaldebt negotiations and is likely to be just as tough on coffee,they said.    They said Brazil's reluctance to open coffee exportregistrations might reflect fears this would provoke anotherprice slide and force an emergency ICO council session, whichwould most likely end in failure.    Producers met this afternoon to review the market situationbut had only a general discussion about how furthernegotiations should proceed, a producer delegate said.    Producers plan to hold consultations on quotas, and thenmay set a date for a formal producer meeting, but plans are notfixed, he said.    The ICO executive board reconvened at 1650 hours local timeto hear a report from consultants on ICO operations. The boardmeeting looks set to end today, a day earlier than scheduled,delegates said. Reuter&#3;
reut2-012.sgm, AMERICAN MOTORS MARCH U.S. CAR OUTPUT DOWN TO 2,578 FROM5,922, 
reut2-012.sgm, YUGOSLAVIA WINS TIME IN PARIS CLUB REFINANCING, Yugoslavia has won breathing space fromits major official creditors through yesterday's Paris Clubrefinancing agreement but it will take time for it to resolveits economic crisis, economists at western embassies said.    Yugoslav delegation chief Finance Minister SvetozarRikanovic said a refinancing was agreed for 475 mln dlrs ofdebt falling due between May 16 this year and May 31, 1988.    The agreement was the second multi-year Yugoslav debtrefinancing, based on a protocol signed last May which usheredin "enhanced monitoring" of Yugoslavia's economy by the IMF.    Western economists who follow Yugoslav financial affairssaid a similar deal would probably emerge from talks withcommercial creditors at the end of this month. But they saidthe refinancings would only provide a breathing space, becauseYugoslavia has to repay 5.5 billion dlrs in 1987.    And the country is still struggling to reverse a dramaticdecline in export earnings, which have fallen 12.5 pct so farthis year, continuing a downward spiral of the past 18 months.    The Yugoslav hard currency debt has grown from 1.2 billiondlrs in 1965 to stand at 19.7 billion dlrs at the end of 1986and is one of the country's most dire economic problems.    The debt began to snowball in the 1960s and 1970s due to anexcessive investment rate exceeding the growth of the GrossSocial Product and necessitating additional foreign borrowing.    Rising international oil prices in the 1970s proved to be aserious blow to the country's balance of payments.    Deputy Prime Minister Milos Milosavljevic said this monththat Yugoslavia had repaid 640 mln dlrs of principal and 325mln dlrs of interest so far this year.    According to official Yugoslav figures, Yugoslavia repaid arecord 5.97 billion dlrs in capital and interest in 1986,reducing overall indebtedness by 996 mln dlrs.    Mikulic is trying to rein in rampant retail inflation ofalmost 100 pct a year through price and incomes controls.    Janez Zemljaric, also a Deputy Prime Minister, saidrecently Yugoslavia expected a "definite measure ofunderstanding" from its 16 major western creditor nations.    Western economists said Yugoslavia has had its way with theParis Club creditors but that not all creditors were satisfiedwith its economic performance last year. They said the Parisdiscussions were heated and emotional.    "Economic factors were balanced by political realities," aneconomist at one of the main embassies here said, but addedthat creditors had no complaints regarding Yugoslavia'srepayment record because it had so far always repaid debts ontime.    Yugoslavia has refinanced its debt regularly since 1983.    In December 1985, it signed a deal with the InternationalCoordinating Committee of 600 commercial banks to refinancematurities arising between January 1, 1985 and end-1988.    It had signed bilateral refinancing agreements in March ofthat year for maturities arising from January 1, 1985 to March25, 1986, following an agreement in Paris on March 25, 1985.    Government ministers told Reuters this month thatYugoslavia had made too great an effort to repay its debts in1986, at great cost to the economy, and that this wasregretted.    Mikulic has said Yugoslavia is unlikely to follow Brazil'slead and suspend its debt repayments "but we have understandingfor what that country did."    Western economists said, however, that Mikulic's remarks,taken with those of his ministers, could be a signal that someproblems were seen ahead in refinancing debt repayments.    Before the Paris talks, some Yugoslav officials had hintedthat Yugoslavia could start to look to the Soviet Bloc forfinancial support if Belgrade failed to secure the necessaryrefinancing from western creditors.    Sources close to the western creditors, however, said theydid not view the threat as serious. REUTER&#3;
reut2-012.sgm, (GEOFFRION LECLERC INC) SIX MTHS NET, Shr 39 cts vs 26 cts    Net 3,466,000 vs 1,913,000    Revs 27.7 mln vs 19.4 mln    Note: period ended February 28. REUTER Reuter&#3;
reut2-012.sgm, ALLIED SUPERMARKETS &lt;ASU> FILES FOR OFFERING , Allied Supermarkets Inc said it filedwith the Securities and Exchange Commission a registrationstatement covering 240 mln dlrs of debt securities.    The company plans to offer 140 mln dlrs of seniorsubordinated discount debentures and 100 mln dlrs ofsubordinated debentures.    Proceeds will be used to finance Allied's acquisition ofVons Cos Inc.    Allied named Drexel Burnham Lambert Inc and Donaldson,Lufkin and Jenrette Securities Corp as co-underwriters of bothofferings. Reuter&#3;
reut2-012.sgm, FHLBB CHANGES SHORT-TERM DISCOUNT NOTE RATES, The Federal Home Loan Bank Boardadjusted the rates on its short-term discount notes as follows:    MATURITY   NEW RATE  OLD RATE  MATURITY                         5.00 pct    30-69 days                         5.92 pct    70-88 days  30-123 days  5.00 pct  5.00 pct   89-123 days 124-150 days  5.93 pct  5.93 pct  124-150 days 151-349 days  5.00 pct  5.00 pct  151-349 days 350-360 days  5.98 pct  5.98 pct  350-360 days Reuter&#3;
reut2-012.sgm, TOWLE MANUFACTURING CO &lt;QTOW> YEAR LOSS, Oper shr loss 4.71 dlrs vs loss 14.09 dlrs    Oper loss 22 mln vs loss 67.2 mln    NOTE: 1986 loss excludes gain on the sale of Gold LanceCorp of 12.1 mln dlrs. Company is operating under chapter 11. Reuter&#3;
reut2-012.sgm, DELTA AIR LINES COMPLETES ACQUISITION OF WESTERN AIR, 
reut2-012.sgm, TREASURY'S BAKER SAYS HE HOPES PRIME RATE INCREASESTEMPORARY, 
reut2-012.sgm, NEW MONTREAL NEWSPAPER FOLDS, Le Matin, the French-language tabloidlaunched here in February, said it is shutting down itsoperations because it can no longer get financing.    The paper, launched by private investors, was Montreal'sfourth French-language newspaper and was aimed at readers withabove average incomes and educations. It had a dailycirculation of about 20,000 copies.    Le Matin was printed and distributed by (Southam Inc)'sMontreal Gazette newspaper. A Gazette spokesman said hisnewspaper is Le Matin's biggest creditor but he declined toreveal the amount of debt    Acting publisher Jean-Pierre Bordua said the newspaper'sbank blocked its lines of credit after three of the paper'ssenior managers resigned Friday. Reuter&#3;
reut2-012.sgm, TOWLE &lt;QTOW> STOCK MAY BE DILUTED, CANCELED, Towle Manufacturing Co, in Chapter11 of the U.S. bankruptcy code, said any plan of reorganizationwould likely lead to a dilution or cancellation of its commonand preferred stock.    The company also said claims for subordinated debentureswould likely be paid at less than their 100 pct of their facevalue, and general unsecured claims would likely be paidwithout interest. The company has not yet filed a plan ofreorganization.    The company said it lost 22 mln dlrs from operations in1986 against a loss of 67.2 mln dlrs a year ago.    The company also said its independent accountantsdisclaimed an opinion on the financial statements for 1986because of questions about its contination as a going concern.    The company said, however, it substantially restructuredits business, reducing borrowings on an outstanding credit lineto 16.5 mln dlrs in 1986 from 57 mln dlrs a year ago. Thecompany also cut its staff to 820 employees at the end of 1986from 2,500 a year earlier. Reuter&#3;
reut2-012.sgm, SOUTH ATLANTIC FINANCIAL CORP &lt;SOAF> 4TH QTR, Shr 12 cts vs 33 cts    Net 699,037 vs 1,349,077    Year    Shr 54 cts vs 55 cts    Net 2,748,280 vs 1,833,766    NOTE: Per shr amounts reported after preferred stockdividend requirements. Reuter&#3;
reut2-012.sgm, AMERICAN MOTORS &lt;AMO> MARCH OUTPUT FALLS, American Motors Corp said itproduced 2,578 U.S. cars in March, down from 5,922 in the same1986 month.    The automaker's March U.S. Jeep output was 21,390, up from16,215 in the same month last year.    Year-to-date U.S. car production by American Motors throughthe end of March was 8,647 vehicles compared to 12,553 in thesame 1986 period. Year-to-date Jeep output was 58,597 comparedto 56,801.                                      Reuter&#3;
reut2-012.sgm, CYPRUS LOWERS COPPER PRICE 1.25 CTS TO 67 CTS, Cyprus Minerals Company said it isdecreasing its electrolytic copper cathode price by 1.25 centsto 67.0 cents a pound, effective immediately. Reuter&#3;
reut2-012.sgm, TOSHIBA COULD BE FIRST TO FEEL U.K. TRADE ANGER, Toshiba Corp &lt;TSBA.T>, the Japaneseelectronics group which plans to enter Britain's liberalisedtelecommunications equipment market, risks becoming the firstcasualty in the current war of words over trade between Japanand the U.K., Government and industry sources said.    U.K. Authorities have lost patience with Japanese tradingpractices and said they are seeking ways to retaliate withoutunleashing a damaging trade war. "Toshiba's timing seems mostunfortunate for the company, as it comes exactly when we arelooking for someone to punch," one official told Reuters.    Earlier, &lt;Toshiba Information Systems (U.K.) Ltd> said itwanted to enter the British business facsimile and keytelephone market. A facsimile machine sends printed data overtelephone lines, while a key telephone system is used forswitching calls within a business, industry sources said.    The move by Toshiba comes in the middle of a dispute overJapan's refusal to open up its telecommunications market toforeign companies. "Toshiba's timing is most extraordinary," oneofficial at the Department of Trade and Industry (DTI) said.    Tomorrow, the U.K. Government will consider what legalaction it can possible take to press for Japanese reform.    Prime Minister Margaret Thatcher has given notice that theU.K. Would fight the Japanese government's attempt to preventCable and Wireless Plc &lt;CAWL.L> from taking a significantposition in a new Japanese international telecommunicationsventure. "We regard this as a test case," she told Parliament.    But while the U.K. Is keen to see some movement on theissue by Japan, it is also worried that recent anti-Japaneserhetoric may cause developments to get out of hand, officialssaid.    Japanese officials in Tokyo today reiterated that Japan hadno plans to bow to U.K. And U.S. Pressure to give foreigntelecommunications firms a bigger role there.    The government, for which competition and the deregulationof markets are major political themes, is unlikely to makefinal decisions tomorrow on how to act against Japan, officialssaid.    Detailed consideration of the issue has been shelved duringThatcher's official visit to the Soviet Union, which endstoday.    "We are waiting for the Prime Minister to decide what to do.The DTI will pass the ball to her as soon as she returnstonight," a DTI official said.    He said Toshiba's application would be considered by theOffice of Telecommunications (OFTEL). An OFTEL spokeswoman said"a decision on this application will take weeks, maybe months."    Asked whether Toshiba's bid would fall victim to Britishretaliation, the OFTEL spokeswoman said: "Who knows what's goingto happen given the current situation!"    A Toshiba executive, who asked not to be named, toldReuters: "We do not anticipate any special problems."    Some analysts queried by Reuters questioned the basis ofBritain's strong stand on the Cable and Wireless bid. One saidthat the company's proposal was equivalent to a Japanesecompany wanting to take a stake in Mercury International, thesubsidiary of Cable and Wireless that is the only realcompetitor of British Telecommunications Plc &lt;BTY.L>.    British Corporate Affairs minister Michael Howard leavesfor Japan on Saturday.    The minister will seek a clear timetable from Japan foreasier access for British institutions to Japanese financialmarkets, reciprocating the easy access Japanese securitieshouses and banks have to the City of London.    Britain has threatened to use its new Financial ServicesAct to revoke or deny licences to Japanese brokerage houses ifit does not get satisfaction.    But British authorities would be far from happy if forcedto use that weapon, government sources said.    Sir Nicholas Goodison, Chairman of the London StockExchange, said in New York yesterday that sanctions againstJapanese financial institutions operating in the U.K. Would setback London's ambition to become a leading centre for corporatefinancing and securities trading.    Chancellor of the Exchequer Nigel Lawson also warnedyesterday of the negative effects that a trade war could haveon the British economy. Such a development could hit U.K.Exports and sharply alter the outlook for the next generalelection in which economic recovery will be one of thegovernment's main themes, political analysts said. REUTER&#3;
