reut2-006.sgm, CAROLINA POWER &lt;CPL> CANCELS GENERATING UNIT, Carolina Power and Light Co saidits board has decided to cancel coal-fired Mayo Unit Two, thesecond unit planned for its Mayo Plant in Person County, N.C.    The company said the 690,000 kilowatt unit was only aboutone pct complete and was scheduled for commercial service in1992.    Carolina Power said the status of the unit had been underreview because of a decision by the North CarolinaEnvironmental Management Commission that would have requiredthe unit to be equipped with expensive sulphur dioxide-removingscrubbers.    Carolina Power said Unit One, which has been in operationsince 1983, meets all air quality regulations without scrubbersthrough the use of low-sulphur coal, and "The addition ofscrubbers to Mayo Unit Two would have produced only marginalair quality improvements."    The company said it will be able to purchase lower-costpower from Duke Power Co &lt;DUK> for intermediate and peakingpurposes than the projected cost of power from Mayo Two withscrubbers.  It said it will retain the Mayo Two site for laterdevelopment of a generating unit.    Carolina Power said Mayo Two was projected to cost about877 mln dlrs, including 200 mln dlrs for scrubbers.  "Thehigher construction costs, plus higher operating costs, wouldincrease the cost of power produced by Mayo Unit Two withscrubbers by about 90 mln dlrs per year."    A company spokesman said the company has already spentabout 23 mln dlrs on Mayo Two. He said no estimate has yet beenmade of the cost of canceling the plant, but the company doesnot expect to take a charge against earnings.  He said CarolinaPower intends to include the cancellation costs in rate filingsit will make late this year or early next year. Reuter&#3;
reut2-006.sgm, ICM PROPERTY &lt;ICM> SIGNS LEASE AGREEMENT, ICM Property INvestors INc saidCrestmont Federal Savings and Loan Association signed afive-year lease on an office building in the Edison Squarecomplex.    ICM and Weingarten Group are joint venture partners in theEdison, N.Y., complex.   Terms of the lease were not immediately available.   ICM said it has about 25.1 mln dlrs invested in EdisonSquare.     Reuter&#3;
reut2-006.sgm, PENGUIN GROUP &lt;PGC> REPORTS ORDERS, Penguin Group Inc said it told a groupof analysts that it has started to book orders for itsL'Ectronique line of costume jewelery and The Simplifier, adevice which employs artificial intelligence to make computerseasy to use.    Penguin officials were not available to comment on thepotential market of these products. Reuter&#3;
reut2-006.sgm, ALLISON'S PLACE INC &lt;ALLS> 4TH QTR NET, Qtr ends Jan 31    Shr seven cts vs 20    Net 1,84,000 vs 387,000    revs 9.1 mln vs 6.7 mln    Avg shrs 2,804,752 vs 1,875,000    12 mths    shr 13 cts vs 33 cts    Net 315,000 vs 627,000    revs 32.4 mln vs 24.6 mln    Avg shrs 2,475,943 vs 1,875,000    Reuter&#3;
reut2-006.sgm, CAROLINA POWER AND LIGHT CO &lt;CPL> SETS PAYOUT, Qtly div 69 cts vs 69 cts prior    Pay May One    Record April 10 Reuter&#3;
reut2-006.sgm, PURITAN-BENNETT &lt;PBEN> MAKES ACQUISITION, Puritan-Bennedtt Corp saidit has acquired a majority interest in Medicom Inc, which makesa heart monitor for use in diagnosing heart disorders, forundisclosed terms.    The company said the device will be sold under the nameCompanion Heart Monitor. Reuter&#3;
reut2-006.sgm, MURRAY OHIO &lt;MUR> SEES HIGHER FIRST QUARTER NET, Murray Ohio Manufacturing Cosaid it expects first quarter earnings to be higher than theyear-ago 4,800,840 dlrs or 1.25 dlrs per share due to excellentlawn and garden shipments.    The company said bicycle sales were soft early in theperiod, but recent orders and shipments have been running wellahead of last year.    It said it expects to meet analysts' projections ofearnings for the full year of 1.50 dlrs per share and it couldpossibly exceed the estimate if orders continue strong. Reuter&#3;
reut2-006.sgm, DEL-VAL FINANCIAL CORP &lt;DVL> SETS PAYOUT, Mthly div 14-1/2 cts vs 14-1/2 cts prior    Pay July One    Record June 17 Reuter&#3;
reut2-006.sgm, ENRON &lt;ENE> TO PAY DIVIDENDS ON PREFERRED, Enron Corp said it will pay accruedsecond quarter dividends on the three series of preferred stockit will redeem on May 1.    The company said it will pay second quarter accrueddividends to the redemption date of 53 cts per share on the6.40 pct stock, 56 cts on 6.84 pct and 70 cts on 8.48 pct. Reuter&#3;
reut2-006.sgm, USSR CORN BUYING MAY BE 3.5 MLN TONNES--AMSTUTZ, The Soviet Union's recent cornpurchases from the United States could total as much as 3.5 mlntonnes, U.S. Agriculture Undersecretary Daniel Amstutz said.    "We are not sure how much (Soviets have bought) but we thinkit could be as high as 3.5 mln tonnes," Amstutz told a HouseAgriculture Appropriations Subcommittee.    He added that China also will need to import more corn thisyear than earlier anticipated, but he gave no figures. Reuter&#3;
reut2-006.sgm, REPUBLIC NEW YORK &lt;RNB> CALLS PREFERRED, Republic New York Corp said it willredeem on May 1 all 839,700 shares of its Series A floatingrate cumulative preferred stock at 51.50 dlrs per share plusaccrued dividends, or a 1.50 dlr premium over stated value. Reuter&#3;
reut2-006.sgm, ALLISON'S PLACE &lt;ALLS> SALES INCREASE IN FEBRUARY, Allison's Place Inc presidentMarvin Schenker said company-owned stores sales for Februaryincreased 82 pct over the same period last year.    He said comparable store sales in February increased 36pct.    The company, which owns and franchises a total of 237clothing outlets where all articles cost six dlrs, willincrease that figure to seven dlrs starting March 1, Schenkersaid.    He said the impact of that boost will start to be felt inthe early part of the company's second quarter and continuethroughout the year.    Schenker said costs of the company's merchandise will notincrease. Reuter&#3;
reut2-006.sgm, BORMAN'S INC &lt;BRF> 4TH QTR NET, Shr 1.10 dlrs vs 1.33 dlrs    Net 3,065,000 vs 3,730,000    Sales 273.9 mln vs 241.0 mln    Year    Shr 3.27 dlrs vs 2.62 dlrs    Net 9,168,000 vs 7,338,000    Sales 1.07 billion vs 987.2 mln    NOTE: Fiscal 1987 net includes tax credits of 10 cts forthe fourth quarter and 1.04 dlrs for the year compared with 43cts and 85 cts in the respective periods of fiscal 1986. Reuter&#3;
reut2-006.sgm, (CORRECTED)-BANKERS TRUST NEW YORK &lt;BT> PAYOUT, Qtly div 41-1/2 cts vs 41-1/2 cts prior    Pay April 25    Record March 31    NOTE: Full name Bankers Trust New York Corp.    (Company corrects pay date, April 25, not April 28 in storythat ran yesterday. Reuter&#3;
reut2-006.sgm, NE ELECTRIC &lt;NES> AUDITORS QUALIFY ANNUAL REPORT, New England Electric System's auditorshave again qualified the utility's annual report because ofuncertainty about whether its oil and gas subsidiary canrecover its investments.    The qualification was noted in the annual report which NewEngland Electric released at a security analysts meeting today.The auditors also qualified the company's 1985 report for thesame reason, noting the sharp drop in oil and gas prices inearly 1986.    President Samuel Huntington told analysts the utility willhave to take a write-down of about 235 mln dlrs if Federalregulators do not allow the company to pass on the losses citedby the accountants to its rate payers. Reuter&#3;
reut2-006.sgm, CORRECTED - FEDERAL PAPER &lt;FBT> RAISES PAYOUT, Qtly div 17-1/2 cts vs 17-1/4 cts    Pay April 15    Record March 31    NOTE: Full name Federal Paper Board Co.    (Corrects headline and dividend figure in item appearingMarch 17 to show dividend was raised.) Reuter&#3;
reut2-006.sgm, NE ELECTRIC SEES HIGHER CONSTRUCTION OUTLAYS, New England Electric System &lt;NES>expects its cash construction spending to reach 205 mln dlrsthis year, up from 188 mln dlrs in 1986, the utility said inmaterial distributed at an analysts meeting.    It said spending is expected to advance to 215 mln dlrs in1988 and 220 mln dlrs in 1989.    The utility said these totals exclude spending on NewEngland Hydro-Transmission being built to import electricityfrom Quebec Hydro. New England Electric is the operator of thisventure as well as owning 51 pct of the project.    The venture expects to spend 65 mln dlr this year, 105 mlndlrs next year and 125 mln dlrs in 1989 to build transmissionlines from northern Quebec into New England, the utility said.    New England Electric said internally generated funds willcover all of its power plant construction costs this year and65 pct of the 108 mln dlrs its retail distribution units planto spend in 1987.    The company said it also expects to spend 60 mln dlrs onits oil and gas activities this year, adding internallygenerated funds are expected to provide 85 pct of this total.    New England Electric said it plans to issue 30 mln dlrsworth of pollution control bonds in 1987 and retire additionalhigher cost preferred stock. Its Granite State Electric unitplans to issue five mln dlrs of long term notes early this yearas well.    The company said it does not plan to offer common sharesthis year or in the foreseeable future, but expects to raiseabout 40 mln dlrs in equity through the sale of stock under itsdividend reinvestment plan and employee share plans.    President Samuel Huntington told the analysts theconstruction spending projection is based on the expectationthat demand for electricity in the New England electric systemwill grow about two pct a year for the next 15 years.    However, the utility cannot ignore the potential forsharper growth, he said, pointing out that demand was up 5.2pct in 1986 and 4.7 pct per year in the past four years.    He attributed this growth to declining electricity pricesand a strong New England economy.    Huntington said New England Elecetric has "all but rejectednew coal fired plants" to supply additional power.    He said the most attractive new power supplies are thosewith short lead times which can be built in modules.    Later, vice president Glenn Schleede said the utility islooking at gas-fired, combined cycle generating units to supplymost of its new power needs, but has not rejected coal-firedfluidized bed units.    He explained that fluidized bed technology is available inmodular units, adding that Huntington was referring to thetraditional coal-fired plant which burns pulverized coal. Reuter&#3;
reut2-006.sgm, RADA ELECTRONIC INDUSTRIES&lt;RADIF> NINE MTHS NET, Ended December 31    Shr three cts vs nine cts    Net 220,000 vs 721,000    Revs 4,920,000 vs 4,184,000    Avg shrs 6,425,925 vs 6,599,000    NOTE: Full name Rada Electronic Industries Ltd. Reuter&#3;
reut2-006.sgm, U.S. WHEAT GROWERS SET STATE DEPT TRADE MEETING, The National Association of WheatGrowers, NAWG, board of directors is scheduled to meetSecretary of State George Schultz and Undersecretary of StateAllen Wallis to discuss the Department's current role in farmtrade policy, the association said.    NAWG President Jim Miller said in a statement that theorganization wanted to convey to Secretary Schultz theimportance that exports hold for U.S. agriculture and thedegree to which farmers are dependent upon favorable StateDepartment trade policies to remain profitable.    "Foreign policy decisions of the U.S. State Department havein the past severely hampered our efforts to move our productto overseas markets," he said.    Miller noted Secretary Schultz is scheduled to meet nextmonth with representatives of the Soviet Union, and the NAWG"wanted to be certain the secretary was aware of our concernsregarding the reopening of wheat trade with the Soviet Union."    The annual spring NAWG board of directors meeting is heldin Washington to allow grower-leaders from around the countryto meet with their state congressional delegations and membersof the executive branch.    The purpose is to discuss the current situation forproducing and marketing wheat and help set the legislative andregulatory agenda for the coming year, the NAWG statement said. Reuter&#3;
reut2-006.sgm, WORLD FOOD PRODUCTION OUTSTRIPS POPULATION, World food production over the next decadewill exceed population growth, but because of unequaldistribution, many parts of the world will go hungry, the U.N.Food and Agriculture Organisation (FAO) said.    In a report to be considered by its agriculture committeeat a meeting later this month, FAO said: "The long term trendspoint towards a further polarisation of the world food system.    "Some regions and commodities will continue to be troubledby chronic surpluses that cannot find outlets...Some of thepoorer countries and regions will still be faced by thecombined problem of low nutritional levels, rapidly risingpopulations, inadequate growth in both food production andincomes...," FAO said.    FAO set out several long-term goals to be considered by thecommittee, which meets between March 23 and April 1.    These included improving the international tradingenvironment for agricutural commodities, reducing foodsurpluses in developed countries, conserving natural resourcesand speeding up the increase of food production in developingcountries. Reuter&#3;
reut2-006.sgm, DOE SECRETARY PROPOSES OIL TAX INCENTIVES, Energy Secretary John Herringtonsaid he will propose tax incentives to increase domestic oiland natural gas exploration and production to the ReaganAdministration for consideration.    "These options boost production, while avoiding the hugecosts associated with proposals like an oil import fee,"Herrington told a House Energy subcommittee hearing. "It is myintention to submit these proposals to the domestic policycouncil and the cabinet for consideration and review."    "The goal of the Administration policies is to increasedomestic production. I would like to shoot for one mln barrelsa day," he said.    The proposals were based on a DOE study released yesterdaywarning the United States was threatened by a growingdependence on oil imports.    "We project free world dependence on Persian Gulf oil at 65pct by 1995," Herrington said. Reuter&#3;
reut2-006.sgm, CHILDREN'S DISCOVERY &lt;CDCRA> 4TH QTR LOSS, Shr loss 18 cts vs profit six cts    Net loss 509,471 vs profit 163,840    Revs 2,623,974 vs 1,835,580    12 mths    Shr loss 18 cts vs profit 10 cts    Net loss 494,352 vs profit 173,948    Revs 10.1 mln vs 3,551,429    NOTE: 4th qtr loss reflects 290,000 dlrs of non-recurringexpenses related to senior management changes.    Full name of company is Children's Discovery Centers ofAmerica Inc. Reuter&#3;
reut2-006.sgm, CPI CORP &lt;CPIC> TO POST HIGHER 1986 RESULTS, CPI Corp said it expects to posthigher sales and earnings for its fiscal year ended February 7when it officially reports results in three weeks.    It said preliminary figures show total sales of 258 mlndlrs, up 30 pct from 198 mln dlrs in its 1985 fiscal year. Netearnings from continuing operations rose to 18 mln dlrs, upalmost 31 pct from 13.9 mln dlrs, while per share earnings fromcontinuing operations were 2.22 dlrs, up 23 pct from 1.80 dlrs.There were 552,500 additional shares outstanding. Reuter&#3;
reut2-006.sgm, COMMODORE &lt;CBU>, BALLY &lt;BLY> SET SOFTWARE PACT, Commodore International Ltdsaid its Commodore Business Machines unit reached an agreementwith Bally Manufacturing Corp to supply software for the designof coin-operated video games.    The company said its Amiga computer graphics technologywill be used to develop the games. In return, Commodore willreceive software licensing rights to Bally video gamesdeveloped for Amiga computer hardware.    The first game designed under the arrangement will beunveiled on March 20, the company said. Reuter&#3;
reut2-006.sgm, S/P MAY DOWNGRADE AFG &lt;AFG> AND GENCORP &lt;GY>, Standard and Poor's Corp said it maydowngrade AFG Industries Inc and GenCorp Inc because apartnership affiliated with AFG and Wagner and Brown made a 2.2billion dlr tender offer to acquire GenCorp.    AFG has 185 mln dlrs of BB-plus subordinated debt andGenCorp carries 100 mln dlrs of same-rated subordinated debt.    Financing terms of the proposed acquisition are unknown,including AFG's equity contribution to the partnership. S and Psaid AFG's appetite for substantial acquisitions is aggressive.The tender offer would likely heighten financial risk andincrease leverage for GenCorp, S and P said. Reuter&#3;
reut2-006.sgm, JAMAICA AUTHORIZED TO BUY PL 480 WHEAT - USDA, Jamaica has been authorized topurchase about 56,000 tonnes of U.S. wheat under an existing PL480 agreement, the U.S. Agriculture Department said.    It may buy the wheat, valued at 7.0 mln dlrs, between March25 and August 341 and ship it from U.S. ports and/or Canadiantransshipment points by September 30, 1987. Reuter&#3;
reut2-006.sgm, LAIDLAW TRANSPORTATION &lt;LDMFA> SEES BETTER YEAR, Laidlaw Transportation Ltd saidearnings per share for the current fiscal year should increaseby "substantially more" than the 30 pct average annual growthexperienced in the last four years.    Revenues for the year ended August 31 will be about 1.2billion dlrs, including GSX Corp, the U.S. waste services unitacquired from Imasco Ltd last year for 358 mln dlrs, Laidlawpresident Michael de Groote told analysts.    Last year, Laidlaw had operating earnings of 66.2 mln dlrs,or 63 cts per share, on revenues of 717.8 mln dlrs.    De Groote also said the company expects "excellent results"in the second quarter ended February 28, but would not be morespecific.    He said his revenue estimate for fiscal 1987 does notinclude possible further acquisitions and said that theaddition of GSX will produce increasing benefits in fiscal 1988through fiscal 1990.    De Groote said the increased earnings in the previous fourquarters was due partly to internal growth of about 15 pct. Therest came from acquisitions, he said.    Laidlaw expects to sell a small rubber recycling operation,a subsidiary of GSX, within the next few weeks, but this willnot make any material contribution to earnings, de Groote said.    He also said he is "not very optimistic" about the ongoingnegotiations to buy 50 pct of Tricil Ltd, a Toronto-basedchemical and solid waste services company with Canadian andU.S. operations, from &lt;Trimac Ltd> of Calgary.    De Groote said that, regardless of the outcome of theproposed Tricil acquisition, Laidlaw will decide within thenext 30 days whether to stay in the North American chemicalwaste business through GSX Corp.    "We feel it is a profitable business with good growthpotential and we now want to stay in it if we can get the rightmanagement," de Groote said.    Laidlaw financed the acquisition of GSX by its U.S.subsidiary, Laidlaw Transportation Inc, with the proceeds of a200 mln Canadian dlr preferred stock issue and borrowing.    De Groote said the company will gain about 138 mln dlrs incash by August 31 from the exercise of warrants.    De Groote also said waste services in fiscal 1987 willrepresent about 49 pct of revenues, school buses willcontribute 49 pct and trucking about two pct.    The trucking subsidiary in western Canada is performingwell and there are no plans to sell it, he said.    He would not estimate the contribution of each segment toearnings per share for the year. He also said that furtheracquisitions of school bus operations in the U.S. are likelywithin the next few months. Reuter&#3;
reut2-006.sgm, HYPONEX &lt;HYPX> SELLS DEBENTURES AT 11.828 PCT, Hyponex Corp is raising 150 mln dlrsthrough an offering of senior subordinated debentures due 1999yielding 11.828 pct, said sole underwriter Drexel BurnhamLambert Inc.    The debentures have an 11-3/4 pct coupon and were priced at99.50, Drexel said.    The issue is non-callable for five years. There were noratings by Moody's Investors Service Inc or Standard and Poor'sCorp at the time of the pricing, Drexel said. Hyponex saidproceeds will be used mainly to finance acquisitions of assetsand businesses. Reuter&#3;
reut2-006.sgm, XEROX &lt;XRX> SELLS CONNECTICUT PROPERTY, Xerox Corp said it sold a102-acre site in Greenwich, Conn., to a limited partnership for10.5 mln dlrs.    Other details were not disclosed.    The purchaser was identified as Greenwich King StreetAssociates II Limited Partnership. Reuter&#3;
reut2-006.sgm, LSI LOGIC CANADA FILES FOR OFFERING, LSI Logic Corp of Canada Incsaid it filed for a proposed public offering of common sharesto be underwritten by McLeod Young Weir Ltd and Nesbitt ThomsonDeacon Inc.    The company did not give details of the proposed offering.    LSI Logic is associated with, but not owned by, LSI LogicCorp &lt;LLSI>. Reuter&#3;
reut2-006.sgm, NO ACCEPTABLE BIDS FOR CCC PEANUTS - USDA, The Commodity Credit Corporation,CCC, received no acceptable bids on the offer to sell about16,610 short tons of 1986-crop farmers stock peanuts fordomestic crushing, the U.S. Agriculture Department said.    An additional offering of 1986-crop peanuts will be made ata later date, the department said. Reuter&#3;
reut2-006.sgm, PERU SHORT-TERM TRADE LINES RISE TO 430 MLN DLRS, peru's short-term foreign trade creditlines have more than doubled to 430 mln dlrs under presidentalan garcia's 20-month administration.    Central bank general manager hector neyra told reporters that many of the credits were for 90-day terms and could beused several times a year.    The trade credits stood at 210 million dollars when garciatook office on july 28, 1985, and announced foreign debtpayments would be limited to 10 pct of export earnngs.    Neyra told reuters that peru was current on interestpayments on short-term debt, including the trade credit linesand on about 750 million dollars in so-called  "working capital"credits.    Neyra did not specify the source of the trade credit lines. Reuter&#3;
reut2-006.sgm, BRAZIL'S GDP GREW 8.2 PCT LAST YEAR, Brazil's Gross Domestic Product,GDP, rose by 8.2 pct in real terms last year following an 8.3pct increase in 1985, the Geography and Statistics Institutesaid.    In money terms this equalled 3.6 trillion Cruzados, givingper capita GDP of 26,120 Cruzados, or 1.6 pct above the levelachieved in 1980 before the recession of 1981-1983, theInstitute said in a statement.    Agricultural output, hit by adverse weather, fell by 7.3pct last year led by coffee production which was 46 pct down.    Industry grew 12.1 pct, including capital goods by 21.6 pctand consumer goods by 20.3 pct, while services were up 8.3 pct. Reuter&#3;
reut2-006.sgm, ENSOURCE INC &lt;EEE> 4TH QTR LOSS, Shr loss 60 cts vs loss 6.50 dlrs    Net loss 2,012,000 vs loss 21.9 mln    Revs 8.6 mln vs 13.5 mln    Year    Shr loss 1.04 dlrs vs loss 5.96 dlrs    Net loss 3.5 mln vs loss 20.2 mln    Revs 36.6 mln vs 52.1 mln Reuter&#3;
reut2-006.sgm, MEXICAN HYDROCARBON RESERVES FALL SLIGHTLY IN 1986, mexico's proven reserves of liquidhydrocarbons at end-1986 were 70 billion barrels, slightly downfrom 70.9 billion a year ago and 71.75 billion in 1984, thestate oil company petroleos mexicanos (pemex) announced.    Reserves were just 5.77 billion barrels in 1974, rosesharply to 40.19 billion in 1978 and flattened out at 72billion in both 1981 and 1982.    In its annual report, pemex said average crude output in1986 was 2.43 mln barrels per day, 202,000 bpd down on 1985.Average exports were 1.29 mln bpd, down from 1.44 mln bpd.    The company did not say what percentage of hydrocarbons wascrude oil, but has previouly said it was about 48 pct.    Natural gas output in 1986 was 3.43 billion cubic feet perday, down from 3.6 billion in 1985.    Due mainly to the fall in oil prices to around 12 dlrs from25 dlrs in the year, 58 wells, both exploratory and production,were suspended, 38 of them in less productive areas than theoffshore campeche fields which accounted for 64 pct ofproduction. Reuter&#3;
reut2-006.sgm, GREAT LAKES FEDERAL &lt;GLFS> HIKES DIVIDEND, Qtly div 15 cts vs 10 cts prior qtr    Pay 17 April    Record 3 April    NOTE: Great Lakes Federal Savings and Loan is full name ofcompany. Reuter&#3;
reut2-006.sgm, MURRAY OHIO &lt;MYO> SEES HIGHER 1ST QTR EARNINGS, The Murray Ohio ManufacturingCo said it expects first quarter earnings to be higher than the4,800,840 dlrs, or 1.25 dlrs per share, it recorded for thefirst quarter of last year.    The company, which produces lawn mowers and bicycles, saidearnings are ahead of last year due to increased lawn andgarden shipments in January and February and a record-settingpace in March. Reuter&#3;
reut2-006.sgm, ALLEGHANY CORP &lt;Y> DECLARES 1987 DIVIDEND, Alleghany Corp said its board declared a stock dividend of one share of its common for every50 shares outstanding, as the company's dividend on its companyfor 1987.    It said the dividend will be distributed on April 30, toholders of record on March 30.    Alleghany said cash will be paid in lieu of any fractionalshares of its stock. Reuter&#3;
reut2-006.sgm, HOUSE SUBCOMMITTEE VOTES CREDIT CARD RATE CAP, A House Banking subcommittee hasapproved legislation to limit the interest rates charged bybanks and other credit card issuers.    The Consumer Affairs and Coinage subcommittee bill wouldlimit credit card interest rates at eight percentage pointsabove the yield on one-year Treasury securities.    If in effect now, the bill would limit credit card rates to13.8 pct compared to a nation-wide average of 18 pct, thesubcommittee said.    The bill now goes to the full House Banking committee forfurther action. Reuter&#3;
reut2-006.sgm, PREMIER INDUSTRIAL CORP &lt;PRE> 3RD QTR NET, Ended Feb 28    Shr 39 cts vs 35 cts    Net 11.5 mln vs 10.4 mln    Revs 111.0 mln vs 104.6 mln    Nine mths    Shr 1.16 dlrs vs 1.04 dlrs    Net 34.3 mln vs 30.8 mln    Revs 335.2 mln vs 320.0 mln    Avg shrs 26.7 mln vs 29.6 mln Reuter&#3;
