reut2-019.sgm, TENNECO &lt;TGT> TO TRANSPORT GAS ON OPEN ACCESS, Tenneco Inc said Tennessee Gas PipelineCo, its largest interstate natural gas pipeline, will transportnatural gas under the open access rules of the Federal EnergyRegulatory Commission, FERC.    In open access, gas pipelines serve purely as a transportcompany, moving gas from suppliers to customers. Pipelines alsotransport its own gas to customers.    Earlier this week, Transco Energy Co &lt;T> rejected the FERCguidelines, saying it would not offer open access until theregulatory body offers a solution to the exposure it faces forgas it has bought but could not sell.    The exposure faced by the industry stems from take or paycontracts, under which pipelines bought gas on long-termcontracts they could not sell. The problem grew severe ascustomers won cheaper sources of gas because of open access.    Some industry analysts speculated earlier this week thatTenneco might follow Transco's lead and close its pipelines toopen-access because of the take-or-pay issue.    But Tenneco today said open access "is one of the stepsFERC is taking to restructure the gas industry in the U.S. FERCis moving the industry through this restructuring now, evenbefore all transitional problems are solved."    A spokesman said Tenneco faces 1.7 billion dlrs in exposureunder the take-or-pay contracts, but he had no specific figurefor Tennessee Gas, which runs 2,000 miles of pipelines fromLouisiana and Texas up to New England.    "We remain convinced that the most critical transitionalissue facing the industry--take-or-pay--must be resolved byFERC in the near future.    "A failure to do so could have grave consequences for theindustry's continued ability to provide its customers withreliable natural gas," said Tennessee Gas Transmission Copresident R.C. Thomas. Reuter&#3;
reut2-019.sgm, CONSUMERS' GAS &lt;CGT.TO> TO SELL DEBENTURES, Consumers' Gas Co Ltd said it agreed tosell on July 6 100 mln dlrs of 10.60 pct debentures maturing in2012 and priced at 998 dlrs per 1,000 dlrs principal amount.    The company said it would use proceeds for generalcorporate purposes.    It said the underwriter is Gordon Capital Corp. Reuter&#3;
reut2-019.sgm, MAXICARE &lt;MAXI.O> ENDS PLANS TO SELL UNIT, Maxicare Health Plans Inc  saidit ended negotiations to sell Maxicare Alabama L.P. to(Complete Health Inc).    The companies said last week they had reached agreement inprinciple for Complete Health to purchase the healthmaintenance organization, the largest in Alabama.    Maxicare said the terms would not be in the best interestsof the heatlh care providers who have built the Alabama HMO.    It said it now intends to work with its health care providersin Alabama to further develop the HMO. Reuter&#3;
reut2-019.sgm, CHIRON CORP &lt;CHIR.O> 4TH QTR APRIL 30 LOSS, Shr loss 22 cts vs loss 18 cts    Net loss 2,494,000 vs loss 1,608,000    Revs 3,590,000 vs 1,710,000    Year    Shr loss 68 cts vs loss 53 cts    Net loss 7,318,000 vs loss 4,160,000    Revs 10,503,000 vs 7,134,000 Reuter&#3;
reut2-019.sgm, METHODE ELECTRONICS INC &lt;METH.O> 4TH QTR NET, qtr ended April 30    Shr nine cts vs 17 cts    Net 1,026,000 vs 1,840,000    Revs 25.9 mln vs 26.1 mln    Year    Shr 27 cts vs 56 cts    Net 2,942,000 vs 5,865,000    Revs 95.7 mln vs 96 mln Reuter&#3;
reut2-019.sgm, VENEZUELA MAY ASK IMF FOR CREDITS, venezuela may turn to the internationalmonetary fund for credits as part of the country's overalleffort to reestablish financial flows from abroad, financeminister manuel azpurua said today.    "this is no secret. It's just one of the steps the executivehas begun taking to reestablish financial flows to the country,"azpurua told reporters at the finance ministry.    He did not specify what types of loans venezuela would seekfrom the fund or the amounts involved.    A technical team from the imf is currently in caracasgathering data for its annual report on the venezuelan economy,the finance minstry said. Members of the mission met today withofficials from the ministry's public finance department.    Venezuela is one of the few latin american debtors whichhas not drawn standby or extended fund facilty loans from theimf since the region's financial crisis began in 1982.    The country has an imf quota of 1.371 mln sdr's (1.75billion dollars), according to the fund's 1986 report. Reuter&#3;
reut2-019.sgm, NO COMINCO STRIKE TALKS SCHEDULED, Cominco Ltd said notalks were scheduled with striking workers at its Trail smelterand Kimberley, British Columbia lead-zinc mine.    A company spokesman said the company and union metinformally Tuesday but talks did not constitute a formalbargaining session. The last formal talks were on June 5.    The workers went on strike May 9 and production has beenshut down since then.    The Trail smelter produced 240,000 long tons of zinc and110,000 long tons of lead last year. The Sullivan mine atKimberley produced 2.2 mln long tons of ore in 1986, most forprocessing at the Trail smelter.    Reuter&#3;
reut2-019.sgm, U.S. ECONOMY SLOWDOWN RAISES RECESSION FEARS, The economy faces lackluster growthand the risk of recession this year if the recent improvementin U.S. exports should falter, economists say.    Growth will slow sharply in the next months due to weaknessin the key housing and auto sectors and could be furtherhampered unless consumer spending picks up, they say.    "These factors raise the question: Is there enough strengthto keep the economy from tipping into a recession?" said LyleGramley, chief economist of the Mortgage BankersAssociation and a former Federal Reserve Board official.    The Commerce Department said this week that the economygrew by a robust 4.8 pct annual rate in the first quarter, buta U.S. monetary official called it a weak report.    Housing starts fell 2.7 pct in May, and consumer spendingrose a weak 0.1 per cent.    "Our two largest visible industries -- autos and housing --are faltering, but exports are picking up some of the slack, "Martin Mauro, senior economist for Merrill Lynch Economics,told Reuters.    Gramley said he is worried that consumer spending may slowbecause inflation is rising faster than real wages.    To offset this, U.S. exports must continue to rise,returning enough jobs to the manufacturing sector to boostpersonal income and consumption, he says.    "I expect to see enough improvement in real net exports tokeep a recession from happening, but it is a close call,"Gramley said.    Federal Reserve Board Governor Martha Seger told reportersthat the apparent strength in the 4.8 pct growth figure was theresult of a temporary buildup in inventories that will not lastand said the recovery was showing anemia.    Seger said that with the recovery stumbling along, "The paceof the economy and the lack of robustness must be factored intomonetary policy" - possibly a signal that the Fed will beaccommodative.    Most economists predict growth slower than the 3 pctforecast by the Reagan administration for 1987 and warn that ifthe dollar drops suddenly, higher inflation will result and addto the risk of a recession.    Mauro said a 0.5 pct rise in industrial production in Maycame despite cutbacks in output in the auto industry, where aninventory overhang still exists.    He says the boost in production came from smallerindustries like paper, chemicals, and lumber which haveimproved sales overseas due to the drop in the dollar.    "They are not going to be enough for any kind of surge ineconomic activity, but I think they will keep us out of arecession," Mauro said.    In a speech to financial planners this week, BerylSprinkel, the chief White House economic adviser, predicted thetrade deficit will continue to improve.    "Prospects for continued economic growth through 1987 andinto 1988 are still quite favorable," he said.    But private economists raise concerns about a resurgence ininflation.    Allen Sinai, chief economist at Shearson Lehman BrothersInc., told Congress this week that inflation would rise to 4.5to five pct this year and stay at that level through 1989 aftera 1.1 pct increase in 1986.    The rise is coming from a sharply lower dollar, higher oiland energy prices and rising prices for services, he said.    "The lesson of history is that once the inflation genie getsout of the bottle, it continues to persist," he said, adding hewould like the Fed to tighten credit.    A major factor affecting inflation is the value of thedollar, which should continue to fall and feed inflation, saysa prominent international banker.    Rainer Gut, chairman of Credit Suisse, told the NationalPress Club that the dollar's downward trend against the yen andthe mark will continue for years because the United States isthe world's largest debtor nation.    The Swiss banker said the economic indicators point to afurther slackening of activity and called naive the belief thatthe five-year boom on world equity markets will go on forever."It is very difficult to be optimistic," Gut said. Reuter&#3;
reut2-019.sgm, CONDOM RECALLS RISE DUE TO FDA TESTING, The Food and Drug Administration saidstepped up testing of condoms by the agency has led to a threerecalls by U.S. manufacturers and the detention of foreign-madecondoms at U.S. borders.    The FDA said industry standards require that roughly nomore than four out of 1,000 condoms leak. Condoms are tested bypouring 10 ounces of water in each and looking for leakage.    The FDA said Schmid Laboratories of Little Falls, N.J., hasvoluntarily recalled one lot of Sheik Fetherlite condoms, whichwas distributed to 22 accounts through the United States.       The agency said Schmid reported that almost all of thecondoms were still in transit or at wholesalers at the time ofthe recall and are being recovered.    National Sanitary Labs of Lincolnwood, Ill, voluntarilyrecalled a lot of Protex Contracept Plus brand latex condomswhich were distributed to a wholesaler in California and tworetailers in Indiana and Michigan, the FDA said.    The FDA said National estimates that none of the suspectlot remains on the market. The FDA also said National recalledtwo more lots of condoms following additional FDA tests.    The FDA also said Circle Rubber Corp of Newark, N.J., isvoluntarily recalling Saxon and L'appel condoms after beinginformed of FDA test results. The FDA said the condoms weredistributed in North Carolina and Illinois.    The FDA urged condom makers on April 7 to inform consumersabout how condoms should be used to increase protection againstsexually transmitted diseases, including AIDS. Since April, theFDA said it had detained 15 shipments of condoms made by firmsin Korea and four shipments of condoms from Malaysia. Reuter&#3;
reut2-019.sgm, BRAZIL COULD EXPORT 19 MLN BAGS OF COFFEE -IBC, Brazil's coffee exports could amount to19 mln bags this year, because of the excellent crop estimateof 35.2 mln bags, an IBC spokesman said.    He said exports could surpass the average annual 18 mlnbags mark, especially if the final harvest to be conducted inOctober and November confirms the crop at over 35 mln bags.    He said the average limit of errors for the official cropharvest could be set at five pct above or below the firstestimates officially published today.    He said the IBC agreed with a request by producers for theInstitute to ask the government for a monthly indexation of theguarantee minimum price. Reuter&#3;
reut2-019.sgm, ENDOTRONICS &lt;ENDO.O> JOINT VENTURE CEASES, Endotronics Inc said operations atits joint venture with Summa Medical Corp &lt;SUMA.O> has ended.    The company said the venture provided production andpurification services to biotechnology companies on a contractbasis. Endotronics, which is reorganizing under Chapter 11, hasa 75 pct stake in the partnership.    The company said it intends to sell the facility thathoused the operations.    It said it is reviewing the adequacy of a two mln dlrreserve set up in the second quarter ended March 31 for thecarrying value of the facility.    The company said the cessation of the joint venture was thesecond move taken to refocus its operations on theinstrumentation business. The company previously said it was nolonger performing research and development for its health caretechnologies. Reuter&#3;
reut2-019.sgm, INVESTMENT PARTNERSHIP UPS FACET &lt;FCT> STAKE, Charter Oak Partners, a Connecticutinvestment partnership, said it raised its stake in FacetEnterprises Inc to 480,000 shares, or 9.6 pct of the totaloutstanding common stock, from 300,000 shares, or 6.0 pct.    In a filing with the Securities and Exchange Commission,Charter Oak said it bought 180,000 Facet common shares on June12 at 18.25 dlrs each. Reuter&#3;
reut2-019.sgm, UPTREND REMAINS INTACT FOR DEBT FUTURES, The six basis point rise of the pastmonth in U.S. debt futures may be extended next week by aseries of U.S. economic reports, analysts said, as long as thedollar holds firm.    "Interest rates have declined by approximately 50 basispoints over the last month, largely over indications thatinflation is not as high as people had feared and the narrowingU.S. trade balance, in nominal terms," Samuel Kahan, chieffinancial economist with Kleinwort Benson GovernmentSecurities, said.    Kahan said recent government reports have shown strength inthe economy during the first quarter, but his concern iswhether the U.S. economy will sustain that strength in thelonger term.    Weak U.S. economic growth could hurt the dollar, which hasbecome more important to the direction of debt futures than thebeneficial impact on interest rates of a sluggish economy.    The median trade expectations for Tuesday's U.S. ConsumerPrice Index and Durable Goods reports are up 0.4 pct and down1.5 pct, respectively.    Meanwhile, the eight billion dlr drop in the M-1 moneysupply announced this week was "surprising, much larger thanexpected," according to Kahan. "Unless quickly reversed," sucha trend "will ensure that June M-1 growth will be negative,"Kahan said.    Taken in conjunction with M-2 and M-3 aggregates whichKahan said have "slowed to a crawl, below Federal Reserve Boardannual targets," the consequences could be a hint of economicweakness down the road, he said.    Based on chart formations, T-bond futures may be poised forfurther gains, although the advance has been slowed recently,analysts said.    September T-bonds "are up almost six points since about May18," Merrill Lynch debt analyst Jim Duggan noted. Septemberbond futures climbed from the low of 87 a month ago to over 93in mid-June, Duggan said.    While follow-through buying has aided the advance so far,and bouts of short covering have prohibited a slide throughchart support, the rally in September T-bonds has been thwartedabove the 93 level.    "The 93 level is formidable resistance and must be takenout before this activity is anything other than a trading rangemarket," Carroll McEntee and McGinley Futures debt analystBrian Singer said.    The dollar remains the key fundamental factor, and the U.S.currency has made little headway of late, analysts said.    "The critical variable remaining in the market is the valueof the dollar," Kahan said.    Additional influences next week will be possibledevelopments ahead of an OPEC members meeting, and the impactand size of the U.S. budget deficit, "although these will notbe in the forefront of the market early next week," Kahan said.    In looking ahead to the U.S. Treasury mini-refundingauctions of 24.25 billion in T-notes on Tuesday, Wednesday andThursday, Singer said the market will likely greet the resultswith little excitement. However, a successful auction couldprove to be a turning point, depending on prevailing marketpsychology. Reuter&#3;
reut2-019.sgm, CANADA POST SEEKS MEDIATOR, VIOLENCE ON PICKET, Canada Post asked the federal governmentto appoint a mediator to help end an increasingly violentseries of strikes by the country's letter carriers.    The government is expected to respond quickly to therequest that was made after the union formally rejected thecorporation's latest offer to settle the four-day-old dispute.    The state-run postal service also said it would halt theuse of replacement workers that the union has blamed for thetrouble on the picket line.    "We have become increasingly concerned that the safety ofour employees, both striking employees and replacement workers,is at risk," Canada Post negotiator Harold Dunstan toldreporters at a downtown Ottawa hotel.    Robert McGarry, president of the 20,000 member LetterCarriers Union, told reporters he and other union leaders wouldconsider suspending the walkouts for a week while the mediatoris involved.    In a bid to step up pressure on management, letter carrierswalked out in Toronto today where some 50 pct of the country'smail is sorted.    Workers also set up picket lines in other populous citiesin southern Ontario, but went back to work in most othercenters across Canada.    There have been several arrests, property damage, andsometimes violent clashes between strikers and replacementworkers whom the corporation hired to try and keep the mailmoving.    The Canadian Union of Postal Workers (CUPW), whichrepresents postal employees who are not letter carriers andwhich is not on strike, said one of its workers was stabbed andis now in the hospital after a scuffle broke out with areplacement worker in Toronto early today.    Police, however, said they had no report of a stabbing.    CUPW President Jean-Claude Parrot called for theresignation of Andre Harvie, minister responsible for CanadaPost, for condoning the use of the so-called strikebreakers.    "The federal government has (the) blood of workers on itshands in this postal strike," Parrot told reporters at theunion's Ottawa headquarters. Reuter&#3;
reut2-019.sgm, JUDGE HEARS APPEALS AGAINST MANVILLE &lt;QMAN> PLAN, A federal judge heard arguments thatManville Corp's chapter 11 reorganization plan, which wasconfirmed in December, should be thrown out.    During a four-and-a-half hour hearing, U.S. District JudgeWhitman Knapp heard arguments in five different appeals.Whitman took the issues under advisement and will rule at alater date.    Key challenges were made by a group of Manvilleshareholders, who claim they were not adequately representedduring the bankruptcy proceedings and that a 2.5 billion dlrfund to pay victims of asbestos is overfunded.       Another challenge came from a group of asbestos victims whoclaimed the trust fund was underfunded.    Today, Manville lawyers said there have been about 54,000claims filed by those injured by asbestos.    The reorganization plan also sets up a trust fund, withinitial funding of 125 mln dlrs, to pay for property damageclaims. Additional funds will be available if needed. Manvillesaid there are currently 9,500 property damage claims filed.    Manville filed for bankruptcy in 1982 and itsreorganization plan was approved by all parties except thecommon stockholders.       The stockholders objected to the proposal because it wouldgreatly dilute the value of their holdings. The plan would havethe effect of converting every eight shares of common stockinto just one share.    Manville lawyers today criticized shareholder groups forfurther delaying the execution of the bankruptcy plan. HerbertEdelman, one of Manville's lawyers, pointed out that manythousands of victims and creditors were still awaiting paymentsand that many victims had already died.    He also pointed out that the bankruptcy court had foundManville to be insolvent.    "They (shareholders) want the plan put aside to get thatnebulous value that may be down the road," Edelman said.    Common shareholders claim they were not adequatelyrepresented because U.S. Bankruptcy Judge Burton Liflandrefused requests to divide the equity holders committee intotwo separate groups, one repesenting common shareholders andthe other preferred stock shareholders.    During confirmation hearings of the plan, the equitycommittee's lawyer George Hahn walked out of the hearing,saying he could not represent both groups.    The equity holders committee was then abolished.       An unofficial committee representing 10 pct of thecompany's stock was present at the confirmation hearings.However, lawyers for that committee did not present evidence orcross examine witnesses.    During today's hearing Paul Gonson, a Washington lawyerrepresenting the Securities and Exchange Commission, told JudgeKnapp that the agency was also concerned that the shareholdersdid not have adequate representation.    Knapp said the unofficial committee was represented by theNew York law firm of Kronish, Lieb, Weiner and Hellman. "Theyhave one of the best law firms in town," Knapp said. Reuter&#3;
reut2-019.sgm, SURINAM MAY TAKE NETHERLANDS TO COURT, surinam may bring the dutchgovernment before the world court of justice in the hague topress for a resumption of a 100 mln dlr aid program cut off in1982, prime minister jules wijdenbosch said.    Wijdenbosch told a news conference tuesday his governmentmay request the court to make a judgment on the aid, suspendedafter the december, 1982 murders of 15 surinamese oppositionleaders while they were in government custody. Reuter&#3;
reut2-019.sgm,  HK SHANGHAI BANK, STANDARD CHARTERED BANK RAISE PRIME1/2 POINT TO 7.5 PCT., 
reut2-019.sgm, QATAR TAKES OVER CABLE AND WIRELESS FRANCHISE, Qatar will today take over the franchise ofCable and Wireless Plc (CAWL.L) in the emirate through thenewly-created Qatar General Telecommunications Corporation(QTELC).    Cable and Wireless, which has operated in Qatar since 1951,will second expert staff and provide technical and computerservices under agreements signed with QTELC.    Cable and Wireless manager Colin Davies told Reuters"Basically we have been here in a franchise situation for thelast 36 years and the government has now decided they want tohave a bigger role and that is, of course, a sovereign right." REUTER&#3;
reut2-019.sgm, VENEZUELA PROBES ALLEGED FOREIGN EXCHANGE FRAUD, Banking authorities and police areinvestigating an alleged fraud by the second largest tradinghouse in the Caracas free foreign exchange market, FinanceMinister Manuel Azpurua told reporters.    The Superintendency of Banks and the Technical and JudicialPolice have both begun probes of Cambio la Guiara, Azpurua saidon Friday night.    Police said the owners of the firm, Mario Muggia and hisbrother Luigi Muggia, have left Venezuela.    Cambio la Guiara operated in part on the "parallel market" inwhich traders buy and sell dollars among themselves.    The Venezuelan central bank on June 17 suspended thelicences of all 21 foreign exchange operators in the parallelmarket, blaming their speculation for the constant rise in thevalue of the U.S. Dollar here.    Juan Domingo Cordero, vice-president of the Caracas StockExchange and the owner of a foreign exchange trading house,said on Friday he had begun legal action against Cambio laGuiara for issuing him four checks without funds for a totalamount of almost one mln dlrs.    The Cambio la Guiara exchange house had operated inVenezuela for more than 20 years. REUTER&#3;
