reut2-019.sgm, BEVERLY HILLS COP II TOPS 100 MLN AT BOX OFFICE, Gulf and Western Inc's &lt;GW> ParamountPictures Corp division said its movie "Beverly Hills Cop II"has topped the 100 mln dlr mark at the box office on the 29thday of its North American release.    Paramount said the the movie has become the fastest movieto hit the 100 mln dlr mark with an "R" rating, which meansthat anyone under 17 must be accompanied by their parents. Reuter&#3;
reut2-019.sgm, TRANSAMERICA CORP &lt;TA> QUARTERLY DIVIDEND, Qtly div 44 cts vs 44 cts    Pay July 31    Record July 3 Reuter&#3;
reut2-019.sgm, U.S. HOUSE CALLS HIGHER JAPAN DEFENSE SPENDING, The House today supported a call forJapan to boost its defense spending to help share the burden ofprotecting Western interests in sensitive areas around theworld, including in the Gulf.    House member approved a measure that would requireSecretary of State George Shultz to enter into talks with Japanon increasing Japanese defense spending to at least 3 pct ofits gross national product.    The measure, passed during consideration of the 1988-89State Department funding bill would not require an increase,but legislators called on Japan to spend more on defense. TheSenate must approve the measure before it becomes law.    "We don't have to bash the Japanese. We have to show themhow to share the burden of the defense of the free world," saidRep. Robert Dornan, a California Republican.    The amendment calls on Shultz to enter into talks withJapan with the aim of reaching agreement on one of twoalternatives: either Japan can spend 3 pct of its GNP ondefense by itself or give the equivalent amount of money to theUnited States as a kind of security fee. Reuter&#3;
reut2-019.sgm,  OECD SEES 1.5 PCT WEST GERMAN REAL GNP GROWTH IN 1987, 
reut2-019.sgm, AUSTRALIA SET TO GROW, BUT UNEMPLOYMENT MAY RISE, Australia's economy should manage modestgrowth over the next two years after a sharp slowdown butunemployment could still edge upwards, the Organisation forEconomic Cooperation and Development (OECD) said.    The organisation's latest half-yearly report says GrossDomestic Product will grow by 2.5 pct this year and by 2.75 pctin 1988 compared with only 1.4 pct in 1986. The growth will behelped by higher stockbuilding and stronger domestic demandfollowing tax cuts and higher real wages, it added.    The report forecasts a decline in inflation, with consumerprices increasing by 8.5 pct this year and 6.25 pct in 1988.    The current account deficit shows signs of easing slightlyand could narrow to 12 billion dlrs by the end of 1988.    While predicting slightly stronger growth than last year,however, the report revises downwards the OECD's earlier growthforecast for 1987 of 3.75 pct.    The OECD predicts a similar combination of modest economicgrowth and rising unemployment for New Zealand, which isstruggling to recover from a major economic crisis.    The country's GDP, which contracted by 0.6 pct last year,should again show growth over the next two years, rising by0.25 pct this year and a more substantial 2.75 pct in 1988. Reuter&#3;
reut2-019.sgm, SQUIBB &lt;SQB> SAID NOT INTERESTED IN BUYING CETUS, Robert Fildes, president and chiefexecutive of Cetus Corp &lt;CTUS.O>, told Reuters that Squibb Corpis not interested in buying Cetus.    Earlier the companies said Squibb would buy from Cetus afive pct equity postion in Cetus for about 40 mln dlrs.    "This is not an attempt by Squibb to become a majormajority holder in Cetus," Fildes told Reuters in an interview."Squibb has not approached us with any indication that theywant to acquire us and we wouldn't be interested in that kindof arrangement," said Fildes.    Squibb could not be reached to comment on the late commentsby Fildes.    Squibb is Cetus' first pharmaceutical partner and the onlyone to own an equity position in Cetus. Eastman Kodak Co &lt;EK>and W.R. Grace &lt;WR> both have joint ventures with Cetus, butneither owns an equity position in the company, said Fildes.    Cetus has a venture with Kodak to develp diagnosticproducts and with Grace to develop agricultural products.    Earlier, Squibb and Cetus announced in a joint statement an agreement in principle to form a joint venture to developnew biotechnology products in several fields.       As part of the deal Squibb will license several of Cetus'anticancer agents, including interleukin-2, in development.Squibb will sell the drugs only in Japan and other markets butnot in North American and Western Europe.    "We wouldn't have done this deal had it not been understoodthat Cetus wants to build its own fully integrated business inNorth America and Europe," said Fildes.    He said Squibb was the good partner because Squibb has amajor joint venture in Japan and has sales capabilities of itsown in that market.       Fildes said Cetus has shunned licensing arrangements withpharmaceutical companies because it wanted to build its ownbusiness. Many large corporations have invested in smallbiotech firms.    But Squibb's investment in Cetus is the first it has madein biotechnology. Fildes said that was attractive to Cetusbecause it wanted a partner that didn't have a relationshipwith a large number of other biotechnology companies."       Fildes said his strategy was to have partners in non drugareas like diagnostics and agriculture, but to "keep thebiggest developments in anticancer drugs to ourselves."    Fildes said the partnership with Squibb would be used tobroaden the company's reach in such big money making areasas the cardiovascular, anti-infective and the anti-inflammatorymarkets.    Squibb is also investming 75 mln dlrs in Cetus' researchover the next five years.       "Squibb is putting up over 75 mln dlrs in research anddevelopment to make it happen, while the equity position partof the package is simply to demonstrate the seriousness of thispartnership," said Fildes. Reuter&#3;
reut2-019.sgm, NBC SAYS IT WILL IMPLEMENT CONTRACT JUNE 29, The National Broadcasting Co, a unit ofGeneral Electric Co &lt;GE>, said it intends to implement on June29 a labor contract rejected by union represenatives.    A spokesman for the National Association of BroadcastEmployees and Technicians, represening 2,800 workers, said itsnegotiating committee adopted a formal resolution today statingit will inform NBC it will strike upon implementation.    "The union will have to decide what action it thinks isappropriate," said Day Krolik, NBC's vice president for laborrelations. A union spokesman said NBC has until the day ofimplemetation to peacefully negotiate a contract. Reuter&#3;
reut2-019.sgm, FORMER SHEARSON &lt;SHE> OFFICIAL PLEADS GUILTY, Mark Stahl, 45, who was a former seniorvice president of Shearson Lehman Brothers, until hissuspension on April 16, today admitted in U.S. District courthere, embezzling almost 19 mln dlrs from his firm over the pastyear.    He entered a guilty plea before United States DistrictCourt Judge Vincent Broderick to four specific charges totaling1,031,000 dlrs on wire fraud.    Stahl, who was a senior vice president for finance, toldthe judge that the total embezzlement amounted to "a littleless than" 19 mln dlrs.       Through an attorney, Stahl agreed to make restitution toShearson Lehman of all the embezzled funds if possible. Howeverhis guilty pleas today to the four counts will cover allcriminal liability of the embezzlement that occurred betweenApril 1986 to last April.    Judge Broderick scheduled sentencing for December nine.    Stahl faces a maximum sentence of 20 years in jail and onemln dlrs in fines, or both. Reuter&#3;
reut2-019.sgm, TRI-STAR PICTURES INC &lt;TRSP.O> 1ST QTR MAY 31, Shr four cts vs four cts    Net 1,180,000 vs 902,000    Revs 146.9 mln vs 37.0 mln    Avg shrs 33 mln vs 23.9 mln    NOTE: Company changed its fiscal year from December 31 tothe last day of February, thus results of operations for theyear-ago period have been restated to reflect this change.    Current first quarter includes results of operations ofLoews Theatre Management Corp which Tri-Star acquired December31. Reuter&#3;
reut2-019.sgm, CANADA BUDGET DEFICIT DECLINE TO SLOW IN LATE 1980S -OFFICIAL            Reuter, 
reut2-019.sgm, CANADA LIFTS CORPORATE TAX REVENUES BY FIVE BILLION DLRSOVER FIVE YEARS - OFFICIAL, 
reut2-019.sgm, WILSON CUTS PERSONAL TAX RATES, LIMITS CAPITAL GAINSEXEMPTIONS Reuter, 
reut2-019.sgm, CANADA LIFTS FINANCIAL INSTITUTION AVERAGE TAX RATE TO21.3 PCT FROM 14.5 PCT - OFFICIAL, 
