reut2-019.sgm, APOLLO &lt;APCI.O> OFFERS NEW WORKSTATIONS, Apollo Computer Inc said it introduced anew family of computer workstations and improved theperformance and cut prices on some of its existingworkstations.    In addition, the company announced new products that allowpersonal computers to communicate with workstations.       Apollo said its new workstation family, the Domain Series4000 Personal Super Workstations, includes the first colorworkstation priced under 19,000 dlrs that can process fourmillion instructions per second.    Apollo said the Domain Series 4000 also features a 14,000dlr monochrome workstation and a 13,000 dlr workstation server,both of which can process four million instructions per second.    Apollo said the new Domain Series 4000 models double theperformance of its existing Domain Series 3000 workstations andprovide performace equivalent to competing workstations athalf the price.    "We are clearly telling users that Apollo is committed tomaintaining its price/performance leadership in the workstationmarketplace," said Thomas A. Vanderslice, Apollo's chiefexecutive officer.    Apollo also said it will offer new color and monochromemodels for the Domain Series 3000, its entry-level workstationfamily. It said it also cut some prices but did not specify. Reuter&#3;
reut2-019.sgm, &lt;FRANKLIN OPTION FUND> SETS DIVIDEND, Qtly dividend 23 cts vs 21.6 cts in prior qtr    Payable July 14    Record July one    Dividend includes short-term capital gain of 20 cts vs 16cts short-term and 2.2 cts long-term gains in prior quarter Reuter&#3;
reut2-019.sgm, DSC COMMUNICATIONS&lt;DIGI.O> IN SUPPLY AGREEMENT, DSC Communications Corp said it signed asupply agreement with United Telephone System Inc to deliverDSC Signal Transfer Points valued at about 3.0 mln dlrs.    It said the agreement runs through 1990 with productdeliveries expected to start later this year. Reuter&#3;
reut2-019.sgm, CLEOPATRA KOHLIQUE INC &lt;CLEO.O> YEAR NET, year ended March 31    Shr three cts vs 11 cts    Net 384,723 vs 800,137    Revs 5.1 mln vs 3.5 mln Reuter&#3;
reut2-019.sgm, INTERSTATE BAKERIES &lt;IBC>BUYS MEXICAN FOOD FIRM, Interstate Bakeries Corp saidits Royal American Foods subsidiary agreed to buy the assets ofLandshire Food Products Inc, a New-Mexico-based producer ofpackaged Mexican food products.    Terms of the proposed transaction were not disclosed. Reuter&#3;
reut2-019.sgm, FEDERATED GROUP INC &lt;FEGP.O> 1ST QTR LOSS, Period ended May 31.    Shr loss eight cts vs profit six cts    Net loss 895,000  vs profit 662,000    Sales 91.1 mln vs 89.8 mln Reuter&#3;
reut2-019.sgm, GABELLI FIRMS HOLD 28.5 DIGIORGIO &lt;DIG> STAKE, A group of firms led by Gabelli GroupInc told government regulators it holds a 28.5 pct stake inDigiorgio Corp common stock, and said two partnerships makingup part of the group may seek control of the company.    In a filing with the Securities and Exchange Comission, thegroup of firms said it holds 2,430,100 shares of Digiorgiocommon stock. Of the total, 2,059,400 shares are held by GAMCOInvestors Inc and Gabelli Funds Inc. for investment purposes,the group said.    Gabelli-Rosenthal and Partners LP and G and R Partners,which hold the remaining 370,700 Digiorgio common shares, toldthe SEC their "purpose is to ultimately obtain control ofDigiorgio contingent upon approval of Digiorgio," according tothe SEC filing.     As previously reported, Gabelli and Co Inc, acting asinvestment advisor to a group including Gabelli-Rosenthal,proposed on June 25 to acquire all Digiorgio common shares fora per share price of 20 dlrs in cash, a subordinated note witha face value of eight dlrs, 14 pct redeemable preferred stock,and one common share of the post-buyout company.    The June 25 buyout proposal, which remains open until July17, also provides that key members of Digiorgio management andsome of its directors would be invited to remain with the firmand participate in the group acquiring the company.    The proposal is also subject to a due diligence review,execution of a merger agreement, arrangement of financing andreceipt of government approvals, all of which Gabelli and Cosaid could be completed within 60 days.    Between April 13 and June 26, the entire group led byGabelli Group Inc made net purchases of 403,600 Digiorgiocommon shares at 22.20 dlrs to 26.79 dlrs a share. Reuter&#3;
reut2-019.sgm, HENLEY GROUP &lt;HENG> UNIT WINS NEWS PLANT ORDER, Henley Group Inc unit,Wheelabrator Technologies Inc, said it won a 243 mln dlrscontract from &lt;Mississippi Chemical Corp> unit Newsprint SouthInc.    The company said the contract is for the construction of a224,000 ton-per-year newsprint production facility in Grenada. Reuter&#3;
reut2-019.sgm, BRAZIL MOTOR INDUSTRY SENDS 9,000 ON LEAVE, Brazil's motor industry, facing theworst crisis of its history, today sent thousands of workers oncollective leave because of a sharp drop in demand.    Company spokesmen said Autolatina, which last Friday laidoff 4,000 workers, sent nearly 9,000 of its 56,500 employees inBrazil on collective leave until July 12.    General Motors do Brasil said it would give 10 days' leaveto part of its 22,000 workforce from Wednesday.    Fiat is giving 2,000 workers a month's holiday from July 6.    Jacy Mendonca, industrial relations director of Autolatina,a merger of Volkswagen and Ford in Brazil and Argentina, saidlast week this would be the worst year ever for Brazil's autoindustry.    He forecast that 1987 would be worse than 1981, whendomestic sales dropped 40 pct to 580,000 units.    "This year we'll be lucky if we can sell 550,000 units," hesaid.    Since Friday there have been two positive developments forthe industry. The government announced that it was scrapping a15 pct surcharge on all new car sales.    The surcharge, created in July last year, was originallyset at 30 pct to help curb a car-buying boom and was in theoryrefundable.    Brazilian car distributors, which since June 16 had haltedall car purchases in protest against high government taxes,responded to the government move by resuming purchases.    But industry spokesmen said taxes on vehicles were stillhigh, 108 pct, and the sector still faced major problems. Reuter&#3;
reut2-019.sgm, WESTERN DONORS STILL BACKING ZAMBIA, SAYS MINISTER, Finance Minister Gibson Chigaga said allof Zambia's traditional financial backers apart from Britainhad pledged continued backing for the country's new go-it-aloneeconomic program announced last month.    Chigaga told Reuters in an interview it was not true thatWestern states had threatened to withold financial aidfollowing Zambia's abandonement of a tough IMF-inspired programthat included the auctioning of the local kwacha.    "It is only Britain which has openly come out to say itwould withhold funds intended for the auction system of foreignexchange," Chigaga said.    "All the other countries have said their relationship withus cannot be affected by the abandonment of a system that onlylived for 18 months, when they have been supporting us for over20 years now," he said.    Chigaga said that Britain was now considering its standfollowing representation by the Zambian government.    Chigaga told Reuters that guidelines on the functioning ofthe new economic prgram would be released soon. REUTER&#3;
reut2-019.sgm, STRIKES HIT CONSOLIDATED-BATHURST &lt;cb.to> MILLS, Consolidated-Bathurst Inc said three ofits Quebec newsprint mills have been shut down by strikes whichbegan over the weekend.    The company said about 2,000 workers, members of theCanadian Paperworkers Union and another, independent union,walked out at its Wayagamack mill at Trois-Rivieres, itsLaurentide mill at Grand-Mere and its Belgo mill at Shawinigan.    Their contract expired April 30.    The Laurentide mill has an annual capacity of 200,000 tonnes, the Belgo mill 350,000 tonnes, and the Wayagamack mill70,000 tonnes.    The strikes are the first at Consolidated-Bathurst millssince an industry-wide walkout in 1976, company spokeswomanDenise Dallaire said.    "As far as management is concerned, negotiations are goingon right now," Dallaire said, adding she could not elaborate.Union officials were not immediately available for comment.Company officials had said at the annual meeting in April theyexpected no labor problems this year. reuter&#3;
reut2-019.sgm, IBM CREDIT &lt;IBM> FILES FOR NOTE OFFERING, IBM Credit Corp said it filed with theSecurities and Exchange Commission a registration statementcovering a 500 mln dlr issue of medium-term notes.    Proceeds will be used for general corporate purposes.    The company named First Boston and Salomon Brothers asagents for the offering. Reuter&#3;
reut2-019.sgm, &lt;UNICOA> TO MERGE INTO ITS UNITED INSURANCE UNIT, Unicoa Corp said it agreed to a mergerwith its wholly-owned subsidiary, United Insurance Co ofAmerica.    Under the agreement, each outstanding share of Unicoacommon stock will be converted into one share of United commonstock.    The agreement is subject to shareholder and regulatoryapproval. Teledyne Inc &lt;TDY> owns about 98.4 pct of Unicoa'soutstanding shares. A shareholder meeting is expected to beheld in August. Reuter&#3;
reut2-019.sgm, EPITOPE &lt;EPTO.O> SETS AIDS TEST CONTROL SERUM, Epitope Inc said it hasdeveloped a set of independent control reagents forlaboratories performing AIDS testing.    The control set consists of human blood serum free of AIDSantibodies, serum with early signs of antibody formation andserum with strong antibody components.    The company said the control sets are designed for use withall Food and Drug Administration-licensed  AIDS screening andsupplemental test and will be marketed worldwide. Reuter&#3;
reut2-019.sgm, RAINS HELP U.S. WESTERN CORN BELT, MORE SEEN, Weekend rain over the Western Corn Beltbrought further relief to crop areas that had been dry earlierthis month, and developing weather patterns will bring welcomemoisture to central and eastern belt locations this week,according to Dale Mohler, senior meteorologist for Accu-WeatherInc.    "There is going to be more rain for the next two, threedays," he said. "We're in a fairly wet pattern with normal toabove normal moisture this week."    Mohler said rainfall averaged 1/2 inch across southernMinnesota, 3/4 inch over southwest Iowa, one inch in easternNebraska and 1-1/2 inches in south-central Nebraska.    Illinois fields saw virtually no rain over the weekend butwere receiving scattered thundershower activity today, he said.    Rain patterns will move across Indiana to Ohio withthudershower activity yielding to more general rains, he said.    "Tomorrow, that eastern area will get 1/4 to one inch, apretty good rain," Mohler said.    Rain was heavier than expected over the weekend, sparkingan early selloff in soybean futures at the Chicago Board ofTrade. Prices were off 14 to 20-1/2 cents with November off19-1/2 cents at 5.43-1/2 dlrs.    Mohler said the cold front now over the eastern belt isexpected to move over the central Midwest, then move northlater in the week. That could bring new rain patterns acrossthe Corn Belt and assure good crop conditions asearly-developed corn moves into the crucial pollination stagein early July, he said. Reuter&#3;
reut2-019.sgm, U.S. CAR OUTPUT SEEN DROPPING IN 3RD QTR, U.S. car production is scheduled to dropby 10.4 pct to about 1.47 mln in the third quarter from lastyear's 1.63 mln as domestic automakers react to a drop in salesfrom last year's record levels, trade paper Automotive Newssaid.    Automotive News said General Motors Corp &lt;GM> has slashedits planned car production by 12.6 pct from last year's thirdquarter totals while Ford Motor Co &lt;F> is scheduling its plantsto build 5.4 pct fewer cars and Chrysler Corp &lt;C> will be off18.4 pct.    But the paper quoted analysts as saying the productionshould be cut by at least 200,000 more units to avoid excessiveinventory build-up in view of a relatively soft market for newcars.    Through June 20, sales of new domestic-built cars are off11.9 pct from last year's levels. Only Ford among the DetroitBig Three is enjoying a sales gain.    GM and Ford may be working to stockpile cars despite themarket conditions because of the prospect of a strike inSeptember by the United Automobile Workers union, analysts said. Reuter&#3;
reut2-019.sgm, HOVNANIAN ENTERPRISES INC &lt;HOV> QTR EARNINGS, May 31 end    Shr 27 cts vs 14 cts    Net 5,664,000 vs 2,812,000    Revs 68.2 mln vs 54.7 mln    Avg shrs 21,254,054 vs 20,167,714    NOTE: First quarter report Reuter&#3;
reut2-019.sgm, APOLLO &lt;APCI.O> CUTS WORKSTATION PRICES, Apollo Computer Inc said the price cutsannounced earlier today on its Domain Series 3000 computerworkstations average 35 pct to 50 pct.    An Apollo spokesman said the cuts bring prices to under5,000 dlrs for some Series 3000 models.    In addition to reducing prices, the company said it addednew monochrome and color models to the Series 3000 line thatimprove its performance and graphics capabilities.    The company made the price cuts along with the introductionof a more powerful family of workstations, the Domain Series4000.       Industry analysts had expected Apollo to reprice the Series3000 in response to aggressive price cuts made two weeks ago byDigital Equipment Corp &lt;DEC> on its competingworkstations.    But the Apollo spokesman said the reductions had beenplanned for some time. "We haven't just cut prices," he added,noting that the company had improved the Series 3000 models.    Analysts have said they also expect Sun Microsystems Inc&lt;SUNW.O>, Apollo's biggest rival in the workstation market, tocut prices and introduce new models. Sun has scheduled a newconference on July eight. Reuter&#3;
reut2-019.sgm, &lt;CORRECTED> - GENERAL INSTRUMENT CORP &lt;GRL> DIVI, Qtly div 6.25 cts vs 6.25 cts prior    Pay Oct 2    Record Sept 1    (Corrects amount of qtly div in item that ran on Friday Jan26) Reuter&#3;
reut2-019.sgm, FED APPROVES CITICORP PURCHASE OF SOME ASSETS OF SEARSCALIF. THRIFT, 
reut2-019.sgm, HEALTH PROPERTIES &lt;HRP> TO BUY PROPERTIES, Health and RehabilitationProperties Trust said it reached an understanding to purchasethree nursing facilities in Mass. and Conn. for 29 mln dlrsfrom Greenery Rehabilitation Group Inc &lt;GRGI.O>.    The buildings will be leased back to Greenery for aninitial term of seven years, subject to renewal options for anadditional 23 years, Health and Rehabilitation Properties said.    The transaction is expected to close on or before August 31. Reuter&#3;
reut2-019.sgm, U.S. CAR OUTPUT SEEN FALLING IN THIRD QUARTER, U.S. car production is scheduled to dropby 10.4 pct to about 1.47 mln in the third quarter from lastyear's 1.63 mln as domestic automakers react to a drop in salesfrom last year's record levels, a trade paper said.    Automotive News said General Motors Corp has slashed itsplanned car output by 12.6 pct from last year's third quartertotals, while Ford Motor Co is scheduling its plants to build5.4 pct fewer cars and Chrysler Corp will be off 18.4 pct.    However, the paper quoted analysts as saying productionshould be cut by at least 200,000 more units to avoid excessiveinventory build-up amid weak demand for new cars.    Analysts said GM and Ford may be working to stockpile carsdespite the market conditions because of the prospect of astrike in September by the United Automobile Workers union.    Through June 20, sales of new domestic-built cars are off11.9 pct from last year's levels. Only Ford among the DetroitBig Three is enjoying a sales gain. Reuter&#3;
reut2-019.sgm, EPA DENIES WHEELING-PITTSBURGH &lt;QWHX> REQUEST, The U.S. Environmental ProtectionAgency said it denied a request by Wheeling-Pittsburgh SteelCorp that it be allowed to continue to operate the Follansbee,W. Va., sinter plant while court-ordered pollution controlequipment is installed.    The EPA said that since the original consent decree withthe company was signed in 1979, the company had had numerousopportunities to reduce harmful emmissions from the plant.    The agency said that only after the company failed tocomply by the last available extension of its compliancedeadline did the agency ask the court to close the plant. Reuter&#3;
reut2-019.sgm, BANK OF NEW YORK ADDS 135 MLN TO LOAN LOSSES, SEES SECONDQUARTER LOSS, 
reut2-019.sgm, BSN &lt;BSN> BUYS STAKE IN MACGREGOR &lt;MGS>, BSN Corp said it holds less than five pctof MacGregor Sporting Goods.    The company said the stock was acquired through recent openmarket purchases and the stake does not require specificdisclosure. Reuter&#3;
reut2-019.sgm, VERNITRON &lt;VRN> SETS RECORD DATE FOR MERGER VOTE, Vernitron Corp said it has set anew record date for shareholders entitled to vote on theproposed merger of Vernitron Corp with SB Holding Corp for July10.    Vernitron, which manufactures electromechanical componentsand related products and services, said it expects that aspecial meeting of shareholders will be held in August.    Vernitron said that SB Holding holds 55.2 pct in Vernitron,resulting from a tender offer in November 1986. Reuter&#3;
reut2-019.sgm, SAVINGS INSTITUTION TO HELP AILING THRIFTS, The U.S. League of Savings Institutionssaid it has launched a program to bolster the liquidity of somesavings and loan institutions and reduce their dependency onhigh interest rate deposits.    A spokesman for the league said 48 institutions havecommitted 340 mln dlrs to the program and estimated that theprogram would begin within a week. Reuter&#3;
reut2-019.sgm, FED ALLOWS CITICORP &lt;CCI>, SEARS &lt;S> THRIFT DEAL, The Federal Reserve Board said itapproved Citicorp's application to purchase through itssubsidiary, Citicorp Savings of Oakland, Calif., some assetsand assume some liabilities of Sears Savings Bank of Glendale,Calif.    Citicorp Savings proposed to assume two billion dlrs indeposits and other liabilities and to purchase 1.9 billion dlrsin assets of 50 branch offices of Sears Savings.    The proposal involved less than one third of the assets andliabilities of Sears Savings, owned by Sears, Roebuck and Co&lt;S>.    The Fed said that it generally has determined there werepotentially adverse effects of allowing affiliations of banksand savings and loan associations, although it has allowed bankholding companies to acquire some failing thrifts.    It said Citicorp's proposal "properly may be viewed as thepermissible acquisition of certain assets and liabilities of Sand L branches rather than the acquisition of an S and L."    Citicorp Savings, the successor to the failed FidelitySavings and Loan Association, has assets of 4.9 billion dlrsand operates 86 branches in California, mainly in the north.    Sears Savings has 6.6 billion in assets and 91 branchespredominantly in southern California.    The application, which was approved unanimously, will noteliminate Sears Savings as a competitor, the Fed said. Reuter&#3;
reut2-019.sgm, LORAL CORP &lt;LOR> AWARDED AIR FORCE CONTRACT, Loral Corp said its LoralDefense Systems won a 29.4-mln-dlr contract with the U.S. AirForce to build 17 advanced transportation and handling sytems.    The systems, the company said, will help extend the lifeand effectiveness of the Minuteman Intercontinental BallisticMissile.    The systems are scheduled for delivery from August 1988 toMay 1989. They will service about 1,000 Minuteman missiles. Reuter&#3;
reut2-019.sgm, NATIONAL PATENT &lt;NPD> TO START AIDS DRUG TRIAL, National Patent Development Corp andBar-Ilan University of Israel said that their joint venturecorporation, Scientific Testing Inc, will begin a clinicaltrial in the U.S. of its immuno-augmenting compound, AS101, forthe treatment of Acquired Immune Deficiency Syndrome (AIDS).    The study will be conducted at the Institute ofImmunological Disorders (MD Anderson Hospital, Houston, Tex)under the direction of Dr Peter Mensell, pursuant to aninvestigational new drug application filed with the Food andDrug Administration, the company said.    The study, expected to begin in four to six weeks, isdesigned to test the effects of AS101 on about 30 AIDSpatients, National Patent said.    It added that AS101, a proprietary synthetic compoundinvented by Bar-Ilan University doctors, has shownimmuno-augmenting, anti-viral and anti-tumor activity inpreclinical animal testing, and immuno-augmenting activity in alimited number of AIDS patients in phase one foreign clinicaltests. Reuter&#3;
reut2-019.sgm, ICN &lt;ICN> BUYS STAKE FROM EASTMAN KODAK &lt;EK>, ICN Pharmaceuticals Inc saidit purchased the remaining 225,000 shares of Viratek Inc&lt;VIRA.O> owned by Eastman Kodak Co owned as part of apreviously announced program.    The company said it paid Kodak 10.50 dlrs a share or 2.4mln dlrs. As previously announced, ICN also said it authorizedthe additional purchase of up to 1.5 mln shares of Viratekcommon. To date, ICN said it bought a total of about 1.2 mlnshares of Viratek, including the shares purchased from Kodak.    The company said it now owns 56 pct of Viratek as a resultof these transactions. Reuter&#3;
reut2-019.sgm, MEXICO GETS 205 MLN DLRS IN WORLD BANK LOANS, The World Bank said it approved twoloans to Mexico totalling 205 mln dlrs to provide financialassistance to industrial companies and finance a projectdealing with agricultural extension services.    Mexico's Nacional Financiera (NF), the recipient of bothloans, will receive 185 mln dlrs to be used to providelong-term credit and equity funds to small and medium-sizedindustrial enterprises, the bank said.    It said a 20 mln dlr loan is being made to help finance aproject designed to test strategies to improve the quality andcost effectiveness of agricultural extension services.    The industrial enterprise project, estimated to cost 350.3mln dlrs, aims to support companies threatened by highinflation and adversely affected by increased competitionbrought about by bank-supported trade liberalization measures.    The bank said the 73.8 mln dlr extension services projectwill examine strategies in 20 of Mexico's 192 rural developmentdistricts and finance training for personnel and farmers,office construction and the purchasing of equipment.    Both loans are for 15 years, including three years ofgrace, with a variable interest rate, currently 7.92 per cent,which is linked to the bank's cost of borrowing funds. Reuter&#3;
reut2-019.sgm, INTEL &lt;INCT.O> SETS PACT WITH SILICON COMPILER, Intel Corp said it has signed aletter of intent with privately-held Silicon Compiler SystemsCorp under which Intel will become a value-added silicon vendorfor integrated circuits designed with Silicon Compiler'sGENESIL silicon compilation system.    Under the proposed pact, Intel would provide initialsilicon foundry services for GENESIL-based designs.    GENESIL users would be able to compile theirapplication-specific designs using Intel's 1.5-microncomplementary metal-oxide semiconductor process.    Reuter&#3;
reut2-019.sgm, WORLD BANK LOANS TURKEY 325 MLN DLRS, The World Bank said it has loanedTurkey 325 mln dlrs to help support an energy sector reformprogram.    The loan-supported program hopes to reduce the extensivepublic sector involvement in the country's energy productionand supply, the bank said.    The loan is for 17 years, including four years of grace,with a variable interest rate, currently 7.92 pct, the banksaid. Reuter&#3;
