reut2-006.sgm, INSPIRATION &lt;IRC> IN CANADIAN GOLD FIND, Inspiration Resources Corp said a goldproject in northern Manitoba in which it has a 44.8 pctinterest has yielded estimated total reserves of 1,580,000short tons grading an average 0.185 ounce of gold per ton.    The company said &lt;Manitoba Mineral Resources Ltd> owns theremaining interest in the project, which is located about 25miles east of Lynn Lake.    Inspiration said the project has proven reserves of 538,000tons assayed at 0.212 ounce of gold per ton, probable reservesof 686,000 tons at 0.166 ounce and possible reserves of 355,000tons at 0.183 ounce.    Inspiration said a production decision is expected to bemade in 1988. Reuter&#3;
reut2-006.sgm, VALERO &lt;VLO> PREFERRED STOCK UPGRADED BY S/P, Standard and Poor's Corp said itraised to B from B-minus Valero Energy Corp's preferred stock.    Also, the rating agency affirmed Valero's BB-minusindustrial revenue bonds and B-rated debentures. About 950 mlndlrs of long-term debt is outstanding.    S and P said Valero's financial flexibility would improveas the company plans to use proceeds of roughly 760 mln dlrsfrom a proposed sale of natural gas operations to reduce debt.Pro forma debt leverage drops to about 30 pct from 67 pct atSeptember 30, 1986. But S and P said Valero's refining segmenthas been unable to consistently generate operating profits. Reuter&#3;
reut2-006.sgm, MARCOR &lt;MAAR> EXPECTS FISCAL YEAR PROFIT, MarCor Development Co Inc saidit expects to post a profit for its fiscal year ended February28 of about two mln dlrs, compared to a year earlier loss of3.2 mln dlrs.    During the prior year the company operated as F and MImporting, a publicly-held wholesale food distributor.    During March last year privately-held Marcor acquired acontrolling interest in F and M Importing, divested the foodbusiness, renamed the company and began operating as a realestate investment and service company. Reuter&#3;
reut2-006.sgm, HONDURAS AUTHORIZED TO BUY PL 480 COMMODITIES, Honduras has been authorized to buyabout 75,000 tonnes of U.S. wheat, about 15,000 tonnes of U.S.corn, and about 6,000 tonnes of U.S. tallow under an existingPL 480 agreement, the U.S. Agriculture Department said.    The department said it may buy the wheat, valued at 8.5 mlndlrs, the corn, valued at 1.5 mln, and the tallow, valued at2.0 mln dlrs, between March 24 and August 31, 1987, and ship itfrom U.S. ports and/or Canadian transshipment points by thisSeptember 30.    The purchase authorizations cover the entire quantityprovided under the agreement, signed March 11.  Reuter&#3;
reut2-006.sgm, VALLEY RESOURCES (VR) SETS STOCK SPLIT, UPS PAYOUT, Valley Resources Inc said itsboard declared a three-for-two stock split and raised thequarterly cash dividend on the pre-split shares to 42 cts from38 cts.    The company said both the split and the dividend arepayable April 15 to holders of record March 31. Reuter&#3;
reut2-006.sgm, CROSS BOOSTS FROST AND SULLIVAN &lt;FRSL> HOLDINGS, A shareholder group led by New Yorkinvestor Theodore Cross said in a Securities and ExchangeCommission filing that it boosted its stake in Frost andSullivan Inc common stock to 208,800 shares or 13.7 pct of thetotal outstanding.    The group said Cross bought 17,000 shares in the openmarket between Feb. 17 and March 10.    The group had said previously that its Frost and Sullivanshare purchases were for investment. Reuter&#3;
reut2-006.sgm, CHAMPION HOME &lt;CHB> SETS UP UNIT, Champion Home Builders Co, aspart of a previously announced reorganization, said it set up asubsidiary to handle two of its operations.    The company transferred its recreational vehicle andcommercial bus manufacturing operations to a new, wholly ownedsubsidiary, Champion Motor Coach Inc.    Total sales from the three manufacturing plants comprisingthe new unit totaled 50 mln dlrs for the fiscal year endedFebruary 27.    Champion Home previously said it was reorganizing itsbusiness units into a new holding company structure. Theholding company will be called Champion Enterprises Inc,subject to shareholder approval at the company's late Juneannual meeting. Reuter&#3;
reut2-006.sgm, PERU TO SELL 40 STATE FIRMS TO CUT BUDGET DEFICIT, peru will sell about 40 state-owned firmsto trim a projected 740 mln dlrs loss this year amonggovernment-owned companies.    Some companies would be sold in their entirety and otherswould be privatised only partially, according to jose palomino,president of the government's state company holding firm, thenational development council (conade).     He told reporters in a radio interview that the aim was toslim a projected public sector firm deficit of 11 billionintis. He did not say if foreigners would be allowed to buy allor part of the companies.    Independent economists warn that the deficit could pushinflation to between 60 and 100 pct in 1987, against thegovenment target of 40-50 pct.    Palomino said aeroperu, the government flagship airlinewith a 10-jet fleet, would issue stock for purchase by privateinvestors. The company in 1986 registered its first profit ineight years, earning about 44.6 mln intis in pre-tax profits.    Peru has about 140 non-financial state firms. Palomino saidthe government would soon publish a list of those to be sold,including those whose shares would be offered on the lima stockexchange.    Last november, palomino said conade's plans included thepossible sale of a company producing palm oil and anothermanufacturing electrical appliances. Shares could also be soldin a copper mine, empresa nacional tintaya sa, in the southernstate of  arequipa.    Neither Palomino nor conade's general manager, enriqueestremadoyro, were available for comment on whether foreignerswould be allowed to purchase the companies. Their secretariessaid they were out of their offices.    Jose antonio almenara, the general manager of the limastock exchange, where shares of the state-owned firms could besold, told reuters that the only foreigners who could purchasestock at the exchange had to be tax-paying residents of peru.    He said foreign stockholders cannot remit profits abroaduntil at least july 1988. Reuter&#3;
reut2-006.sgm, DIEBOLD &lt;DBD> IN PACT WITH WANG &lt;WAN>, Diebold Inc said it signed anoriginal equipment manfacturing agreement with WangLaboratories Inc. Terms of the agreement were not disclosed.    Diebold said the agreement gives Wang the right to sell andsupport a variety of Diebold retail and electronic fundstransfer systems to selected markets worldwide.    In a press release, Wang hailed the agrement as a "majormilestone in Wang's strategy to become a supplier of bothtransaction and data processing systems to the financialmarket." Reuter&#3;
reut2-006.sgm, INTERDYNE CO &lt;IDYN> 1ST QTR FEB 1 LOSS, Shr loss 28 cts vs loss 80 cts    Net loss 2,150,000 vs loss 3,722,000    Sales 1,478,000 vs loss 2,097,000 Reuter&#3;
reut2-006.sgm, SEARS &lt;S> REAL ESTATE UNIT BUSINESS IMPROVES, The Coldwell Banker Commercial RealEstate Services unit of Sears Roebuck and Co said it recorded1986 real estate sales and leases totaling 17.7 billion dlrs,compared with 15.4 billion in 1985.    Some 62.1 pct of the volume was in leases and the remainderin sales, the company said.    It also said sales and leases in office building propertiesaccounted for about about 7.8 bilion dlrs, industrial sales andleases accounted for about 4.9 bilion and commercial/retail 3.5billion. Reuter&#3;
reut2-006.sgm, TERUMO CORP IN 75 MLN DLR EXPANSION IN MARYLAND, &lt;Terumo Corp of Tokyo> hascommitted 75 mln dlrs to the expansion of its medical productsmanufacturing and research development facility in Elkton, Md.,said Gov. William Donald Schaefer in a press release.    Terumo, which operates in Maryland as Terumo Medical Corp,is the largest manufacturer of disposable medical products inJapan.    The release said Terumo bought a 25-acrte site and willbuild a 300,000-square-foot plant to manufacture its line ofdigital therometers. It said the company plans to add 166 newemployees when the facility is completed later this year. Reuter&#3;
reut2-006.sgm, DANA &lt;DCN> DEBT MAY BE DOWNGRADED BY MOODY'S, Moody's Investors Service Inc said itmay downgrade 700 mln dlrs of debt of Dana Corp and its unit,Dana Credit Corp.    The agency said its review would focus on the implicationsof Dana's aggressive balance sheet management on liquidity andfinancial flexibility. Moody's will also take into accountintensifying competition and pricing difficulties in Dana'shighly cyclical core truck and industrial markets.    Dana currently carries A-2 senior debt and industrialrevenue bonds. The Prime-1 commercial paper of Dana and itscredit unit are also under review for possible downgrade. Reuter&#3;
reut2-006.sgm, KILLEARN PROPERTIES INC &lt;KPI> 3RD QTR NET, Qtr ends Jan 31    Shr 23 cts vs eight cts    Net 309,963 vs 110,356    Revs 2,503,451 vs 1,351,076    Nine mths    Shr 62 cts vs 25 cts    Net 851,776 vs 331,666    Revs 6,739,351 vs 4,107,713 Reuter&#3;
reut2-006.sgm, &lt;GATEWAY MEDICAL SYSTEMS INC> 3RD QTR LOSS, Period end Jan 31    Shr loss one cts vs profit eight cts    Net loss 52,198 vs profit 602,766    Revs 18.6 mln vs 7,833,424    Nine mths    Shr profit 10 cts vs profit six cts    Net profit 809,243 vs profit 393,372    Revs 36.3 mln vs 18.7 mln Reuter&#3;
reut2-006.sgm, SPARTECH CORP &lt;SPTN> 1ST QTR JAN 31 NET, Shr two cts vs three cts    Net 369,000 vs 347,000    Revs 21.3 mln vs 14 mln    NOTE: Per shr reflects payment of preferred dividends. Reuter&#3;
reut2-006.sgm, ACADEMY INSURANCE GROUP INC &lt;ACIG> 4TH QTR NET, Shr profit two cts vs loss 1.05 dlrs    Net profit 1,666,000 vs loss 18,306,000    Revs 29.1 mln vs 28.3 mln    Avg shrs 69.1 mln vs 17.5 mln    Year    Shr loss 21 cts vs loss 2.72 dlrs    Net loss 7,571,000 vs loss 45,517,000    Revs 117.4 mln vs 123.3 mln    Avg shrs 35.4 mln vs 16.7 mln    NOTE: Results include losses of nil vs 473,000 dlrs, orthree cts a share, in quarter and 921,000 dlrss, or three cts ashare, vs 1,137,000 dlrs or seven cts a share, in year fromdiscontinued operations Reuter&#3;
reut2-006.sgm, ESSEX CHEMICAL CORP &lt;ESX> REGULAR DIVIDEND, Qtly div 15 cts vs 15 cts in prior qtr    Payable May 11    Record April 10 Reuter&#3;
reut2-006.sgm, U.S. EXPORTERS REPORT 350,000 TONNES CORN  SOLD TO UNKNOWN DESTINATIONS FOR 1986/87, 
reut2-006.sgm, CALUMET &lt;CALI> GETS 4.2 MLN DLRS FROM WARRANTS, Calumet Industries Inc said it raised4.2 mln dlrs from holders exercising company warrants. Theprogram expired February 27.    It issued 420,000 shares to holders who had exercisedoptions to exchange four warrants and 10 dlrs for each share ofcommon stock. About 87 pct of its warrants were exercised.    These proceeds and another 14 mln dlrs from the sale ofnotes will provide long term financing for its HydroCal 2 heavyhydrotreating system under construction at its Princeton, La.,refinery. Reuter&#3;
reut2-006.sgm, FINANCIAL TIMES LAUNCHES NEW WORLD SHARE INDEX, The Financial Times newspaper said ithas launched a new international share index, which representsmore than 70 pct of the world's total stock market value. TheFT-Actuaries World Indices, published for the first time today,feature a main world share index and indices plotting themovement of share prices in different regions and individualcountries, the FT said.    The first world share indices will be published on anup-to-date daily basis. The indices are based on the prices ofaround 2,400 equity securities from 23 countries.    Calculated on the same basis as the FT-Actuaries Indicesfor UK securities, the indices will be produced daily andpublished in the Financial Times. The daily tables have aseries of regional indices together with the overall worldindex.    The FT said its main aim was to provide a set ofmeasurements against which the performance of internationalfund managers could be judged. Markets, companies andsecurities have been included only when direct holdings ofshares by foreign nationals are allowed, it said. The FT saidto keep the whole series manageable it has kept the number ofcompanies from the U.S. To 600.    The indices are calculated in three seperate currencies -the US dollar, sterling and the appropriate local currency.    The regional indices are calculated in a way that takesinto account the relative weight of local capitalisations.Thegross dividend yield is also published on the basis of whatforeign shareholders are entitled to receive before withholdingtaxes.    The FT said it has decided to calculate these numbers afterthe enourmous growth in the volume of cross-border equityinvestment in recent years.REUTER...^M&#3;
reut2-006.sgm, USDA REPORTS 350,000 TONNES CORN TO UNKNOWN, The U.S. Agriculture Department saidprivate U.S. exporters reported sales of 350,000 tonnes of cornfor delivery to unknown destinations during the 1986/87marketing season.    The marketing year for corn began September 1.    This is the second day running that exporters have reportedcorn sales to unknown destinations. Yesterday, they reportedsales of 150,000 tonnes to unknown. Reuter&#3;
reut2-006.sgm, HRE PROPERTIES &lt;HRE> 1ST QTR ENDS JAN 31 NET, Shr 38 cts vs 47 cts    Net 2,253,664 vs 2,806,820    Revs 5,173,318 vs 5,873,904    NOTE: 1987 qtr includes 126,117 dlrs, or two cts per share,from gains on sale of property, vs gain 29,812, or less thanone cent per share, for prior qtr. Reuter&#3;
reut2-006.sgm, MOODY'S UPGRADES TEXAS AIR &lt;TEX> UNIT'S DEBT, Moody's Investors Service Inc said itupgraded 475 mln dlrs of debt of Continental Airlines Inc, aunit of Texas Air Corp.    Raised were the unit's senior secured Denver industrialrevenue bonds to B-1 from Ca and subordinated debt to B-3 fromC.    Moody's said the action recognizes the airline'sreorganization under Chapter 11 of the bankruptcy code, risksassociated with its substantial financial leverage andunpredictable cash flow. Reuter&#3;
reut2-006.sgm, JAYARK CORP &lt;JAYA> 3RD QTR ENDS JAN 31 LOSS, Shr nil vs nil    Net loss 77,879, vs loss 65,501    Revs 3,895,741 vs 4,872,163    Nine mths    Shr profit nine cts vs profit two cts    Net profit 488,898 vs profit 118,208    Revs 13.0 mln vs 15.8 mln Reuter&#3;
reut2-006.sgm, &lt;BIO-VASCULAR INC> 1ST QTR JAN 31 LOSS, Shr loss three cts vs profit two cts    Net loss 54,791 vs profit 28,866    Sales 137,9810 vs 338,886    Avg shrs 1,602,717 vs 1,331,739 Reuter&#3;
reut2-006.sgm, GREAT AMERICAN MANAGEMENT &lt;GAMI> 2ND QTR LOSS, Period ended Jan 31    Shr loss 89 cts vs loss 82 cts    Net loss 5,187,000 vs loss 5,362,000    Revs 128.4 mln vs 50.3 mln    Six mths    Shr loss 1.27 dlrs vs loss 1.04 dlrs    Net loss 7,015,000 vs loss 6,790,000    Revs 264.7 mln vs 97.3 mln    NOTE: Full name is Great American Management and InvestmentInc Reuter&#3;
reut2-006.sgm, NEWMONT GOLD &lt;NGC> FILES FOR PUBLIC OFFERING, Newmont Gold Co said it filed aregistration statement with the Securities and ExchangeCommission for the proposed public offering of five mln sharesof common plus an over-allotment option of 500,000 shares.    Newmont Gold said the newly registered shares wouldrepresent about 5.2 pct of the 105 mln shares outstanding afterthe share issue. It said it will use proceeds to repay thelong-term debt it owes to its parent, Newmont Mining Corp&lt;NEM>, and for general corporate purposes.    Newmont Mining will continue to own about 90 pct of NewmontGold after the offering.    Newmont Gold said four mln shares will be offered initiallyin the U.S. by a U.S. underwriting group and one mln shareswill be offered initially outside the U.S by an internationalunderwriting group.    It said Kidder, Peabody and Co Inc, Lazard Freres and Coand Salomon Brothers Inc and their affiliates will beco-managers of both underwriting groups. Reuter&#3;
reut2-006.sgm, NORSTAR &lt;NOR> TO BUY CALLICOON BANK, Norstar Bancorp said it reached anagreement in principle to buy United National Bank of Callicoonthrough a stock exchange valued at 20 mln dlrs.    Under terms of the agreement, Norstar would buy all 201,660shares of United's common stock at a rate of three Norstarshares for each United share.    With year-end assets of 90 mln dlrs, United has branchessix upstate New York cities, all of which will become part ofNorstar Bank of the Hudson Valley, N.A.    Norstar is an 11.1 billion dlr multibank financial servicescompany. Reuter&#3;
reut2-006.sgm, MAJESTIC CONTRACTORS TO PURCHASE SHARES, &lt;Majestic Contractors Ltd>said it will purchase up to a maximum of 403,828 of its commonshares on the Toronto Stock Exchange at the market price.    Purchases will begin on April 13, 1987 and will end whenMajestic has bought 403,828 common shares or on April 12, 1988,whichever comes first. Reuter&#3;
reut2-006.sgm, ACADEMY INSURANCE GROUP INC &lt;ACIG> 4TH QTR NET, Oper shr profit one ct vs loss 1.14 dlrs    Oper net profit 435,000 vs loss 19.9 mln    Year    Oper shr loss 28 cts vs loss 2.78 dlrs    Oper net loss 10 mln vs loss 46.5 mln    NOTE: Excludes investment gains of one ct per share vs 12cts in the quarter, and gains 10 cts per share vs 13 cts in theyear. Excludes loss from discontinued operations of three ctsper share in fourth quarter 1985, and loss of 21 cts per sharevs loss 2.72 dlrs in the year. Reuter&#3;
reut2-006.sgm, NYSE CLARIFIES TRIPLE WITCHING PROCEDURE, The New York stock exchange said itsrules for triple expiration Friday permit enteringarbitrage-related market-on-close orders in the final 30minutes of trading providing they are on the other side ofimbalances and providing they open positions.    The NYSE clarified a statement released yesterday in whichit detailed procedures to be followed this Friday when stockindex options, index futures and individual stock optionsexpire simultaneously. The NYSE said it will not allow amarket-on-close order after 1530 EST Friday that increases orliquidates an existing arbitrage position.    The NYSE in cooperation with the Securities and Exchangecommission will publicize imbalances of 10,000 or more sharesin the 50 stocks beginning at 1530 EST Friday. In the final 30minutes of trading Friday any market-on-close orders must be onthe other side of the imbalance. Reuter&#3;
reut2-006.sgm, U.S HOUSE BUDGET CHAIRMAN PROPOSES SPENDING HOLD, House Budget Committee ChairmanWilliam Gray, D-Pa, said he would propose a freeze on allspending for federal government programs for the fiscal 1988budget to meet budget deficit targets.    "An outlay freeze -- with no additional revenues -- producesalmost enough savings to reach the 108 billion dlr deficittarget. For fiscal 1988, this would mean total spending of justover 1 trillion dlrs," Gray said in a statement.    Gray said his plan would call for a freeze in spending oneach individual federal program at fiscal 1987 levels.    He said this would mean numerous program cuts, lowerbenefits for recipients of federal assistance and fewer peoplebeing served by federal programs.    Gray said he would make the budget freeze proposal when theHouse Budget Committee begins work on the budget resolutionthis Thursday. The Senate Budget Committee began work on itsbudget resolution this afternoon. Reuter&#3;
reut2-006.sgm, NO POLICY FOR OR AGAINST CERTIFICATES -- OMB, The U.S. Office of Management andBudget does not have a policy position one way or another onwhether the Agriculture Department's commodity certificateprogram should be expanded or contracted, an OMB official said.    Speaking at the National Grain and Feed Association'sannual convention, Ron Landis, chief of OMB's agriculturalbranch, said instead of an across the board policy for oragainst certificates, OMB has worked and will continue to workvery closely with USDA in determining how many certificatesshould be sent out in each government farm payment.    "Recent evidence by the General Accounting Office and theCongressional Budget Office suggest that certificates can anddo increase budget exposure," Landis said.    But Landis also noted that certificates have numerousbeneficial impacts.    These benefits are helping maintain U.S. pricecompetitiveness, freeing up storage space and saving thegovernment storage and handling costs.    The major drawback to certificates, said Landis, is thatthey increase budget exposure relative to cash through use ofthe pik and roll marketing strategy.    In the pik and roll strategy, a farmer puts his grain underloan, redeems it with certificates, then keeps the differencebetween the price he paid for certificates and the county loanrate.    However, if the benefits of certificates outweigh the addedcosts, OMB officials said they will support continuation of theprogram.    "OMB says certificates have a very positive effect on themarket, but the question is do those positive benefits outweighthe added costs. If they do, then the certificate program isgood," an OMB official told Reuters.    Landis calculated that the redemption of each certificateworth 1,500 bushels results in 176 dlrs in storage savings forwheat farmers, 270 dlrs for corn farmers and 92 dlrs forsoybean farmers. The pik and roll strategy represents a benefitof about 35 cents per bushel per farmer, he said.    But Landis also noted that recent studies by CBO suggestthat an additional one billion dlrs of certificates released tothe market could result in outlays of 1.15 dlrs in cash forevery dlr released in certificates.    OMB is concerned that too many certificates released ontothe market could cause prices to drop too low and governmentcosts to increase too much.    But Landis said OMB has not determined what amount ofcertificates would be excessive. Reuter&#3;
reut2-006.sgm, MANUFACTURERS HANOVER CORP &lt;MHC> SETS DIVIDEND, Qtly div 82 cts vs 82 cts prior    Pay April 25    Record April one Reuter&#3;
reut2-006.sgm, UK TRADE WARY OF HIGHER EC GRAIN LEVY, The European Community may decide toincrease the cereals co-responsibility levy and extend itsscope to cover cereal substitutes if the Commission's 1987/88farm price package is opposed by member states, Edgar Pye,vice-president of the British agricultural merchants'association UKASTA, said.    At the moment the Commission is proposing the rate of levyremain unchanged at three pct - but Pye, addressing a feedmanufacturers' dinner in Glasgow, said this could change if itscontroversial plans to cut cereal prices and introduce an oilsand fats tax are blocked    Pye said UKASTA would continue to fight the cereals levy"tooth and nail."    However, a test case in the European Court of Justicecontesting the legality of the current regulation applying thelevy, which is being backed by the EC feed manufacturers'organisation FEFAC, was not now expected to be heard until theend of 1987, he said. Reuter&#3;
reut2-006.sgm, WILLIAMS INDUSTRIES INC &lt;WMSI> 2ND QTR NET, Qtr ended Jan 31    Shr 10 cts vs three cts    Net 194,842 vs 54,200    Revs 22.2 mln vs 11.2 mln    Six mths    Shr 50 cts vs 28 cts    Net 965,924 vs 502,008    Revs 43.8 mln vs 21.6 mln    Note: Current six mths revs include 16.8 mln dlrs in revsfrom John F. Beasley Construction Co, a wholly owned unit. Reuter&#3;
reut2-006.sgm, HYDRAULIC CO &lt;THC> UNIT LAND SALE PLAN DENIED, The Hydraulic Co said itsBridgeport Hydraulic Co subsidiary had its proposal to use landsales proceeds to help fund capital improvements denied by theConnecticut Department of Public Utility Control.    Hydraulic said its proposal also called for a distributionof the finaical benefits to its stockholders and customers.    However, Hyraulic said the state utility commission wouldconsider similar requests in the future. It said the utilitycommission felt its request was premature and noted  Hydraulicdid not specify parcels of land considered for sale.    The company said it will submit a detailed plan shortly. Reuter&#3;
reut2-006.sgm, MOR-FLO &lt;MORF> LOSES INFRINGEMENT APPEAL, Mo-Flo Industries Inc said thefederal appeals court has affairmed a trial court ruling thatMor-Flo infringed on patents held by &lt;State Industries Inc> forinsulating gas water heaters with polyurethane.    Mor-Flo said it intends to seek a rehearing of thedecision. If the rehearing is denied, further proceedingsbefore the trial court will be held to determine damages.    The company said it made provision for a potential awardand related litigation expenses by taking an after-tax chargeof 384,000 dlrs, or 15 cts a share, against 1986 earnings. Reuter&#3;
reut2-006.sgm, &lt;HANOVER COS INC> 3RD QTR JAN 31 LOSS, Oper shr loss 26 cts vs profit 22 cts    Oper net loss 672,879 vs profit 596,760    Revs 2,188,678 vs 2,364,280    Nine mths    Oper shr loss 1.60 dlrs vs profit 92 cts    Oper net loss 4,278,055 vs profit 2,472,532    Revs 5,896,322 vs 7,497,782    Note: Oper net excludes tax gains of 596,000 dlrs foryear-ago qtr and 2,173,000 dlrs for year-ago nine mths. Reuter&#3;
reut2-006.sgm, U.S. SELLING 12.8 BILLION DLRS OF 3 AND 6-MO BILLS MARCH 23 TO PAY DOWN 2.875 BILLION DLRS, 
