reut2-012.sgm, PAKISTANI DECISION WILL HURT KENYAN TEA EXPORTS, Pakistan's decision to suspend teaimport licences will hurt Kenyan tea exports in the short termwhile exporters seek new markets, sources close to Nairobibroking houses and exporters said.    Broking house officials in the Sri Lankan capital Colomboyesterday told Reuters Pakistan had suspended the licences inorder to link tea imports to Pakistani exports.    The latest available figures show that Kenyan exports toPakistan, mainly tea, were worth 75 mln dlrs in 1985, whileimports from Pakistan amounted to only 4.8 mln dlrs. Kenyaprovides over 50 pct of Pakistan's tea imports.    The Nairobi sources said the Pakistani decision did notcome as a surprise as Pakistan had been complaining of thetrade imbalance for some time.    "We are very disappointed that Pakistan took such action ...(it) will certainly hurt Kenya's tea industry in the short termas Pakistan is Kenya's second largest market," a source at onebroking house told Reuters.    One tea broker said Pakistan's move had already affectedKenya's tea trade and was largely responsible for an averagefall of two shillings a kilo at the export auction in Mombasalast Monday.    "The trend is likely to continue until other countriesreplace Pakistan, which usually buys all qualities of our tea,"he added.    Kenya has for a long time relied on Britain, Pakistan,Egypt and, to a lesser extent the United States, as majormarkets for its tea, the sources added.    Small-scale exporters who export mainly to Pakistan wouldbe worst hit by the Pakistani move as it would take them longerto find new outlets, they said. REUTER&#3;
reut2-012.sgm, SWEDISH PRIME MINISTER'S CHINA VISIT BOOSTS TRADE, An big expansion in bilateral trade isexpected as a result of Swedish Prime Minister IngvarCarlsson's visit to China, a official of China's ForeignEconomic Relations and Trade Ministry official said.    He told the China Daily that petroleum, coal, cotton,non-ferrous metals and electric engines could help balance thetrade running at over three-to-one in Sweden's favour.    Total trade reached 290 mln dlrs last year, up 32 pct on1985, according to Chinese statistics. Swedish sources saidmajor paper mill projects and an aviation agreement would bediscussed during Carlsson's one week visit. REUTER&#3;
reut2-012.sgm, U.S. FIRMS BID TO BUILD JAPAN'S NEXT FIGHTER, The United States is stepping up its bidto win a share of a multi-billion dollar project to buildJapan's next jet fighter, the FSX, as the country's DefenceAgency nears a decision, agency sources said.    General Dynamics Corp &lt;GD.N> and McDonnell Douglas Corp&lt;MD.N> of the U.S. Have separately suggested joint developmentof the FSX with Japanese firms.    Officials said the Agency was still studying the project,but agency sources said the assessment was in the final stages.    The officials said the agency had received a briefing on adevelopment proposal from General Dynamics to modify its F-16jet. The firm's team arrived here on March 30. They declined toelaborate on the briefing.    A team from McDonnell is arriving next Monday with asimilar proposal based on its F/A-18 Hornet, the Agency said.    A Pentagon team of about 10 experts will follow up with aone-week visit starting on April 11 to discuss the projectedplane with the Agency, the officials said.      Five major Japanese makers will also present briefingsthis month, they said. A spokesman for the group includingMitsubishi Heavy Industries &lt;MITH.T> and Kawasaki HeavyIndustries &lt;KAWH.T> declined to disclose details.    The agency has been studying three possibilities:development of a new fighter-bomber by Japanese makers with orwithout foreign participation, modifying F-4EJ Phantoms theAgency now uses or purchase of a foreign aircraft.    The contract will be worth an estimated 1,000 billion yenfor 100 FSXs. The agency plans to decide by June and seekinitial research funds in the 1988 budget, press reports said. REUTER&#3;
reut2-012.sgm, TAIWAN BUYS 54,000 TONNES OF U.S. SOYBEANS, The joint committee of Taiwan soybeanimporters awarded a contract to Cigra Inc of Chicago to supplya 54,000 tonne cargo of U.S. Soybeans, a committee spokesmantold Reuters.    The cargo, priced at 213.87 U.S. Dlrs per tonne c and fTaiwan, is for delivery between April 20 and May 5. REUTER&#3;
reut2-012.sgm, SOUTH KOREAN MONEY SUPPLY FALLS IN MARCH, South Korea's M-2 money supply fell twopct to 33,463.4 billion won in March from 34,030.3 billion inFebruary, provisional Bank of Korea figures show.    It rose a revised 0.5 pct in February and was up 14.7 pctfrom a year earlier.    M-1 money supply fell 8.7 pct to 7,767.8 billion won inMarch against a revised rise of 4.3 pct in February. It hasincreased 8.3 pct since March last year.    Bank officials said the March falls were due mainly tovarious measures by the bank to absorb excess money. REUTER&#3;
reut2-012.sgm, SKANDIA INTERNATIONAL BUYS STAKE IN NEVI BALTIC, &lt;Skandia International Holding AB>,the overseas offshoot of Swedish insurance group Forsakrings ABSkandia &lt;SKDS.ST> said it was buying a 29.9 pct share in theLondon-quoted property and financial services company &lt;NeviBaltic Plc>. No financial details were given.    Nevi Baltic, with a 1986 turnover of 20 mln stg and totalassets of 70 mln stg, is controlled by Norwegian financecompany &lt;Nevi AS> which will retain a 30.1 pct stake in theBritish unit, Skandia said in a statement.    The deal is subject to formal approval from the Swedishcentral bank, the statement added. REUTER&#3;
reut2-012.sgm, LONDON SUGAR OPENS STEADY BUT QUIET, Raw sugar futures had a quiet openingcall of 38 lots with prices holding steady from last night withgains of 20 to 80 cents a tonne, dealers said.    Aug was trading at 157.60 dlrs from 157.40 asked yesterday.    The modest rise continued the recent rally from an oversoldsituation but, dealers noted, there was little fresh physicalsnews to stimulate activity.    Whites tenders are scheduled for next Wednesday by Syriafor 36,000 tonnes and Greece for 40,000 tonnes while Pakistanis due to tender on April 11 for 100,000 tonnes whites, theysaid.    This week has seen whites buying by India and Egypt. REUTER&#3;
reut2-012.sgm, AUSTRALIAN TUG CREWS DELAY FOREIGN CONTAINER SHIPS, Tug crews are preventing the movement offoreign-flag container vessels in and out of the ports ofSydney, Melbourne and Fremantle, shipping sources said.    They said maritime unions imposed bans on late Wednesdayfor reasons that are obscure but seem to be linked with claimsfor a pay rise above the 10 dlrs a week awarded by theArbitration Commission nationally to all workers recently.    Only about 10 vessels are being delayed but the bans willaffect container terminal movements and will disrupt linerschedules, they said.    The dispute goes to the Commission on Monday, they said. REUTER&#3;
reut2-012.sgm, U.K. WHEAT MARKET EASES ON INTERVENTION RELEASE, U.K. Domestic wheat markets dropped aboutone stg per tonne early this morning following overnight newsthat the EC is releasing a further 300,000 tonnes of wheat fromBritish intervention stores for the home market over a threemonth period.    April deliveries of denaturable wheat were offered in EastAnglia at 124 stg and May at 125 stg per tonne, both one stgdown on yesterday's traded rates.    The market is expecting U.K. Wheat futures to show asimilar loss at today's opening. REUTER&#3;
reut2-012.sgm, LONDON COCOA TRADES AT LOWS BY MIDMORNING, Cocoa futures fell to session lows bymidmorning, posting losses from last night of six to two stg atonne in 1987 deliveries, dealers said.    Weekend profittaking by jobbers and general book-squaringfeatured the fall which was aided by steady sterling versus thedollar and lack of offtake in the physicals market.    Dealers said the market was switch and straddle-bound, inthat any pressure on one particular month was certain to bereflected in adjacent deliveries.    The undertone, however, remained cautious as operatorsawait an eventual start to ICCO buffer stock buying, dealerssaid.    The market was originally forecast to open with averagefive stg gains from last night following New York's firmerclose yesterday, dealers said.    But this was largely counter-balanced by currency factors.    Near July traded at its session low of 1,327 stg after onehour versus 1,333 bid last night and an early high of 1,335.    Volume midmorning was 730 lots including 350 lots crossedand 108 switches.    There was no sign of any origin activity. REUTER&#3;
reut2-012.sgm, JAPAN STUDY URGES FOREIGN ACCESS TO FARM MARKETS, Japan should increase foreign access toits farm products market, while encouraging further developmentof domestic agriculture, a government report said.    The white paper on agriculture for the year ended March 31said active participation in writing world farm trade rules atthe next round of General Agreement on Tariffs and Trade (GATT)talks will help prepare Japan to improve access.    Agriculture Ministry sources said the paper marked aneasing in Japan's tough position on agricultural imports whichstressed the need for strict controls on some products tomaintain self-sufficiency in food.    Japan now produces only 30 pct of its annual grain needs,down from 61 pct some 20 years ago, official figures show.    The paper said Japanese agriculture has been slow toimprove productivity and demand/supply imbalances.    The relative shortage of farmland in Japan is mainlyresponsible for higher domestic prices, it said.    The strong yen has meant lower input material prices buthas also resulted in higher agricultural imports which hasworsened working conditions among part-time farmers, the papersaid.    This could make it difficult to improve the industry'sstructure, the paper said.    To solve these problems and to reduce farm product pricesto more reasonable levels, Japan should try to restructure thethe agricultural sector to improve productivity and make itself-supporting, it said. REUTER&#3;
reut2-012.sgm, S. KOREA ATTEMPTS TO COOL OVER-HEATED STOCK MARKET, South Korea will press institutionalinvestors to sell shares they are holding and oblige them tobuy monetary stabilisation bonds if they want to make furtherstock investments, a finance ministry spokesman said.    He said Finance Minister Chung In-yong, Bank of KoreaGovernor Park Sung-sang and officials of the SecuritiesSupervisory Board agreed that the stock market was over-heatedand decided to take measures to cool it down.    Ministry officials said the recent market boom was fuelledmainly by ample liquidity and excessive demand frominstitutions and speculative investors.    The spokesman said industrial firms with bank loans worth50 billion won or more should either issue convertible bonds oroffer new shares in order to raise funds to help repay theirloans.    Securities houses will not be allowed to hold shares worthmore than 40 pct of their paid-in capital and investment trustfirms 50 pct, the spokesman said. But he did not give adeadline for compliance. Other insitutitions should also reducethe volume of their share-holdings, he added.    The composite index, a weighted average of 355 listedfirms, closed at 398.72 yesterday. It started 1987 at 264.82.    The spokesman said industrial firms with bank loans worth50 billion won or more should either issue convertible bonds oroffer new shares in order to raise funds to help repay theirloans.    Securities houses will not be allowed to hold shares worthmore than 40 pct of their paid-in capital and investment trustfirms 50 pct, the spokesman said. But he did not give adeadline for compliance. Other insitutitions should also reducethe volume of their share-holdings, he added.    The composite index, a weighted average of 355 listedfirms, closed at 398.72 yesterday. It started 1987 at 264.82. REUTER&#3;
reut2-012.sgm, SUZUKI RECALLS 63,000 CARS, Suzuki Motor Co Ltd &lt;SZMT> said it isrecalling about 63,000 of its compact 1,300-cc SA-413 cars.    The cars, produced between May 1984 and January 1987, needmodifications because insufficient space between the fuel tubeand the cooling fan switching coupler could cause them to catchfire under ordinary driving conditions, the spokesman said.    Some 53,100 of the cars affected were sold abroad. REUTER&#3;
reut2-012.sgm, HORIZ0N AGREES TO 94.8 MLN STG BID FROM BASS, Bass Plc &lt;BASS.L> and &lt;Horizon TravelPlc> said terms have been agreed for an offer worth around 94.8mln stg for Horizon by Bass.    The offer values each Horizon share at some 0.213 of a Bassordinary share, or 190p. This is based on a price of 892p, theBass share quotation at 1630 gmt on April 2.    Horizon said its board and financial advisers consider theoffer to be fair and reasonable and the board will unanimouslyrecommend acceptance to its shareholders.    Horizon shares jumped 23p to 188 after the announcementwhile Bass shares dipped 13p to 879.    Bass has for some time regarded overseas holidays as anarea for expansion and in pursuit of this objective, acquired a25.6 pct holding in Horizon in 1985 when it set up the jointlyowned hotel company.    Both Bass and Horizon said that Bass's resources willenable Horizon's businesses to expand strongly this year.    On March 30 Bass said it had agreed to sell its PontinsU.K. Holiday camps to a newly formed private company, PontinsLtd, for some 57.5 mln stg. REUTER&#3;
reut2-012.sgm, ROTTERDAM'S MAIN GRAIN TERMINAL CLOSED BY STRIKE, Grain handling at Rotterdam port'smain grain terminal was at a standstill today as members of thelargest Dutch transport union FNV staged a lightning strike forthe third day running.    Pieter van der Vorm, managing director of Graan ElevatorMij (GEM), which handles 95 pct of grain passing through theport, said their main Europoort terminal was out of actionbecause of a strike by technical staff.    The actions, in support of union demands in negotiationsover a new labour agreement, began on Wednesday when grainhandlers stopped work.    Van der Vorm said that if strikes continued on today'sscale for some time vessels coming to unload grain in Rotterdamwould face delays, but this was not happening yet.    Wednesday's actions left GEM's facilities 40 pctoperational, and there were only limited strikes yesterday.    Talks between unions and employers yesterday and todayproduced no result, but FNV spokesman Bert Duim said the unionwas prepared to put their key demand, for a 36 hour workingweek, at the bottom of the agenda.    Van der Vorm said, however, the union's demands on a rangeof issues were far in excess of the management's final offer. REUTER&#3;
reut2-012.sgm, CITIBANK AND TOKYO SOGO SIGN RETAIL BANKING ACCORD, &lt;Citibank NA> and &lt;Tokyo Sogo Bank Ltd>,the largest mutual loan and savings bank in the Tokyo area,have signed an agreement to cooperate on retail banking, aTokyo Sogo spokesman said.    Citibank, a subsidiary of Citicorp &lt;CCI>, plans to startretail banking in Japan and is expected to provide Tokyo Sogowith help in this area, he told Reuters.    The two banks will exchange customer information andcooperate on credit card and foreign exchange business, hesaid. REUTER&#3;
reut2-012.sgm, SOUTH KOREA TO PAY MORE FOR JAPANESE ETHYLENE, South Korea will pay about 20 pct more forethylene imported from Japan in the second quarter of the yearbecause increased plastic production in both countries hasboosted demand and tightened supplies, chemical industrysources said.    South Korea has agreed to pay Japanese trading houses justover 400 dlrs C and F per tonne, up from an average of 350 dlrsin the first quarter and throughout 1986, they said.    South Korean demand for imported ethylene this month hasrisen to 17,000 tonnes from 10,000 last month, and the countrymay face difficulties covering the extra volume, they said.    &lt;Korea Petrochemical Industries Corp>, a producer of highdensity polyethylene (HDPE) and polypropylene, will more thandouble its ethylene requirements to 9,000 tonnes a month from4,000 when it completes a plant expansion at the end of thismonth, the sources said.    &lt;Honan Ethylene Corp's> import requirements have risen to8,000 tonnes a month from 6,000 tonnes last year to meet strongdemand from &lt;Honan Petrochemical Co>, which makes HDPE andethylene glycol, and &lt;Hangyang Chemical>, which produceslow-density polyethylene and vinyl chloride monomer, they said.    But Japan's ethylene plants are already operating at almostfull capacity of 4.5 mln tonnes a year just to fulfill domesticdemand, the sources said.    "And even if Japan had the additional ethylene, there is alogistical problem of finding extra appropriate-sized vesselsto ship it to Korea," said one trading house source.    Japanese trading companies are looking to alternativesources to supply South Korea's needs, including Saudi Arabia,Qatar and Mexico, they said.    But long-haul voyages are expensive as the product has tobe shipped at a temperature of minus 103 degrees centigrade tokeep it in a liquid form, they said.    Japan has no plans to invest further in the ethyleneindustry in order to cope with the additional demand, despiterising prices, trading house sources said.    South Korea has two projects in hand which will increaseits ethylene production capacity by 500,000 tonnes a year bythe end of 1989, so the strong demand surge for imports is onlya medium-term trend, they said. REUTER&#3;
reut2-012.sgm, SWISS 1988 INFLATION SEEN AT TWO PCT - INSTITUTE, Swiss inflation is likely to rise in 1987and 1988 because of inflationary tendencies in the domesticeconomy, the Centre for Economic Research of the FederalInstitute of Technology said in its spring review.    It forecast a rise in consumer prices of two pct in 1988compared with 1.3 pct in 1987. Low import prices in 1986 helpedto keep annual inflation down to 0.8 pct.    The centre said that in general the outlook for the Swisseconomy in 1987 and 1988 remained favourable, despite the moredifficult international economic climate facing exportindustry.    The centre repeated its previous forecast that growth inSwiss domestic product would slow to 2.2 pct in 1987 from 2.5pct in 1986. It revised its forecast for 1988 GDP growth to 1.7pct from 1.6 pct in its last autumn review.    Domestic demand will continue to replace exports as themotor of economic growth. Private consumption will grow bythree pct in 1987 and two pct in 1988 against 3.75 pct in 1986.    Growth in goods exports will slow to 1.75 pct in 1987 from2.1 pct in 1986 but pick up slightly to 2.5 pct in 1988. Allthree figures are well below the Swiss average for recentyears. In 1985, for example, exports increased by 9.1 pct.    The centre said the strength of the Swiss franc, which hasfirmed sharply in recent months, would continue to put pressureon Swiss exporters.    It forecast that imports of goods would grow by a moremodest 4.5 pct in 1987 and 3.25 pct in 1988 than in 1986, whenimport prices fell substantially and imports rose by 8.2 pct.    Industrial production will grow by 1.6 pct in 1987 and 1.2pct in 1988 compared with 4.2 pct in 1986. REUTER&#3;
reut2-012.sgm, LONDON SUGAR TRADES AT SESSION HIGHS BY MIDMORNING, Raw sugar futures firmed to session highsby midmorning, securing gains from last night's basicallysteady close of 1.00 to 1.80 dlrs a tonne in a 166 lot volume.    Shortcovering against an oversold situation continued toplay a part in the extended rally with unsettled dollar ratesversus sterling providing additional support.    Recent and prospective whites buying in the world marketwas supportive but the raws section lacked feature, dealerssaid.    India and Egypt bought white sugar this week while nextweek sees tenders by Pakistan, Greece and Syria, they said.    May was at 154 dlrs from 152.80 asked last night.    All London Daily prices rose two dlrs a tonne on tone.    The Raws price was set at 150 dlrs Fob and 173 dlrs (107.50stg) Cif.    The Whites price was at 192 dlrs from 190 yesterday. REUTER&#3;
reut2-012.sgm, REAGAN'S STRENGTH IN U.S. CONGRESS APPEARS SAPPED, President Reagan's reduced strengthin Congress has been demonstrated by the U.S. Senate's decisionto approve a highway spending bill despite his attempts to vetoit, political analysts said.    "He's very weakened," said William Schneider of the privateAmerican Enterprise public policy group after the Senate voted67-33 yesterday to ignore Reagan's veto of the road bill.    Schneider contrasted Reagan's failure with his previousability to win clear majorities on major issues.    Sustaining his veto required him to win just one-third ofthe votes in either house of Congress.    It was the third consecutive fight over a presidential vetoon which Congress had defied Reagan, whose clout with thelegislature has been greatly diminished by the arms-for-Iranscandal and the capture of a majority in the Senate by theopposition Democratic party in the November 1986 election.    Congress overrode Reagan's veto of a popular water projectsbill in January and last autumn Congress rejected his veto ofeconomic sanctions against South Africa.    But this time the president laid his full authority on theline, even making a rare journey to Capitol Hill to plead forsupport in person.    With both the House and Senate in Democratic hands,analysts say Reagan is swiftly becoming a lame duck, facingdifficulties in enacting his own legislative agenda, especiallygiven the furore over the Iran arms deal.    The situation contrasts with Reagan's first six years inoffice when a Republican-controlled Senate and the backing ofconservative Democrats in the House enabled Reagan to winpassage of most of his legislative priorities.    Reagan's ability to veto legislation he dislikes had beenhis strongest weapon in dealing with Congress, but his defeaton the highway bill was expected to reduce the credibility ofhis veto power.    Senator John Chafee, a Rhode Island Republican, told theNew York Times earlier this week that if Reagan lost "there willbe no brake on -- if you suggest a presidential veto you willbe laughed away."    Yesterday's defeat came two days after the House ofRepresentatives' overwhelming rejection of a presidential vetoon the highways bill by 350 votes to 73.    White House strategists had presented the veto fight as atest of Reagan's strength as he attempted to recover from thescandal over secret arms sales to Iran.    Senate Republican leader Robert Dole of Kansas pleaded withfellow party members to back Reagan because "this may determinethe strength of the presidency for the next 21 months."    The defeat showed the problems facing any president in hisfinal years in office. Reagan's term expires in January 1989.    A majority of Republicans in the House of Representativesand 13 in the Senate apparently decided their own politicalconcerns have become more important than the president's.    "President Reagan, he ain't going to be running in 1988, butI am," Congressman Arthur Ravenel, a South Carolina Republican,said on Tuesday of his decision to back a bill that means moneyand jobs for his home district in new highway construction.    The defeat interrupted a good streak for Reagan, who wonapplause for his selection in February of former Senatemajority leader Howard Baker to replace Donald Regan as WhiteHouse chief of staff, and was believed by most politicalanalysts to have benefitted from a televised speech and a newsconference on the Iran affair last month.    A steady drop in Reagan's job approval ratings appeared tolevel off in recent weeks. The president slumped from about 65pct last autumn to about 42 pct after the Tower Commissionreport in February said he had failed to exercise propercontrol over the dealings with Iran.    His approval rating hovers at 50 pct.    Reagan said he was deeply disappointed by the Senate defeatbut "my efforts to control spending are not diminished."    Democratic leader Robert Byrd said "this isn't going to makeor break the president." REUTER&#3;
reut2-012.sgm, BELGIUM CUTS TREASURY CERTIFICATE RATES, The Belgian National Bank cut interestrates on one, two and three-month treasury certificates to 7.30pct from 7.40 pct effective immediately, the bank said in atelex message.    The Bank last adjusted its short-term treasury certificaterates on March 23, when it also reduced rates for all threeperiods by 0.10 points.    A National Bank spokesman said the latest adjustment wouldbring the rates closer in line with currently prevailinginterbank interest rates.    The spokesman said it was too early to predict whether themove would herald a reduction in discount rate, which currentlystands at eight pct, when the Bank holds its regular weeklymeeting at which the rate is discussed next Wednesday.    The discount rate generally moves in tandem with thethree-month treasury certificate rate. However, there is noformal link and the discount rate was not adjusted followingthe March 23 changes. REUTER&#3;
