reut2-012.sgm, YEUTTER STRESSES IMPORTANCE OF TRADE TALKS, U.S. Trade Representative ClaytonYeutter stressed the importance of trade negotiations to openforeign markets rather than trade restrictions in a statementto the Senate Finance Committee.    "In the long term we cannot repeatedly bludgeon othernations into opening their markets with threats of U.S.restrictions. Rather, we must be able to negotiate credibly forglobal liberalization," Yeutter said.    Yeutter did not mention the recent U.S. trade sanctionsagainst Japanese semiconductors in his testimony on the pendingtrade bill.    Yeutter said the trade bill should increase U.S.competitiveness, aid U.S. trade negotiating leverage, and avoidprovoking foreign retaliation.    He urged Congress to reject provisions that would mandateU.S. retaliation against foreign unfair trade practices.    Yeutter emphasized the importance of the new multilateraltrade negotiating round and called on Congress to quicklyapprove an extension of U.S. negotiating authority.    "We want to open foreign markets and establish and enforcerules of international competition, not foster dependence onprotection and subsidies," he said. Reuter&#3;
reut2-012.sgm, EC MUST EXPLAIN FARM POLICY TO U.S., FRANCE SAYS, The U.S. and the European Community couldenter into a new trade dispute unless urgent action is taken toexplain EC farm policy to the U.S. Congress, French officialsources said.    They said Prime Minister Jacques Chirac planned to urge ECCommission president Jacques Delors to send a team of expertsto Washington as soon as possible.    Chirac returned to Paris this morning after three days oftalks in New York and Washington in which trade andprotectionism featured prominently.    At the centre of the new trade tension is an EC Commissionproposal to tax vegetable oils, the sources said. Reuter&#3;
reut2-012.sgm, C.J. LAWRENCE HAS BUY ON BETHLEHEM STEEL &lt;BS>, Aldo Mazzaferro, analyst at C.J.Lawrence Inc, issued an agressive buy opinion on BethlehemSteel Corp, traders said.    Bethlehem rose 7/8 to 10-3/4, the first time in severalmonths the stock has been over 10 dlrs.    Mazzaferro was not immediately available for comment. Reuter&#3;
reut2-012.sgm, AETNA LIFE/CASUALTY &lt;AET> FILES TO OFFER NOTES, Aetna Life and Casualty Co saidit filed a shelf registration with the Securities and ExchangeCommission for the issue of 200 mln dlrs of debt securities.    Managers of the offering have not been selected. Terms ofthe securities will be based on market conditions, the companysaid.    Proceeds will be added to general funds and used to supportAetna's basic insurance and financial services businesses. Reuter&#3;
reut2-012.sgm, S/P RATES NOMURA INTERNATIONAL PLC BONDS AAA, Standard and Poor's Corp said itassigned a preliminary AAA rating to 150 mln dlrs of 7-1/4 pctguaranteed subordinated bonds due 1992 of Nomura InternationalFinance PLC, the U.K. unit of Nomura Securities Co Ltd.    S and P cited the guarantee, which is a senior obligationof the parent company, the largest of the Big Four securitieshouses in Japan.    The rating agency noted that Nomura Securities has by farthe largest capital base in nominal terms of any securitiesfirm in the world and is conservatively leveraged. Reuter&#3;
reut2-012.sgm, STATUS GAME &lt;STGM> TO SELL CONDOMS, Status Game Corp said it willimmediately start selling condoms through the 500 cigarettemachines it owns and operates in Las Vegas.    The company said it is negotiating a contract with one ofthe world's largest condom maker, which it did not identify,for the production of specially-packaged condoms for thecigarette machine sales. Reuter&#3;
reut2-012.sgm, CENTRONICS CORP &lt;CEN> YEAR LOSS, Oper shr loss 11 cts vs loss 36 cts    Oper net loss 2,383,000 vs loss 4,285,000    Total income 2,194,000 vs nil    NOTE: Resultes restated for discontinued operations andexclude discontinued operations loss 5,755,000 dlrs vs gain4,933,000 dlrs. Reuter&#3;
reut2-012.sgm, SANDSPORT DATA SERVICES INC &lt;SAND> 3RD QTR NET, Feb 28 end    Shr nil vs nil    Net 132,804 vs 53,510    Revs 2,001,107 vs 1,467,742    Avg shrs 73.9 mln vs 56.7 mln    Nine mths    Shr nil vs nil    Net 302,316 vs 171,034    Revs 5,230,014 vs 4,112,562    Avg shrs 74.4 mln vs 56.7 mln Reuter&#3;
reut2-012.sgm, NORTH CAROLINA FEDERAL &lt;NCFS> RAISES PRIME RATE, North Carolina Federal Savingsand Loan Association said it has raised its prime rate to 7-3/4pct from 7-1/2 pct, effective yesterday, following moves bymajor banks. Reuter&#3;
reut2-012.sgm, HEALTH IMAGES INC &lt;HIMG> 4TH QTR LOSS, Shr loss one ct vs loss seven cts    Net profit 108,419 vs loss 241,192    Revs 2,044,882 vs 317,266    Year    Shr loss 18 cts vs loss 23 cts    Net loss 430,027 vs loss 432,982    Revs 5,088,065 vs 416,777    NOTE: Share after preferred dividends. Reuter&#3;
reut2-012.sgm, SHELL CANADA SEES BETTER PROFIT, LOWER SPENDING, &lt;Shell Canada Ltd>, 72 pctowned by Royal Dutch/Shell Group, anticipates an improved levelof earnings in 1987, assuming a continuation of prices andmargins that existed at the end of 1986 and early 1987, thecompany said in the annual report.    Shell previously reported 1986 operating profit fell to 130mln dlrs, excluding a 24 mln dlr unusual gain, from 146 mlndlrs in the prior year.    The company also said 1987 capital and exploration spendingof 420 mln dlrs will be 160 mln dlrs lower than last year, dueto the uncertain short-term outlook.&#3;
reut2-012.sgm, UTILICORP &lt;UCU> SEEKS TO SPLIT STOCK, Utilicorp United Inc said itsmanagement is recommending to the board of directors athree-for-two stock split and an increase in the quarterly cashdividend rate, currently at 37 cts per common share.    The company said it is also submitting to shareholders atits May 21 annual meeting a proposal authorizing an additionalclass of common stock.    Utilicorp said the board of directors will vote on thesplit at its next regularly scheduled board meeting on May 6.    It added that its semi-annual four pct stock dividend willnot change.    Utilicorp said the proposal to create a new class of stock,if approved, will authorize 20 mln shares of Class A commonstock with a par value of one dlr.    The stock could be issued in various series with terms,rights and preferences designated by the board in eachinstance, Utilicorp said.    The company said the new stock is intended to enhanceUtilicorp's ability to carry out future financings,investments, acquisitions or for other corporate purposes. Reuter&#3;
reut2-012.sgm, CHEROKEE GROUP &lt;CHKE> SHARE OFFERING UNDERWAY, Cherokee Group said anoffering of 2,500,000 common shares is underway at 22 dlrs eachthrough underwriters First Boston Inc &lt;FBC> and AmericanExpress Co's &lt;AXP> Shearson Lehman Brothers Inc.    The company is selling 1,800,000 shares and shareholders700,000. Reuter&#3;
reut2-012.sgm, BANK OF SPAIN GOVERNOR SAYS MONEY GROWTH TOO FAST, Bank of Spain governor Mariano Rubio saidthe central bank was worried that money supply was growing toofast, reflecting excessive internal demand in the Spanisheconomy, but added that he was confident recent measures wouldsucceed in restricting money growth.    In testimony to the economic commission of Congress, Rubiosaid the main measure of money supply, the broad-based LiquidAssets in Public Hands, grew at an estimated annualised rate of17 pct in March, the same as in February.    The bank's target range for growth in this measure in 1987is 6.5 to 9.5 pct, compared with 11.4 pct last year.    Rubio said he was aiming for the lower end of the range.    He added that real GDP growth of three pct in 1986 was dueto a six pct increase in real internal demand and a three pctreal drop in the contribution of the external sector.    The aim for 1987 was for the same real growth in GDP but adrop in the internal contribution to 4.5 pct with the negativecomponent of the external sector trimmed to 1.5 pct, he said. REUTER&#3;
reut2-012.sgm, PRESIDENT REAGAN COMING TO CAPITOL TO LOBBY SENATORS ON HIGHWAY BILL VETO, 
reut2-012.sgm, MDU &lt;MDU> PREFERRED STOCK UPGRADED TO A BY S/P, Standard and Poor's Corp said it raisedto A from BBB-plus the preferred stock of MDU Resources GroupInc.    S and P affirmed the company's A-rated first mortgage bondsand A-minus unsecured industrial revenue bonds. About 300 mlndlrs of debt and preferred were outstanding at December 31,1986.    The rating agency cited recent redemptions that reduced thelayer of preferred in the company's capital structure. S and Pexpects fundamentals to remain strong for electric utility andnatural gas pipeline and distribution units. Reuter&#3;
reut2-012.sgm, AMERICAN REALTY &lt;ARB> SETS RECORD DATE FOR OFFER, American Realty Trust said its board hasset April 3 as the record date for its previously announcedrights offering, and the rights will be issued on April 6 andexpire May 22.    Shareholders will be able to subscribe for 1.25 shares foreach share held, at a price of 3.75 dlrs per share. Reuter&#3;
reut2-012.sgm, CARTER-WALLACE INC &lt;CAR> SETS REGULAR PAYOUT, Qtly div 20 cts vs 20 cts prior    Pay June 1    Record April 16 Reuter&#3;
reut2-012.sgm, REAGAN TO LOBBY SENATORS ON HIGHWAY BILL, President Reagan is going to the U.S.Capitol to personally urge senators to support his veto of an88 billion dlr highway and mass transit funding bill,Republican leader Robert Dole of Kansas said.    Reagan will meet with senators at 1115 est/1615 gmt Doletold the senate.    Reuter&#3;
reut2-012.sgm, SOFTWARE PUBLISHING &lt;SPCO> USING SMALLER DISKS, Software Publishing Corp said it hasconverted all of its programs to the three and a half inch diskformat required to run on International Business MachinesCorp's &lt;IBM> new Personal System/2 computers. Reuter&#3;
reut2-012.sgm, EC SETS EXPORT LICENCES ON 20,000 TONNES MAIZE, The European Community Commission awardedexport licences for 20,000 tonnes free market French maize at amaximum export rebate of 129.40 European currency units (Ecus)per tonne, trade sources said here.    All requests for export licences for free market feed wheatand barley were rejected, they said. Reuter&#3;
reut2-012.sgm, FRENCH FARMERS ATTACK LACK OF EC PRICE DECISION, France's major farm union, the FNSEA,criticised the recent European Community farm ministers'meeting for failing to come to any agreement on 1987/88 farmprices before the start of the crop year on April 1.    It was damaging that no important decision was taken andthat there will be no further meeting of EC agriculturalministers before the end of this month when the meat and milkcampaigns started on April 1, the union said in a statement.    The FNSEA also criticised the failure of the ministers touphold their intention to suspend monetary compensatoryamounts, mcas, in the pork sector. Reuter&#3;
reut2-012.sgm, PAKISTAN TO TENDER FOR RBD PALM OLEIN TOMORROW, Pakistan will tender tomorrow for 12,000tonnes of refined bleached deodorised palm olein tomorrow,split in two equal cargo lots for first and second half Aprilshipments, traders said.    The tender will be financed with Islamic Development Bankcredit. Reuter&#3;
reut2-012.sgm, FLORIDA INVESTMENT FIRM SHUT BY SEC, The Securities and Exchange Commission(SEC) had Elliott Enterprises, an investment firm in Naples,Fla., shut down, accusing it of defrauding investors andmisusing funds.    An SEC spokesman in Miami said the agency closed theinvestment holding company and two related firms, ElliottSecurities and Elliott Mortgage Co.    In a complaint filed in federal court in Miami, the SECsaid the firms had at least 1,000 customers who invested around50 mln dlrs.    U.S. District Judge William Hoeveler ordered the companyclosed, appointed a receiver and froze the assets of the firm'sexecutives. Reuter&#3;
reut2-012.sgm, USDA DENIES CHANGES IN TEXAS GULF DIFFERENTIALS, No changes have been made or arebeing planned in the Agriculture Department's calculation ofprice differentials between interior grain locations and theTexas Gulf, a senior USDA official said.    Ralph Klopfenstein, USDA deputy administrator for commodityoperations, told Reuters, "We do not anticipate any changes tobe made" in the Texas Gulf differentials used to calculateposted county prices for corn.    "We do not relate the Texas Gulf structure with theLouisiana Gulf structure at all. It's a totally differentsituation," he said.    Rumors had circulated through the market this morning thatUSDA had widened Texas Gulf differentials in a similar mannerto last weekend's adjustments with the Louisiana Gulf. Reuter&#3;
reut2-012.sgm,  Lawson says his sterling target comments were misunderstood, and insignificant, 
reut2-012.sgm, IBM &lt;IBM> DOWN ON LOWER MORGAN STANLEY OPINION, The stock of International BusinessMachine Corp declined slightly today and shares of DigitalEquipment Corp &lt;DEC> rose after brokerage house Morgan Stanleyand Co reiterated a negative opinion on IBM and a buy onDigital, traders said.    IBM, which this morning introduced four new personalcomputers, the first major overhaul of its PC line since itentered the business in 1981, fell 1-3/4 to 149-3/8.    Digital Equipment rose 1-3/8 to 163-5/8.    Analyst Carol Muratore of Morgan Stanley was unavailablefor comment.&#3;
reut2-012.sgm, LONE STAR &lt;LCE> FORMS JOINT VENTURE, Lone Star Industries Inc saidit formed a joint venture with Monier Ltd of Australia to makeand sell concrete railroad ties in North America.    The equally owned venture, Lone Star Monier Concrete TieCo, initially will operate a new Denver, Colo., plant that willmake 1.75 mln ties ordered by Burlington Northern Inc &lt;BNI>.    In addition, the venture will market ties made at LoneStar's existing Massachusetts facilities.    Based in Chatswood, New South Wales, Monier is amanufacturer of building and construction products and concreteties. Reuter&#3;
reut2-012.sgm, SEC WOULD BACK ONE-DAY DISCLOSURE RULE ON FIVE PCT STOCKHOLDINGS, 
reut2-012.sgm, J.P. MORGAN &lt;JPM> INCREASES PRIME RATE, J.P. Morgan and Co Inc said it israising its prime lending rate to 7-3/4 pct from 7-1/2 pct,effective today.    Most major U.S. banks are now posting a 7-3/4 pct rate.Citibank was the first to announce an increase on Tuesday. Reuter&#3;
reut2-012.sgm, LAWSON SAYS HIS STERLING-TARGET COMMENTS WERE MISUNDERSTOOD AND INSIGNIFICANT, 
reut2-012.sgm, NO EXTENSION ON U.S. DAIRY HERD BUYOUT - LYNG, U.S. Agriculture Secretary RichardLyng said he would not agree to an extension of the 18-monthwhole dairy herd buyout program set to expire later this year.    Speaking at the Agriculture Department to representativesof the U.S. National Cattlemen's Association, Lyng said somedairymen asked the program be extended.    But he said the Reagan administration, which opposed thewhole herd buyout program in the 1985 farm bill, would notagree to an extension.    The program begun in early 1986, is to be completed thissummer. U.S. cattlemen bitterly opposed the scheme, complainingthat increased dairy cow slaughter drove cattle prices downlast year. Reuter&#3;
reut2-012.sgm, BRAZIL TO EXPORT POULTRY, MEAT TO IRAQ FOR OIL, Brazil will export 6,000 tonnesof poultry and 10,000 tonnes of frozen meat to Iraq in exchangefor oil, Petrobras Commercial Director Carlos Sant'Anna said.    Brazil has a barter deal with Iraq and currently imports215,000 barrels per day of oil, of which 170,000 bpd are paidfor with exports of Brazilian goods to that country. Reuter&#3;
reut2-012.sgm, MICHAELS STORES INC &lt;MKE> YEAR FEB ONE, Shr 35 cts vs 19 cts    Net 3,336,000 vs 1,484,000    Sales 115.9 mln vs 76.2 mln    Avg shrs 9,461,000 vs 7,897,000    NOTE: Prior year ended December 29, 1985. Reuter&#3;
reut2-012.sgm, WORLD BANK TO REDEEM EARLY TWO SWISS FRANC BONDS, The World Bank will prepay on July 9,1987 and July 17, 1987 the total amount outstanding of twoSwiss franc public issues, in the first of what could be aseries of similar moves in other capital markets, a spokesmanfor the Bank said in a telephone call from Washington.    The prepayments cover 96 mln Swiss francs of 6-1/2 pctSwiss franc bonds of 1976 and due 1991, lead managed by SwissBank Corporation and 100 mln Swiss francs of 7-3/8 pct bonds of1981 and due 1991, lead managed by Credit Suisse.    Eugene Rotberg, World Bank vice president-treasurer, saidin a prepared statement that the prepayments are being madebecause of the substantial decline in interest rates over thepast two years, the spokesman said.    The World Bank intends to exercise early redemption onselected public issues of its securities in Switzerland andother capital markets if the exercise is financially beneficialand consistent with the Bank's overall funding strategy.    Last month, Rotberg said that the World Bank planned tobring forward to the first half of 1987 its borrowing plans forthe year because of its expectations that world interest rateswill rise by the year end. REUTER&#3;
reut2-012.sgm, U.S. URGED TO STRENGTHEN DEBT STRATEGY, Several industrial nations arepressing the United States to consider whether its debtstrategy, under increasing fire in the developing world, needsto be strengthened, monetary sources say.    While few nations are ready to pour vast sums of money intoradical "debt relief" style solutions to the debt crisis,pressure is building for a greater International Monetary Fundrole in the plan.    But U.S. officials, who are fighting off demands for changeby Congress, are confident they will retain support for theirstrategy which will probably be endorsed in a communiqueissued by the IMF's policy-making Interim Committee.    One Reagan administration official said a recent discussionamong leading industrial countries showed there was "very broadand strong support for continuing the strategy".    The official said in an interview, "I don't sense thatthere's a strong desire to revise the debt strategy, except ofcourse here on (Capitol) Hill."    But monetary sources said some industrial nations, likeFrance and Italy, are troubled by signs the strategy isincreasingly strained. Britain too is said to be concerned.    In late 1985, Washington called on multilateral developmentbanks, like the World Bank, and commercial banks to increaseloans to the 15 major debtors by 29 billion dlrs over threeyears.    In return, the major debtors were expected to undertakereforms promoting inflation-free economic growth, more openmarkets and a reduced government role in the economy.    The IMF was to retain a "central role" in the strategy,shifting its economic reform programs from emphasizingausterity to stressing growth, freer trade policies and foreigninvestment in debtor nations.    But monetary sources said some nations want even moreflexibility from the IMF when it sets economic programs tied toloans for debtor nations.    Such flexibility would include less rigid economic targets-- which often lead to artificial crises when they are not met-- and more reliance on ranges and benchmarks to monitoreconomic performance.    There is also concern that the level of IMF lending is toolow and the commercial banks, themselves under attack fortawdry loan levels to debtors, want to see it increased.    The IMF, which holds its semi-annual meetings with theWorld Bank next week, will only be a small net lender thisyear. Much of its loan disbursements are offset by repayments.    Meanwhile, most countries, including the United States,acknowledge the banks have not lived up to their commitments.    Paul Volcker, chairman of the Federal Reserve Board, is particularly irritated with the reluctance of commercial banksto lend more to reforming debtors, monetary sources say.    New IMF managing director Michel Camdessus is understood tobe worried about the Fund's image in the developing world,where it is often depicted as the source of economic ills.    Camdessus' experience as former chairman of the so-called"Paris Club" of western creditor governments, has given himextensive first-hand experience of the debt crisis.    Brazil, which in February declared an interest paymerntsmoratorium on 67 billion dlrs of commercial bank debt, hasflatly ruled out adopting a program of IMF-sponsored economicreforms. Peru too has rejected an IMF program, curbing debtrepayments to 10 pct of exports.    But the administration official said Brazil's strategy ofusing a moratorium as a negotiating tool might backfire. "It'sprobably turning out to be more complicated than they thought.It underlines the extreme risk that a debtor country takes onitself when it begins down that road," the official said.    Indeed, U.S. banks are laying the groundwork for writingdown their Brazilian loans.    U.S. officials have generally praised most debtors foradopting genuine economic reforms and the multilateralinstitutions for stepping up their lending.    And they point out that Venezuela, Chile and thePhilippines have struck agreement with commercial banksstretching out debt repayments.    But problems still dog assembly of a 7.7 billion dlrs bankloan for Mexico, which many officials acknowledge may be thelast major cash loan for a debtor country.    Instead, banks are being pressed to come up with more novelways of easing the liquidity squeeze in debtor nations.    The prospect of greater official involvement in the debtstrategy depends chiefly on the ability of western nations tocome up with more finance.    While there is sympathy in Congress for various forms ofdebt relief, more U.S. funds for the World Bank or the IMF area virtual impossibility in today's era of budget restraint.    That leaves rich surplus nations like Japan and WestGermany, but neither country favors generalized debt relief.    And the Reagan administration is not inclined to bow toCongressional pressure for changes in regulations governingforeign loans, to make it easier for banks to account fordelays in interest and principal repayments. Reuter&#3;
reut2-012.sgm, MORTON THIOKOL &lt;TKI> UNIT TO MARKET RESINS, Morton Thiokol Inc said its MortonChemical Division entered into an agreement with &lt;MitsubishiChemical Industries Ltd>, Japan, to market extrudable adhesiveresins based on Mitsubishi's Novatec AP product linetechnology.    It said the resins are used in a broad range ofapplications, including barrier co-extrusion with nylon andEthylene-Vinylalcohol Copolymer for film, sheet and bottles. Reuter&#3;
reut2-012.sgm, HAWLEY BUYS U.S. CRIME CONTROL FOR 51.3 MLN DLRS, &lt;Hawley Group Ltd> said it has agreed tobuy &lt;Crime Control Inc> of Indiana for 51.3 mln dlrs cash.    Crime control is a security service group that sells,installs and services electronic security systems which wouldexpand the coverage of Hawley's &lt;Electro-Protective Corp> unit.    Hawley said the acquisition moved it into 12 new marketareas including the West and South-West and would create thefourth largest provider of security systems in the U.S.    Hawley is a Bermuda-based holding company whose mainsubsidiary is the U.K. Security, home improvements and cleaningoperation &lt;Hawley Group Plc>.    Earlier this week, Hawley launched a 196 mln stgrecommended offer for &lt;British Car Auction Group Plc> and lastmonth it said it planned to issue 150 mln dlrs in 15 yearconvertible redeemable preference shares.    It said in a statement that Crime Control reportedoperating profit of 4.0 mln dlrs in 1986 and had end-year nettangible assets of 4.5 mln dlrs. REUTER&#3;
reut2-012.sgm, LAWSON SAYS STERLING TARGET COMMENTS INSIGNIFICANT, Chancellor of the Exchequer Nigel Lawsoncriticised media coverage of comments he made yesterday, whenhe was reported as saying he wanted sterling to stay roughlywhere it was, specifying a rate of around 2.90 marks and 1.60dlrs to the pound.    Holding up a newspaper report on his comments headed"Exchange Rate Targets Set" Lawson told journalists "This story isa complete non-event."    He criticised the report, which said he was now targettingsterling against the dollar and mark. "Nothing of the sortoccurred," Lawson said.    Lawson said he had only told National Economic DevelopmentCouncil panel members what the pound's current dollar/markrates were that day, after saying he was happy with currentsterling levels. He said he had told the NEDC, a tripartiteforum of government, unions and industry, that the pound wouldbe kept near its present level by a mixture of interest ratesand intervention on foreign exchange markets.    He then repeated to the panel that he remained satisfedwith sterling at around its current levels following the Parisaccord in February on currency stabilisation. REUTER&#3;
reut2-012.sgm, EC PUBLISHES LIST OF U.S. BARRIERS TO FREE TRADE, The European Community responded towidespread U.S. criticism of its trade policies by publishingan extensive list of U.S. actions which pose obstacles to ECexports.    A spokeswoman for the EC Commission said the detailed25-page report of alleged malpractices was in response to asimilar document issued by U.S. Administration officials inNovember, and updated a previous EC list.    EC External Trade Relations Commissioner Willy De Clercqsaid its object was to show such actions were not solely takenby trading partners of the U.S. And that "the U.S. Were notinnocents in the matter."    The report covers the entire field of EC-U.S. Commercialrelations and lists more than 30 obstacles ranging from tariffmeasures, import quotas, customs duties, anti-dumpingprocedures, fiscal barriers and export subsidies.    The Commission said not all the barriers mentioned werenecessarily inconsistent with U.S. International obligations,and emphasised many of them could be removed at upcominginternational trade talks. "The purpose of the report is to makeclear that trade practices which impede exports are not aunique problem only faced by U.S. Exporters. Europeans facesimilar problems in the U.S.," it said.    Among the obstacles detailed in the report are importrestrictions on food products, such as cheese, sugar and syrup,certain wines, beers and juices, as well as on firearms andmachine tools.    It also criticises programs to boost U.S. Cereals exports.The document said the U.S.'s three-year export enhancementprogram (EEP), which began in 1985, had subsidised exports of9.7 mln tonnes of wheat, two mln tonnes of wheat flour and 2.8mln tonnes of barley up to mid-March this year. The subsidiesgranted so far were worth about 620 mln dlrs, it added.    "The Community has already reacted where necessary to U.S.EEP subsidies by increasing its exports refunds, and willcontinue to do so," it said, adding the current GATT round wouldalso provide an opportunity to address the subject.    The document also says import quotas maintained by the U.S.On a range of farm products, including sugar, peanuts andcertain cottons, restrict EC exports.    In addition, the report deplores a recent U.S.-Japan accordon semi-conductors, export controls on technology transfers,standards tests in the telecommunications arena and the U.S.Administration's "buy American" public procurement policy. Reuter&#3;
