reut2-006.sgm, VALERO ENERGY &lt;VLO> DEBT UPGRADED BY MOODY'S, Moody's Investors Service Inc said itupgraded Valero Energy Corp's 120 mln dlrs of debt.    Moody's cited an improved leverage position that willresult from Valero's sale of its Valero Natural Gas subsidiaryto Valero Natural Gas Partners L.P., the partial sale of unitsof that partnership to the public, and the simultaneous sale offirst mortgage bonds to institutional investors.    Raised were Valero-backed tax-exempt economic developmentrevenue bonds of Vincennes, Ind, to Baa-3 from B-1, Valero'ssubordinated debt to Ba-1 from B-2 and depository preferredstock to Ba-1 from B-2.  Reuter&#3;
reut2-006.sgm, NL &lt;NL> FILES SUITS AGAINST UNITED CATALYSTS, NL Industries Inc's NLChemicals Inc subsidiary said it filed two complaints against&lt;United Catalysts Inc> for patent infringements andmisappropriation of confidential information.    NL said the patent infringement suit alleges that United'sproduct, Thixogel DSS, infringes on NL's patent protecting itsBentone 128 product.    NL said it filed the patent complaint in the United StatesDistrict Court for the Western District of Kentucky, and themisappropriation complaint in Circuit Court, Jefferson County,Ky. United Catalysts is based in Louisville, Ky. Reuter&#3;
reut2-006.sgm, IRVING TRUST &lt;V> BUYS GULF/WESTERN &lt;GW> UNIT, Irving Bank Corp said it bought thefactoring division of Associates Commercial Corp, a unit ofGulf and Western Co Inc's Associates Corp of North America.    The terms of the previously announced deal were notdisclosed.    It said the assets were transferred to Irving CommercialCorp. Reuter&#3;
reut2-006.sgm, DITTLER BROTHERS SEEK LOTTERY INVESTIGATIONS, Dittler Brothers called forinvestigations by the attorneys general of 24 states inconnection with possible violation of state lottery laws byBally Manufacturing Corp &lt;BLY> and its subsidiary, ScientificGames.    Dittler Brothers said it requested the states' lawenforcement chiefs to investigate the companies following lastweek's determination by a court-appointed auditor thatScientific furnished erroneous information to those 24 statelottery officials.    The states named are spread throughout the country. Reuter&#3;
reut2-006.sgm, AMRE INC &lt;AMRE> 3RD QTR JAN 31 NET, Shr five cts vs one ct    Net 196,986 vs 37,966    Revs 15.5 mln vs 8,900,000    Nine mths    Shr 52 cts vs 22 cts    Net two mln vs 874,000    Revs 53.7 mln vs 28.6 mln Reuter&#3;
reut2-006.sgm, KANSAS LEGISLATOR TO OFFER U.S. 0/92 BILL TODAY, U.S. Rep. Dan Glickman, D-Kan.,chairman of the House Agriculture subcommittee on wheat,soybeans and feedgrains, said he would today introduce a billto apply the so-called 0/92 concept to wheat and feedgrainsproducers.    Glickman told Reuters the measure would allow 1987 winterwheat producers and 1988 feedgrains producers the possibilityof receiving no less than 92 pct of their income supportpayments regardless of how much acreage they planted.    He also said his bill would protect program participantsfrom reduced income payments in the event market prices roseabove the loan rate. Reuter&#3;
reut2-006.sgm, C. ITOH FINANCE (EUROPE) ISSUES EUROBOND, C. Itoh Finance (Europe) Ltd is issuinga 30 mln dlr deferred coupon eurobond, due March 30, 1992 andpriced at 100.1 pct, Wako International (Europe) Ltd said aslead manager.    From the third year the bonds will pay interest at a rateof four pct over six month London interbank borrowed rate(Libor). They will be issued in denominations of 50,000 dlrsand will be listed in Luxembourg. Fees of 0.1 pct comprise twobasis points for management and underwriting and eight pointsfor selling.    Co-leads are Mitsui Trust International and Pru-BacheSecurities International. Pay date is March 30.    The transaction is guaranteed by C. Itoh and Co (Hong Kong)Ltd, Wako International said. REUTER&#3;
reut2-006.sgm, INTERNATIONAL LEASE &lt;ILFC> SELLS TWO JETS, International LeaseFinance Corp said it sold two Boeing 737-200 aircraft andleased one 737-200 in two transactions valued at 28 mln dlrs.    It said the sales will result in a pre-tax gain for itssecond fiscal quarter ending May 31.    The two jets were sold for 18 mln dlrs to an investor groupand the third was leased for five years to Pacific WesternAirlines Ltd of Calgary, Alberta, International Lease said. Reuter&#3;
reut2-006.sgm, HITECH ENGINEERING &lt;THEX> COMPLETES STOCK SALE, HiTech Engineering Co said itcompleted the private sale of 200,000 shares of its commonstock to its chairman and president, Francine Prokoski, for37,500 dlrs.    The company said the proceeds will be used to developproducts under a contract with a private company. Reuter&#3;
reut2-006.sgm, PORTA SYSTEMS CORP &lt;PSI> 4TH QTR JAN 31 NET, Shr 10 cts vs 11 cts    Net 547,000 vs 579,000    Sales 11.0 mln vs 11.1 mln    Year    Shr 46 cts vs 52 cts    Net 2,500,000 vs 2,841,000    Sales 40.7 mln vs 40.5 mln Reuter&#3;
reut2-006.sgm, CALIFORNIA ENERGY &lt;CECI> INITIAL OFFER STARTS, California Energy Co Incsaid an initial public offering of 1,900,000 common shares isunderway at 7.50 dlrs each through underwriters led by LaidlawAdams and Peck Inc.    The geothermal power company said the offering is expectedto close March 19. Reuter&#3;
reut2-006.sgm, DIVI HOTELS &lt;DVH> WARRANTTRADE ON AMEX, Divi Hotels NV of Aruba said itswarrants have started trading today on the &lt;American StockExchange>. Reuter&#3;
reut2-006.sgm, FEDERATED DEPARTMENT STORES INC 4TH QTR SHR 3.64 DLRS VS 3.16 DLRS, 
reut2-006.sgm, &lt;WARNACO GROUP INC> EIGHT MTHS JAN THREE NET, Oper net 46.6 mln    Revs 392 mln    12 mths    Oper net 65 mln vs 47.1 mln    Revs 590 mln vs 591 mln    NOTE: Eight months represents earnings followingacquisition in May 1986 when company went private.    Period ending Jan. 3, 1987 excludes 42.3 mln dlrs ofinterest expenses, 41.6 mln dlrs of acquisition adjusments, and1.7 mln dlrs of income taxes. Reuter&#3;
reut2-006.sgm, BANK OF IRELAND LAUNCHES U.S. PAPER PROGRAM, Bank of Ireland said it launched in theU.S. Market a commercial paper program for up to 200 mln dlrs,becoming the first Irish issuer of paper in that market.    It said the first tranche of an undisclosed amount was soldtoday through Goldman Sachs and Co Inc and that the paper lastweek had received the top A-1/P-1 rating of Standard and Poor'sCorp and Moody's Investors Service Inc, respectively.    In a statement, the Bank of Ireland noted that the U.S.Paper market will provide it with a new source of funding. REUTER&#3;
reut2-006.sgm, BAKER SAYS U.S. OPPOSES SOVIET BANK MEMBERSHIP, Treasury Secretary James Baker saidthe U.S. opposes Soviet membership of the World Bank or theInternational Monetary Fund.    Baker told a House foreign affairs subcommittee, "I thinkour position is absolutely clear on that ... We do not supportand will not support Soviet membership in the World Bank or theIMF."    Baker said the U.S. position was "unqualified andunconditional."    The secretary observed that he has written to congressmanJack Kemp, a New York Republican who is also a presidentialcontender, outlining the U.S. position.    Baker was responding to a questioner who noted that WorldBank President Barber Conable has in the past suggested futureSoviet membership could take place.    Ever since Soviet leader Mikhail Gorbachev suggested Sovietmembership in the General Agreement on Tariffs and Trade --which was also rejected -- there has been speculation Moscowwas interested in joining the international institutions. Reuter&#3;
reut2-006.sgm, GANTOS INC &lt;GTOS> 4TH QTR JAN 31 NET, Shr 43 cts vs 37 cts    Net 2,276,000 vs 1,674,000    Sales 31.9 mln vs 23.9 mln    Avg shrs 5.3 mln vs 4.5 mln    Year    Shr 90 cts vs 69 cts    Net 4,508,000 vs 3,096,000    Sales 98.4 mln vs 75.0 mln    Avg shrs 5.0 mln vs 4.5 mln Reuter&#3;
reut2-006.sgm, &lt;ATLANTIC EXPRESS INC> 1ST HALF DEC 31 NET, Shr not given    Net 788,099    Revs 15.5 mln    NOTE: Company went public during 1986. Reuter&#3;
reut2-006.sgm, RABOBANK LAUNCHES 250 MLN GUILDER BULLET, Rabobank Nederland B.A.Said it is launching under its own management a 250 mln guildereight-year bullet bond with a 6-3/4 pct coupon and priced atpar.    No early redemption is permitted on the bond which will bepaid back in full on April 15, 1995.    Denominations are in 1,000 and five times 1,000 guilders.Subscription closes March 23, payment is April 15. Listing willbe on the Amsterdam Stock Exchange. REUTER&#3;
reut2-006.sgm, SPENDTHRIFT FARMS &lt;SFI> GETS BID FOR CONTROL, Spendthrift Farm Inc said it hasreceived three tentative proposals to acquyire control of thecompany.    It said it is evaluating the proposals and will not commentfurther unless a definitive agreement is reached. Reuter&#3;
reut2-006.sgm, BIOTECHNICA &lt;BIOT> HAS NEW AGRICULTURE UNIT, BioTechnica International saidit established a new subsidiary, BioTechnica Agriculture, todevelop and commercialize microbial and plant products forimproving crops. It said the unit will be based in OverlandPark, Kansas.    It said Charles H. Baker, former president of Rohm and HaasCo's &lt;ROH> Rohm and Haas Seed Inc affiliate, has been namedpresident of the new agriculture unit. The company said Bakerwill also act for a limited time as president of &lt;ChacoEnterprises Inc>, formed to acquire the Hybrex hybrid wheattechnology from Rohm and Haas. Reuter&#3;
reut2-006.sgm, SUNWORLD &lt;SUNA> HAS HIGHER LOAD FACTOR, Sunworld International AirwaysInc said its February load factor rose to 53 pct from 46.1 pcta year earlier and its year-to-date load factor was up to 52pct from the 51 pct posted for the same period last year.    February revenue passenger miles rose to 27.4 mln from 26.4mln, but year-to-date revenue miles declined to 59.7 mln from60.4 mln.    Available seat miles for the month dropped to 51.7 mln from57.2 mln and for the two month period available miles totaled115.3 mln, down from last year's 119.2 mln, SunworldInternational said. Reuter&#3;
reut2-006.sgm, SHEARSON LEHMAN UPGRADES U.S. OIL STOCKS, Analyst Sanford Margoshes of ShearsonLehman Brothers said he recommended a number of oil stockstoday now that it is apparent that OPEC has succeeded inholding to its prescribed production quotas.    "It is clear that OPEC, through jawboning and quotarestraint, will boost the price of oil," Margoshes said.    Prices of oil stocks rose sharply today in response tohigher oil prices and optimism about OPEC quotas. Margoshessaid he recommends Imperial Oil &lt;IMO.A>, up 1/2 to 49-1/8,Standard Oil Co &lt;SRD>, 7/8 to 62-3/4, Exxon &lt;XON> one to83-1/8, and Chevron &lt;CHV> 1-1/8 to 54-7/8.    In addition, Margoshes said he recommended AtlanticRichfield &lt;ARC> on a short-term basis, though he said he isstill suspect about its debt situation. Atlantic Richfield rose1-3/4 to 77.    He said "the market could come down to test the 16 dlr abarrel level again, but the main thrust of investing in oil ispositive right now. Before the year is out we will see higheroil prices."    He noted that belief that the government is interested inraising the strategic reserves is factored into the rise in oilstocks today. Reuter&#3;
reut2-006.sgm,  EC COMMISSION TO VISIT BONN AT KOHL'S INVITATION, West German Chancellor Helmut Kohl hasinvited the European Community's 17-man Commission for talks inBonn next month in a bid to repair strained relations, ECdiplomats said.    The Commissioners, led by President Jacques Delors, willpay a two-day visit to Bonn on April 1-2 when they were due fora meeting with the principal West German cabinet members.    The meeting, the first of its kind between the Commissionand the government of a member state, was originally meant tofocus on problems posed by West Germany's federal constitution.    But they said the meeting was now likely to be dominated byCommission plans to restructure the EC's exhausted finances andits costly farm policy, which have provoked strong oppositionfrom Bonn.    Kohl has written two letters to Delors, complaining thatthe plans would hit West German farmers hard.  His farmminister Ignaze Kiechle has publicly criticised the two Germanmembers of the Commission for failing to oppose them.    This caused protest from Brussels where the Commissiontries to guard the independence of its members from thegovernments that nominate them. REUTER&#3;
reut2-006.sgm, ZAMBIAN MINISTER CONFIRMS COPPER DIVERSION, Minister of Mines Patrick Chitambalaconfirmed that Zambia had ended copper shipments through SouthAfrica and announced that its state-run mining company hadclosed down its liaison office in the white-ruled republic.    He told the official Times of Zambia newspaper in aninterview the government was diverting all mineral exportsalong rail routes to Dar es Salaam in Tanzania and Beira inMozambique. Chitambala declined to say what volume of copperand other minerals were being shipped through these two ports,but he said there had not been any problem with the newarrangements.    "So far our copper has been reaching its destinationswithout hindrance," he told the Times.    The Times of Zambia quoted unnamed sources as saying Zambiaexported 100,000 tonnes of copper through Dar es Salaam and17,000 through Beira in the last quarter of 1986. Diplomaticsources in Lusaka had earlier expressed doubts over Zambia'sability to ship all its copper through Beira and Dar es Salaamwithout causing massive bottlenecks at the ports.    Chitambala also said that the state-run Zambia ConsolidatedCopper Mines (ZCCM) had closed its liaison office inJohannesburg, since it was now redundant. Reuter&#3;
reut2-006.sgm, TAFT CHAIRMAN'S GROUP RAISES TAFT BROADCASTING BID TO 150 DLRS/SHARE, 
reut2-006.sgm, DEVELOPMENT CORP OF AMERICA &lt;DCA> MERGED, Development Corp of Americasaid its merger with Lennar Corp &lt;LEN> was completed and itsstock no longer existed.    Development Corp of America, whose board approved theacquisition last November for 90 mln dlrs, said the merger waseffective today and its stock now represents the right toreceive 15 dlrs a share.    The American Stock Exchange said it would provide furtherdetails later. Reuter&#3;
reut2-006.sgm, TREASURY'S BAKER CALLS FOR NEW BRAZIL PLAN, Treasury Secretary James Baker saidthat Brazil should come up with a new economic plan if it hopesto get additional assistance from commercial banks and others.    In testimony before a House appropriations subcommittee,Baker said that he had given that message to Brazilianofficials earlier this month when they met for talks inWashington.    He said that the so-called Cruzado Plan had worked for awhile, but that new efforts by the government are now required.    Baker made it clear that he backed the decision by theParis Club official creditors to reschedule loans to Brazil,even though the country later froze its payments to commercialbank creditors.    He said that the official loans are being serviced and thatthis was a result of the rescheduling. Reuter&#3;
reut2-006.sgm, CALIFORNIA MICRO &lt;CAMD> TRADES ON NASDAQ, California Micro Devices Corpsaid its stock was included in the March 17 expansion of theNASDAQ market system. Reuter&#3;
reut2-006.sgm, TEVA &lt;TEVIY> SELLS PROMEDICO SUBSIDIARY, Teva Pharmaceutical Industries Ltd,based in Israel, said it sold its wholly owned Promedicosubsidiary, to foreign investors for four mln dlrs.    It said the book value of the unit is about 2.2 mln dlrs.    Teva said it will continue to market Promedico's productsthrough its wholly owned subsidiary, Salomon, Levin and ElsteinLtd.    Reuter&#3;
reut2-006.sgm, ERC &lt;ERC> GETS THIRD CONTRACT, ERC International said itsFacilities Management Group subsidiary, ERCI Facilities ServiceCorp, was awarded a 2.1 mln dlrs contract in the drugrepository field, the third such contract in nine months.    It said that under the five-year contract, it will managethe National Cancer Institutes's pre-clinical drug repositoryof more than 400,000 drugs and chemicals used to test antitumoractivity in animals and tissue culture systems. Reuter&#3;
reut2-006.sgm, BAKER SAYS U.S. NOT SEEKING IADB VETO, Treasury Secretary James Baker saidthat the United States was not seeking loan veto in itsnegotiation for voting power at the Inter-American DevelopmentBank.    Discussing the ongoing negotiation, Baker said the U.S.position is that the countries that pay in the most should havethe greatest say over the loan decisions.    The U.S. is seeking the power to block loan votes with oneother country, and the issue will be discussed in Miami laterthis month at the annual meeting of the Latin development bank. Reuter&#3;
reut2-006.sgm, NEW MILFORD SAVINGS BANK &lt;NMSB> RAISES PAYOUT, Qtly div 25 cts vs 20 cts prior    Pay April 21    Reord March 27 Reuter&#3;
reut2-006.sgm, K MART &lt;KM> ENDS TALKS TO SELL STORES, K Mart Corp said recent talks to sell65 remaining Kresge variety stores and their underlying realestate to F.W. Woolworth Co &lt;Z> have ended.    Robert Stevenson, K Mart vice president, told Reuters thetalks, which began about six weeks ago, ended. He declined togive a reason.    Kresge is the forerunner of what is now the K Mart chain.The name was changed to K Mart in 1977, Stevenson said.    "We're selling and buying real estate in our real estatedivision, and Woolworth was interested in some of ourproperties. The talks were of a casual nature," he said.    The 65 Kresge stores that are scattered around the countryin downtown and suburban locations, he said.    Stevenson said K Mart will continue to operate the stores."The stores are profitable. The only decision K Mart has madeis that we will continue to operate them," he said    Kresge had been a nationwide chain of 900 variety stores. Reuter&#3;
reut2-006.sgm, INSTITUTE OF CLINICAL PHARM PLC &lt;ICPYY> YEAR, Shr 20 ct vs 27 cts    Net 1,048,000 vs 1,368,000    Revs 9,457,000 vs 5,386,000    NOTE: Dollar amounts converted from Irish pounds at noonbuying rate of the Federal Reserve Bank of New York at Dec 31,1986, of 1.4105 dlr per one Irish pound. The equivalent rate atDec 31, 1985, was 1.2470 dlr equals one Irsh pound. Full nameof company is The Institute of Clinical Pharmacology PLC, basedin Dulbin, Ireland. Reuter&#3;
reut2-006.sgm, LAWSON SAYS U.K. BASIC RATE INCOME TAX TO BE CUT TO 27 PCT FROM 29 PCT, 
reut2-006.sgm, U.K. GROWTH RATE SEEN AT THREE PCT THIS YEAR, Chancellor of the Exchequer NigelLawson, presenting his budget for fiscal 1987/88 to parliament,said U.K. Economic growth was forecast at three pct in calendar1987.    He said the Treasury expected a current account balance ofpayments deficit in 1987 of 2.5 billion stg, after a 1.1billion shortfall in 1986. Inflation is expected to be 4.0 pctat the end of 1987, he said, adding it may exceed 4.5 pct bythe summer before falling back to 4.0 pct by the end of theyear.    The planned PSBR for 1987/88 was 4.0 billion stg unchangedwhen compared with the likely outturn for fiscal 1986/87,Lawson said.    Although no explicit target was set for the broad sterlingM3 money supply, Lawson said broad money will continue to betaken into account in assessing monetary conditions as well asthe exchange rate.    The low outturn of the PSBR in 1986/87 was mainly due tothe buoyancy of non-oil tax revenues in general, and thecorporation tax paid by an increasingly profitable businesssector in particular.    On oil prices, Lawson said he was sticking to his earlierassumption that North Sea crude prices will average 15 dlrs perbarrel in calendar 1987. The treasury would strive to keep thePSBR at 1.0 pct of GDP in future, he said. Reuter&#3;
reut2-006.sgm, BUTLER &lt;BTLR> TO BUY BACK 600,000 SHARES, Butler Manufacturing Co saidits board authorized the repurchase of up to 600,000 shares, or12 pct of its outstanding common stock.    It said purchases will be made in open market and privatetransactions through Kidder, Peabody and Co.    Butler currently has 5,001,848 shares outstanding. Reuter&#3;
reut2-006.sgm, ROYAL PALM &lt;RPAL> SAYS RESTRICTIONS LIFTED, Royal Palm SavingsAssociation said it has entered into an agreement with theFederal Home Loan Bank Board and the Florida Department ofBanking and Finance resulting in the removal of limitationswhich had severely restricted its growth and lending.    The company said it will now be permitted to grow about 70mln dlrs in calendar 1987, or about 15 pct for this year, andat the same rate thereafter.    Royal Palm said under the accord, it will resume commercialand nonresidential lending but will place substantial emphasison residential loans.    The company said it agreed to adopt new policies andprocedures but did not elaborate. Reuter&#3;
reut2-006.sgm, WEST GERMAN FEED OUTPUT SEEN DECLINING, West German feedstuffs production isexpected to decline further after it dropped to 16.5 mln tonnesin 1986 from 16.7 mln the previous year, the West German FeedStuff Industry Association (MFI) said.    Association president Ulrich Wagner told a news conferenceWest Germany's rate of self sufficiency in the feedstuffssector is expected to fall below 70 pct this year from around75 pct in 1986.    He attributed the expected decline to introduction of milkquotas in 1984, aimed at curbing EC milk production, and tocheaper imports from abroad.    "Our industry's output is not even close to stagnation,"Wagner said. "In the long term we expect annual production todecline steadily."    The only sector which saw a slight increase last year, by0.6 pct, was feed for poultry which rose to 3.25 mln tonnesfrom 3.23 mln, he said.    Wagner predicted that the sales volume in feed for dairycattle will decline even more this year because of the furthercut in milk output from April. Reuter&#3;
reut2-006.sgm, ICN BIOMEDICALS INC &lt;BIMD> 1ST QTR FEB 28 NET, Shr 10 cts vs eight cts    Net 856,000 vs 574,000    Sales 9,593,000 vs 9,232,000    Avg shrs 8,809,000 vs 6,969,000 Reuter&#3;
reut2-006.sgm, APPLIED CIRCUIT TECHNOLOGY &lt;ACRT> 1ST QTR LOSS, Period ended January 31.    Shr loss two cts vs loss 12 cts    Net loss 192,370 vs loss 1,494,146    Revs 6,751,830 vs 2,278,842    Note: Full name Applied Circuit Technology Inc. Reuter&#3;
reut2-006.sgm, FRISCH'S RESTAURANTS INC &lt;FRS> SETS QUARTERLY, Qtly div 5-1/2 cts vs 5-1/2 cts prior    Pay April 16    Record April Six Reuter&#3;
reut2-006.sgm, FED SETS TWO BILLION DLR CUSTOMER REPURCHASE, FED SAYS, 
reut2-006.sgm, NYSE REVIEWS PROGRAM TRADING, The &lt;New York Stock Exchange> said itis undertaking a review of the long-term effects on securitiesmarkets of computer-driven trading techniques known as programtrading.    The NYSE said, "The study will review major new tradingtechniques involving programmed portfolio hedging and indexarbitrage for their potential benefits and risks to thefinancial system.  It will also explore the regulatoryimplications of these trading techniques and whether theirincreased use could possibly lead to market abuse."    The exchange said a final report is expected before the endof 1987.  It said program trading is becoming increasinglyimportant as a market factor. Reuter&#3;
reut2-006.sgm, FED ADDS RESERVES VIA CUSTOMER REPURCHASES, The Federal Reserve entered the U.S.Government securities market to arrange two billion dlrs ofcustomer repurchase agreements, a Fed spokesman said.    Dealers said Federal funds were trading at 6-1/16 pct whenthe Fed began its temporary and indirect supply of reserves tothe banking system. Reuter&#3;
reut2-006.sgm, FEDERATED DEPARTMENT STORES INC &lt;FDS> 4TH QTR, Jan 31 end    Shr 3.64 dlrs vs 3.16 dlrs    Net 171.3 mln vs 154.0 mln    Sales 3.44 billion vs 3.23 billion    Avg shrs 47.1 mln vs 48.8 mln    Year    Oper shr 6.23 dlrs vs 5.88 dlrs    Oper net 301.9 mln vs 286.6 mln    Sales 10.51 billion vs 9.98 billion    Avg shrs 48.5 mln vs 48.8 mln    NOTE: Latest year net excludes 14.3 mln dlr charge fromloss on early debt extinguishment.    Net includes charges 15.7 mln dlrs in both periods oflatest year vs charges 23.9 mln dlrs in both periods of earlieryear from merger of divisions.    Investment tax credits three mln dlrs vs 8,900,000 dlrs inquarter and 4,900,000 dlrs vs 16.4 mln dlrs in year.    Latest year net includes nine mln dlr provision for loss ondisposition of two Abraham and Strauss stores and preopeningexpenses for another.    Latest year net includes gain from sale of interest in FortWorth, Texas, shopping center of 9,500,000 dlrs.    Latest year net both periods includes gain 9,100,000 dlrsfrom sale of interest in Memphis, Tenn., shopping center.    Prior year net includes gain 6,600,000 dlrs on sale ofBoston Store division. Reuter&#3;
reut2-006.sgm, CLOTHESTIME INC &lt;CTME> 4TH QTR NET, Shr 12 cts vs 10 cts    Net 1,683,000 vs 1,407,000    Sales 42.2 mln vs 28.8 mln    Year    Shr 83 cts vs 70 cts    Net 11,908,000 vs 10,005,000    sales 160.3 mln vs 126.5 mln Reuter&#3;
reut2-006.sgm, PHOENIX CANADA OIL TO APPEAL RULING, &lt;Phoenix Canada Oil Co Ltd> said itintends to appeal a ruling in U.S. Federal District Court ofDelaware on its suit against Texaco Inc &lt;TX>, Chevron Corp&lt;CHV>, Chevron's Gulf Oil unit and their Ecuador subsidiaries.    The court ruled against Phoenix's claim that a royalty itheld should have entitled it to a share of the 160 mln U.S.dlrs paid to the defendants when they sold 62.5 pct of theirworking interest in Ecuador oil operations, Phoenix said.    However, the court did award Phoenix 1,250,000 Canadiandlrs in underpayments, the company said.    Phoenix Canada Oil said the fiduciary relationship thatexisted between Phoenix, as the royalty owner, and thedefendants, as the working interest operators, was fundamentalin the oil industry and was not reflected in the court'sruling. Reuter&#3;
