reut2-006.sgm, BUNDESBANK SEEN STEERING STEADY MONETARY COURSE, The Bundesbank is likely to steer asteady monetary course over the next few weeks and a change incredit policies is not expected at tomorrow's regular centralbank council meeting, bank economists and dealers said.    "There is no need for action," Hermann Remsperger, chiefeconomist of Berliner Handels- and Frankfurter Bank (BHF) said.    Others noted that exchange rates are stable after lastmonth's Group of Six agreement in Paris and central bank moneystock growth is still well above the three to six pct targetzone, so a change in credit policies could be ruled out.    One money market dealer said comments by BundesbankPresident Karl Otto Poehl at a private seminar in Duesseldorftwo weeks ago hinting at another interest rate cut onlyindicated the Bundesbank might act if conditions changed.    Bank economists said U.S. Pressure on West Germany tofurther ease credit policies had receded since the Paris pact.    But such demands could re-emerge if West Germany failed tostimulate its economy enough to affect the massive U.S. Tradedeficit.    Remsperger said continued strong money supply growth alsoprecluded a further cut in official interest rates.    Central bank money stock was growing at an annualized 7.5pct in February, unchanged from the 7.5 pct in January.    Economists said some of the 18 members of the central bankcouncil were worried about the continued overshoot in the moneysupply target and were bound to resist any moves to cut rates.But Poehl played down the risk of inflation.    Economists said the fact that money stock growth remainedstable last month was a success. Some said it was likely toreturn to within the target range later this year.    "The special factors which boosted money supply growth lastyear are disappearing," one economist said.    He said some 75 pct of the money supply increase in 1986was caused by a sharp rise in the inflow of foreign funds.    This trend had been reversed recently and with domesticcredit demand likely to remain at steady levels, money stockgrowth was expected to narrow in the medium-term.    These developments were increasing the Bundesbank's scopefor a rate cut in the medium-term, economists said.    Money market dealers said period rates remained littlechanged, indicating no change in credit policy was expected.    Call money rates declined to 3.75/80 pct from 3.90/95yesterday, with the market well stocked with liquidity.    Dealers said call money was soft because tax payments onbehalf of customers had been less than expected so far. Butrates were likely to tighten again as soon as the full effectof this month's major tax payment period is felt. Payments forthe federal railways bond are also likely to burden the market.    The Bundesbank did not inject liquidity via a securitiesrepurchase agreement this week, but countered a tightening inrates on Monday by injecting funds through government-ownedbanks.    Dealers said recent securities repurchase pacts had shownthe Bundesbank clearly wanted call money rates stable at 3.80.    One dealer said, "If the central bank wanted lower interestrates, it would first of all drive call money rates down."    Banks remained relatively well stocked with minimum reserveassets. They held 52.9 billion marks in minimum reserves onMonday, averaging 53.7 billion marks over the first 16 days ofMarch. A requirement of around 51 billion is expected. REUTER&#3;
reut2-006.sgm, U.S. REAL GNP ROSE 1.1 PCT IN FOURTH QUARTER, The U.S. Gross National Product,after removing the impact of inflation, increased at a revisedannual rate of 1.1 pct in the fourth quarter, the CommerceDepartment said.    That was down from an earlier preliminary 1.3 pct riseestimated a month ago and down from the 2.1 pct rise in thefourth quarter of 1985.    The final fourth quarter revision, however, left unchangedthe previous estimate of a 2.5 pct increase in GNP for all of1986 over 1985.    The revised estimate for fourth quarter GNP partlyreflected a downward revision in inventories to a totaldecrease of 28.5 billion dlrs in the fourth quarter, thedepartment said.    The revisions also indicated personal consumption spendingdecreased 2.2 billion dlrs in the fourth quarter after anincrease of 39.6 billion dlrs in the third quarter.    Exports of goods and services rose 15.3 billion dlrs aftera decline of 9.4 billion dlrs in the third quarter. Importsdecreased 700 mln dlrs in the final quarter, in contrast to anincrease of 20.9 billion dlrs in the third quarter. REUTER&#3;
reut2-006.sgm, JAPAN TELECOM MERGER COULD INVOLVE U.K.,U.S. FIRMS, Cable and Wireless PLC &lt;CAWL.L> and thePacific Telesis group &lt;PAC.N> may take part in a proposedmerger of two rival firms seeking to enter Japan'sinternational telecommunications market, a senior industryofficial said.    Fumio Watanabe, head of a telecommunications committee withthe Federation of Economic Organisations (Keidanren), told anews conference Japanese shareholders in the two consortiumsagreed that the U.S. And British companies will be invited toparticipate in the new merged firm.    The planned linkup will satisfy Tokyo's request that onlyone private company should enter the market.    The two consortiums, &lt;International Digital CommunicationsPlanning Inc> (IDC) and &lt;International Telecom Japan> (ITJ),were set up in 1986 to compete with monopoly &lt;Kokusai DenshinDenwa Co> (KDD) after the market was deregulated in 1985.    Watanabe said the Post and Telecommunications Ministrywanted only one competitor for the time being because of thesize of the Japanese telcommunications market and that foreigninvestors will only be allowed to hold a minority stake.    He estimated the two foreign firms' share in the mergedconsortium at less than three pct and added that even thelargest shareholders could own only some five pct .    Cable and Wireless and Japanese trading house &lt;C. Itoh andCo.> each have a 20 pct stake in the IDC consortium whilePacific Telesis and Merrill Lynch and Co. Inc. &lt;MER.N> jointlyhold 13 pct .    ITJ is headed by a rival group of trading houses. Severalfirms including Toyota Motor Corp. &lt;TOYO.T>  belong to both.    Watanabe said progress was being made towards a mergeragreement and added that Japanese industry agreed with thegovernment on having only one private consortium as twocompanies might invest "excessive" amounts.    He said talks with Cable &amp; Wireless will continue thisweek. REUTER&#3;
reut2-006.sgm,  EC COMMISSION PLANS TO OPEN UP PUBLIC CONTRACTS, The European Community executiveCommission today announced plans to open up governmentcontracts to companies throughout the 12-country bloc.    Internal Market commissioner Lord Cockfield told a newsconference the Commission will shortly make proposals to openup contracts awarded by state-owned utilities such astelecommunications, transport, energy and water.    About 400 billion European Currency Units worth ofcontracts are awarded by governments and public bodies in theEC every year. The Commission says only 20 pct of these areopen to competition from outside the country. REUTER&#3;
reut2-006.sgm, FERRUZZI NEGOTIATING EUROPEAN ACQUISITION, Italy's &lt;Gruppo Ferruzzi> is in theadvanced stages of negotiations that could result in anacquisition worth "some hundreds of billions of lire" in theEuropean agro-industrial sector, a company spokesman toldReuters.    The spokesman declined to identify the other party orparties involved in talks, or whether a complete takeover wasunder discussion, but said an Italian newspaper report thatFerruzzi was studying the possibility of advancing an offer for13 European cereal processing plants owned by the U.S. GroupCPC International Inc &lt;CPC.N> was incorrect.    The spokesman said that possibility had been evaluated byFerruzzi but that the company's attention at the moment was"decisively in another direction."    The spokesman, responding to a report in the Italianeconomic daily Il Sole-24 Ore that Ferruzzi was considering apossible bid for the CPC plants, told Reuters his company hopedto conclude the talks currently underway in a couple of months.    The spokesman said that since the U.K. Government lastmonth blocked Ferruzzi's bid to acquire &lt;British Sugar Plc>,the company had been looking at other investment opportunities. REUTER&#3;
reut2-006.sgm, U.S. CORPORATE PROFITS ROSE 6.1 PCT IN 4TH QTR, Profits of U.S. corporations, aftertax liabilities, increased 8.3 billion dlrs, or 6.1 pct, in thefourth quarter to a seasonally adjusted annual rate of 144.2billion dlrs, the Commerce Department said.    The increase was the largest since the third quarter of1983, when profits rose 11.4 pct and followed a 5.5 pct rise inthe third quarter of 1986.    For the full year 1986, profits after tax were 2.5 billiondlrs, or 1.9 pct, higher than in 1985 at a total of 133.9billion dlrs, the department said.    The department also estimated corporate profits to reflectretroactive provisions of the Tax Reform Act of 1986.    It said profits after tax fell 11.2 billion dlrs in thefourth quarter after a decline of 10.3 billion dlrs in thethird quarter.    Profits before taxes and from current production rose 2.8pct to 310.4 billion dlrs after rising three pct in the thirdquarter.    Profits tax liability rose to 114.6 billion dlrs in thefinal quarter last year from 104.4 billion dlrs in the thirdquarter, the department said. Reuter&#3;
reut2-006.sgm, MALAYSIA TO CUT OIL OUTPUT FURTHER, TRADERS SAY, Malaysia's state oil company Petronaswill cut oil production to 420,000 barrels per day (bpd) fromMay 1, trade sources said.    Malaysia cut its 510,000 bpd target output by 10 pct lastSeptember to support Opec moves to boost prices, and the latestcut would reduce output by 17.5 pct from 1986's target level.    Petronas said in February that Malaysia would maintain its10 pct production cutback until mid-1987.    However, the Finance Ministry said in its annual reportthat Malaysia's crude oil output was expected to rise to anaverage 510,000 bpd in 1987.    The ministry's forecast assumed average 1987 crude pricesat 13 dlrs/barrel (bbl), but prices have risen enough to permitfurther production cutbacks, the sources said.    Malaysia's benchmark Tapis blend fetched above 18 dlrs/bblthis year against a low of 10.50 dlrs/bbl in July, they said.    Traders said further reductions by Malaysia would add tothe tight spot availabilities of Asian grades caused by reducedIndonesian and Chinese crude output.    The cutback will also help Malaysia maintain prices, asthere is concern some buyers want to reduce term purchases dueto the availability of cheaper alternatives, the sources said.    In addition to term sales, Petronas has been offering twoto three 400,000 bbl spot cargoes of Malaysian crude each monthfor sale through tender, the sources said.    However, this practice is likely to dwindle given thereduced scale of production, they said.&#3;
reut2-006.sgm, INTERCARE &lt;CARE> SAYS ACQUISITION TERMINATED, InterCare Inc said it hasagreed to terminate the proposed acquisition of &lt;UniversalCare> because &lt;First Jersey Securities> has withdrawn asunderwriter for a proposed offering of InterCare securities.    The company said the offering was to have raised 7,500,000dlrs for working capital through the sale of equity and debtand would have also financed the 1,897,000 dlr cash portion ofthe Universal Care purchase price.  In addition, 1,700,000 dlrswould have been used to repay debt.    InterCare said to date it has incurred about 500,000 dlrsin expenses in connection with the proposed offering.    The company said to improve its working capital position,it plans to reduce operating expenses by decreasing hours ofoperation and its workforce and selling some assets.    As of October 31, the copmpany said it had a workingcapital deficit of 2,301,000 dlrs, on a pro forma basis toinclude recently acquired U.S. Medical Enterprises Inc. Reuter&#3;
reut2-006.sgm, RANK ORGANISATION CURRENT TRADING SATISFACTORY, Rank Organisation Plc &lt;RANK.L> saidtrading in the current year had continued satisfactorily takinginto account seasonal fluctuations.    Association companies, such as &lt;Rank-Xerox Ltd>, indicatedan improved performance, a statement issued at the annualmeeting said.    It said it planned to spend some 15 mln stg on refurbishingits Odeon cinema chain and the Rank Film Distributors unit wascommitted to spending 20 mln to secure internationaldistribution rights of films.    Investment in new activities in 1987 should continue at arelatively high level to exploit opportunities for growth. Ranksaid it did not exclude the possibility of making large as wellas small acquisitions.    In the year to end-October, Rank reported a rise in pretaxprofits to 164.1 mln stg from 136.0 mln previously.    Rank shares firmed in morning trading to be quoted at 712pat 1320 GMT after 697p at last night's close. REUTER&#3;
reut2-006.sgm, HARCOURT BRACE SETS MARCH 30 DEADLINE IN HARPER AND ROW BID, 
reut2-006.sgm, SHIPS HELD UP AT CALCUTTA, Some 10 Indian ships have been held upat Calcutta port after four days of industrial action by localseamen, a spokesman for the shipowners' association INSA said.    The dispute has prevented local crewmen signing on and off,but has not affected foreign ships with international crewsdocking at Calcutta, which exports tea and jute and importsmachinery, crude oil and petroleum products, the spokesmansaid.    Foreign ships may also suffer if dock workers join theaction, he said. The Shipping Corporation of India (SCI) hasasked its ships to avoid the port until the dispute is over,National Union of Seafarers in India president Leo Barnes said. Reuter&#3;
reut2-006.sgm, COOPERVISION INC &lt;EYE> 1ST QTR JAN 31 NET, Shr 3.65 dlrs vs 33 cts    Net 82.5 mln vs 7,300,000    Sales 94.4 mln vs 85.4 mln    Avg shrs 22.6 mln vs 21.7 mln    NOTE: Current year net includes pretax gain 175.2 mln dlrson sale of ophthalmic business and loss 17.9 mln dlrs posttaxfrom repurchase of debt.    Prior year net includes 120,000 dlr loss from discontinuedoperations. Reuter&#3;
reut2-006.sgm, COOPERVISION &lt;EYE> DELAYS ANNUAL MEETING, CooperVision Inc said it hasdelayed its annual meeting to June 22 from May 14 to allow itsboard to review possible recapitalization options before themeeting.    CooperVision today reported first quarter net income of64.6 mln dlrs, after a 175.2 mln dlr pretax gain from the saleof its ophthalmic business to Johnson and Johnson &lt;JNJ> for 260mln dlrs in cash and a 17.9 mln dlr posttax charge from a debtrepurchase.  Sales were 94.4 mln dlrs.  A year earlier itearned 7,300,000 dlrs after a 120,000 dlr loss fromdiscontinued operations, on sales of 85.4 mln dlrs.    The company said an aggressive program of investmentspending to maintain or increase market shares its its two corebusinesses will accelerate sales growth this year but hold backincreases in operating income in the near future.    CooperVision said "Furthermore, until the entire net cashproceeds from the recent sales of several of our businesses areemployed to reduce indebtedness, make strategic acquisitionsand/or are otherwise employed in relation to a possiblerecapitalization of the company, recovery of net income will beheld back by the loss, particularly of the tax income, of the(ophthalmic) pharmaceutical business sold to Johnson andJohnson." Reuter&#3;
reut2-006.sgm, JEFFERIES IS MAKING MARKET IN GENCORP &lt;GY>, Jefferies and Co Inc said it ismaking a market in Gencorp at 100 bid and 115 offerred. Reuter&#3;
reut2-006.sgm, GREAT ATLANTIC AND PACIFIC TEA CO 4TH QTR OPER SHR 55 CTS VS 36 CTS, 
reut2-006.sgm, MOBEX SAYS ABOUT 87 PCT OF GRANT &lt;GTX> TENDERED, Mobex Corp said 2,088,461 GrantIndustries Inc common shares, about 87 pct of the 2.4 mlnoutstanding, have been tendered in response to Mobex's offer.    The company said its offer of 7.75 dlrs a share for thestock has been extended to 2000 EST March 23 from 2400 March 17. Reuter&#3;
reut2-006.sgm, HARCOURT BRACE &lt;HBJ> SETS HARPER &lt;HPR> DEADLINE, Harcourt Brace Jovanovich Incsaid it has told Harper and Row Publishers Inc representativesthat it intends to withdraw its proposal to acquire Harper andRow for 50 dlrs per share in cash if the parties have not madesatisfactory progress in discussions by the close of businesson March 30.    Harcourt Brace said, "We do not wish to put undue pressureon Harper and Row, but we also, in fairness to our ownshareholders, cannot allow an offer of such magnitude to lie onthe table too long."    Harcourt said three of its senior officers and itsinvestment bankers met yesterday with investment bankers forHarper and Row to discuss the Harcourt Brace offer.    Harcourt Brace said it will only pursue the acquisition ifa mutually-satisfactory merger agreement can be negotiated.    Last week, a group formed by Theodore Cross offered toacquire Harper and Row for 34 dlrs per share.  The group heldabout six pct of Harper and Row.    In addition, New World Pictures Ltd &lt;NWP>, holder of 4.5pct of Harper and Row, had offered to discuss a merger withHarper and Row. Reuter&#3;
reut2-006.sgm, DIXONS GROUP SAID IT ACCEPTS 54 PCT OF CYCLOPS SHARES IN TENDER, 
reut2-006.sgm, CZECHOSLOVAKIAN MILK POWDER BANNED BY UAE, The United Arab Emirates, UAE, hasbanned a Czechoslovakian milk powder because checks showedunacceptable radiation levels, government officials said.    They said stocks of the powdered milk are being withdrawnfrom the market following checks on food imported from Europesince last year's Chernobyl nuclear accident in the SovietUnion.    The UAE three weeks ago banned two brands of Austrianpowdered milk for the same reasons. Reuter&#3;
reut2-006.sgm, BANKERS TRUST ISSUING STG/DLR CURRENCY WARRANTS, Bankers Trust International Ltd said itis issuing 200,000 stg call/dlr put currency warrants at aninitial offer price of 31.25 dlrs per warrant.    The issue is guaranteed by Bankers Trust New York Corp.    Each warrant entitles the holder to exchange 500 dlrs forstg at a rate of 1.60 stg/dlr and the minimum number ofwarrants exercisable or tradeable is 100.    Exercise period for the warrants will run from April 22,1987 until March 17, 1989. Payment is due April 15, 1987. REUTER&#3;
reut2-006.sgm, BUNDESBANK WILL NOT HOLD PRESS CONFERENCE TOMORROW, The Bundesbank will not hold a pressconference after its regular fortnightly council meetingtomorrow, a spokeswoman said in answer to enquiries.    Bundesbank President Karl Otto Poehl will chair themeeting.    The next meeting is scheduled for April 2. REUTER&#3;
reut2-006.sgm, GREAT ATLANTIC AND PACIFIC TEA CO &lt;GAP> 4TH QTR, Oper shr 55 cts vs 36 cts    Oper net 20.7 mln vs 13.6 mln    Sales 2.34 billion vs 1.58 billion    Avg shrs 38.1 mln vs 37.7 mln    Year    Oper shr 1.82 dlrs vs 1.48 dlrs    Oper net 69.0 mln vs 56.1 mln    Sales 7.83 billion vs 6.62 billion    Avg shrs 38.0 mln vs 37.8 mln    NOTES: Results for 13 and 53 week periods ended Feb 28,1987, and 12 and 52 week periods ended Feb 22, 1986    Operating net excludes credits from tax loss carryforwardsof none vs 5.3 mln dlrs, or 14 cts a share in quarter and 26.0mln dlrs, or 68 cts a share, vs 32.2 mln dlrs, or 85 cts ashare, in year    Company had 1,200 stores inoperation at year end vs 1,045 ayear earlier Reuter&#3;
reut2-006.sgm, FRENCH FINANCE GROUP SDR ISSUES DOMESTIC BOND, French regional financing group &lt;Societesde Developpement Regional> is issuing a 1.41 billion francdomestic bond, Banque Nationale de Paris and &lt;Banque Indosuez>said.    The issue will be in three tranches with BNP being thebook-keeper for a 770 mln franc, 15-year, 9.10 pct fixed ratetranche issued at par. Redemption will be in seven equaltranches after the eighth year and payment date is April 6.    The banks said Indosuez will be the book-keeper for twonon-syndicated variable-rate, eight years and 20 day tranchesof 320 mln francs, each issued at par.    Interest will be based on the annual money market rate(TAM) with a TAM reference rate of 8.10 pct and with a marginof minus 0.10 pct. It will be payable on April 26 every yearfrom 1988 and onwards.    Redemption is to be in six equal tranches after two years. REUTER&#3;
reut2-006.sgm, GROUP TENDERING FOR GENCORP SAYS IT HOLDS ABOUT 9.8 PCT OF GENCORP COMMON, 
reut2-006.sgm, ROTTERDAM SIGNS COOPERATION AGREEMENT WITH TOKYO, The city of Rotterdam today signed anagreement in principle to cooperate with the AOMI CargoDistribution Centre in Tokyo.    Acting Mayor Roel den Dunnen said that cooperation betweenprivate and public entities in the Tokyo and Rotterdam area,and a fruitful exchange of information have a favourableinfluence on the flow of goods and services between the twocountries.    The AOMI Cargo Distribution Center, which will startoperating in October this year, signed a similar agreement withRotterdam's twinned-port of Seattle last September. Reuter&#3;
reut2-006.sgm, DAVY CORP UNIT WINS INDIA SMELTER CONTRACT, Davy McKee Ltd, a subsidiary of U.K.Engineering and contruction company Davy Corp Plc, has beenawarded a contract worth around 15 mln stg for the design of azinc and lead smelter in India, a spokesman for the companysaid.    The contract is being funded by Britain's OverseasDevelopment Administration as part of a total grant of 73.65mln stg to India's state-owned Hindustan Zinc Ltd.    The grant is for the development of a major zinc and leadmine and associated smelting complex in Rajastan, North WestIndia, the agency said.    The agency said the project was expected to account for 44pct of India's total production of zinc.    A total 55 mln stg of the grant is allocated for the supplyof goods and services from Britain. The grant comes as part ofpackage announced on March 13 for Indian mineral development.    The agency is also paying a further 31 mln stg to India'scoal sector, for the expansion of its indigenous coaldevelopment programme, using British-designed longwalltechnology. Reuter&#3;
reut2-006.sgm, U.K. MONEY MARKET GIVEN 15 MLN STG AFTERNOON HELP, The Bank of England said it had providedthe money market with a further 15 mln stg assistance. Thisbrings the Bank's total help so far today to 344 mln stg andcompares with the estimated shortage of around 1.3 billion stg.    The central bank purchased bank bills outright, at thelower dealing rates established this morning, comprising onemln stg in band one at 9-7/8 pct and 14 mln stg in band two at9-13/16 pct. REUTER&#3;
reut2-006.sgm, WEST GERMAN BANKS SLOWLY CUTTING KEY SAVINGS RATES, West German commercial banks arecautiously cutting key savings and lending rates, bankingsources said. The cuts follow nearly two months after theBundesbank reduced leading interest rates, far longer than theusual interim period.    A Deutsche Bank AG &lt;DBKG.F> spokesman said it is cuttingleading savings rate for private customers on a regional basisby 0.5 percentage points to two pct. Dresdner Bank AG &lt;DRSD.F>and Commerzbank AG &lt;CBKG.F> have initiated similar moves. Bankfuer Gemeinwirtschaft AG &lt;BKFG.F> cut rates 0.5 pct generally.    The delay was partly due to commercial banks' desire togauge customer reaction to a similar move by regional savingsbanks.    A fall in customer savings because of lower rates couldreduce cheap refinancing available to banks, forcing them todraw down relatively expensive funds from other sources, oneeconomist at the German Banking Association said.    But the volume of savings funds may not be substantiallyundercut by lower savings rates because many customers areparking funds in savings accounts in the hope they can reinvestthem at higher yields in the future, he said.    He said this may conflict with Bundesbank aims to move morefunds from relatively short-term deposits to longer-datedsecurities to reduce strong growth in its central bank moneysupply aggregate.    The aggregate showed annualized growth of a provisional 7.5pct in February against the fourth quarter of last year,unchanged from January. The growth rate was outside theexpanded target range of three to six pct.    Few banks have so far reduced lending rates to privatecustomers, though lending rates for corporate customers arebeginning to decline. REUTER&#3;
reut2-006.sgm, TOYS "R" US INC &lt;TOY> 4TH QTR FEB ONE NET, Shr 89 cts vs 68 cts    Net 116.0 mln vs 88.1 mln    Revs 1.17 billion vs 924.0 mln    12 mths    Shr 1.17 dlrs vs 93 cts    Net 152.2 mln vs 119.8 mln    Revs 2.44 billion vs 1.97 billion    NOTE: net 1986 were restated to reflect three-for-two stocksplit on June 27, 1986. Reuter&#3;
reut2-006.sgm, MEASUREX CORP &lt;MX> 1ST QTR NET, Shr 34 cts vs 27 cts    Qtrly div six cts vs 4.5 cts prior    Net 6,448,000 vs 4,969,000    Revs 51.1 mln vs 44.7 mln    Avg shrs 19.1 mln vs 18.7 mln    NOTE: pay for dividend was March 11 to shareholders ofrecord on Feb 20. Reuter&#3;
reut2-006.sgm, PALMER LEWIS CO INC &lt;LWIS> 4TH QTR NET, Qtr ends Jan 31    Shr three cts vs one cent    Qtrly div seven cts vs seven cts prior    Net 106,185 vs 28,871    Revs 46.9 mln vs 30.3 mln    12 mths    Shr 33 cts vs 23 cts    Net 1,306,595 vs 878,484    Revs 187.2 mln vs 140.8 mln    NOTE: effective July One, 1986, the company acquired theoutstanding stock of Western American Forest Product Inc forcash and convertible debentures. the acqustion is accounted foras a purchase and consolidated statements include Western'sresults of operations from July One, 1986.    payout for dividend is may six to stockholders of record onApril 13. Reuter&#3;
reut2-006.sgm, CAPITAL CITIES/ABC &lt;CCB> SETS PAYOUT, Qtrly div five cts vs five cts    Pay April 20    Record March 30&#3;
